shop,userid,userinfo,rating,date,photos,username,language,text
chef-icon-nature-bakery-singapore,iqPpCHOIN36YtI3Plh7aIw,"{'link': '/user_details?userid=iqPpCHOIN36YtI3Plh7aIw', 'src': 'https://s3-media0.fl.yelpcdn.com/photo/gIs49iia8f8MtDfyAStj8A/60s.jpg', 'srcSet': 'https://s3-media0.fl.yelpcdn.com/photo/gIs49iia8f8MtDfyAStj8A/ms.jpg 1.67x,https://s3-media0.fl.yelpcdn.com/photo/gIs49iia8f8MtDfyAStj8A/120s.jpg 2.00x,https://s3-media0.fl.yelpcdn.com/photo/gIs49iia8f8MtDfyAStj8A/90s.jpg 1.50x,https://s3-media0.fl.yelpcdn.com/photo/gIs49iia8f8MtDfyAStj8A/168s.jpg 2.80x,https://s3-media0.fl.yelpcdn.com/photo/gIs49iia8f8MtDfyAStj8A/180s.jpg 3.00x', 'markupDisplayName': 'Boon T.', 'displayLocation': 'Singapore, Singapore', 'altText': 'Boon T.', 'userUrl': '/user_details?userid=iqPpCHOIN36YtI3Plh7aIw', 'partnerAlias': None, 'friendCount': 80, 'photoCount': 873, 'reviewCount': 38, 'eliteYear': None}",5,10/17/2012,"[{'src': 'https://s3-media0.fl.yelpcdn.com/bphoto/PMiZELJyFLd5mnMBVJxZuA/300s.jpg', 'link': '/biz_photos/chef-icon-nature-bakery-singapore?reviewid=Rqk7ZaoFX1aWgciyCJrqpA&amp;select=PMiZELJyFLd5mnMBVJxZuA', 'altText': 'Photo of Chef Icon Nature Bakery - Singapore, Singapore. Yakiniku Style Mushroom Clubman', 'width': 300, 'height': 300, 'caption': 'Yakiniku Style Mushroom Clubman'}]",Boon T.,en,"Chef icon nature bakery is one of those place that no one knows about, but once you have had their signature cakes. you will want to know where it is.<br&gt;<br&gt;their 2 signature cakes are Chocolate Trovana &amp;amp; new york cheese cake, and they are only available in whole cakes (500g, 1kg, Choco Trovana also comes in 2kg) and you gotta order them 2 to 3 days in advance. <br&gt;<br&gt;Francis also makes a whole list of stuff, baked goods, cakes (yes there are cakes available in slices), kaya, peanut butter with the same principles: Best natural ingredients, no preservatives, with lots of passion and love.<br&gt;<br&gt;Drop by, get a clubman sandwich. and a flat white. (i know the duxton/ everton road area is full of gourmet coffeeshops, but he does a good cuppa too)<br&gt;<br&gt;Closed on Sunday and Public Holidays."
chef-icon-nature-bakery-singapore,RACaZuc0YD9jRPAtaust5g,"{'link': '/user_details?userid=RACaZuc0YD9jRPAtaust5g', 'src': 'https://s3-media0.fl.yelpcdn.com/photo/3og3g2d1OVY6BWm2MbpSIg/60s.jpg', 'srcSet': 'https://s3-media0.fl.yelpcdn.com/photo/3og3g2d1OVY6BWm2MbpSIg/ms.jpg 1.67x,https://s3-media0.fl.yelpcdn.com/photo/3og3g2d1OVY6BWm2MbpSIg/120s.jpg 2.00x,https://s3-media0.fl.yelpcdn.com/photo/3og3g2d1OVY6BWm2MbpSIg/90s.jpg 1.50x,https://s3-media0.fl.yelpcdn.com/photo/3og3g2d1OVY6BWm2MbpSIg/168s.jpg 2.80x,https://s3-media0.fl.yelpcdn.com/photo/3og3g2d1OVY6BWm2MbpSIg/180s.jpg 3.00x', 'markupDisplayName': 'Clarissa L.', 'displayLocation': 'Basel, Switzerland', 'altText': 'Clarissa L.', 'userUrl': '/user_details?userid=RACaZuc0YD9jRPAtaust5g', 'partnerAlias': None, 'friendCount': 92, 'photoCount': 332, 'reviewCount': 303, 'eliteYear': None}",4,7/15/2013,[],Clarissa L.,en,"Delicious! Clubman sandwiches are SO GOOD. Maybe I was just hungry, but it was deliciously toasted, thin bread, chockful of veggies :) Nice ham and cheese (mozzarella and somewhat else that I&amp;#39;ve forgotten) - this was the Mexican dream. ($8.80 I think)<br&gt;<br&gt;Hokkaido roll was nice and soft, with a huge dollop of cream in the middle. Shared a matcha one with red bean cream, liked that there were whole pieces of red bean! yay. Apparently the matcha is from Korea or something, I forget.<br&gt;<br&gt;Decided to try the guava tea on a whim, $4.90 for a hot cup, I believe. Very fragrant!<br&gt;<br&gt;They clearly take pride in providing quality ingredients (which shows in their prices too, haha). Guy at the counter was very friendly and didn&amp;#39;t mind us moving two tables together (although it clearly states NOT to) since it was nearing closing time..<br&gt;<br&gt;Wish it was in a more convenient place for me to visit more often! Was very tempted by their Sakura bread (dark choc and banana bread) but at $2.90... had to think twice. Ah well."
chef-icon-nature-bakery-singapore,uAFRWzUiacIqHzHT5wfLGQ,"{'link': '/user_details?userid=uAFRWzUiacIqHzHT5wfLGQ', 'src': 'https://s3-media0.fl.yelpcdn.com/photo/0wOPaE6MoqHSXLKbEI-36g/60s.jpg', 'srcSet': 'https://s3-media0.fl.yelpcdn.com/photo/0wOPaE6MoqHSXLKbEI-36g/ms.jpg 1.67x,https://s3-media0.fl.yelpcdn.com/photo/0wOPaE6MoqHSXLKbEI-36g/120s.jpg 2.00x,https://s3-media0.fl.yelpcdn.com/photo/0wOPaE6MoqHSXLKbEI-36g/90s.jpg 1.50x,https://s3-media0.fl.yelpcdn.com/photo/0wOPaE6MoqHSXLKbEI-36g/168s.jpg 2.80x,https://s3-media0.fl.yelpcdn.com/photo/0wOPaE6MoqHSXLKbEI-36g/180s.jpg 3.00x', 'markupDisplayName': 'Jason P.', 'displayLocation': 'Ewa Beach, HI', 'altText': 'Jason P.', 'userUrl': '/user_details?userid=uAFRWzUiacIqHzHT5wfLGQ', 'partnerAlias': None, 'friendCount': 273, 'photoCount': 142, 'reviewCount': 57, 'eliteYear': None}",5,9/16/2015,[],Jason P.,en,"Delicious food. I don&amp;#39;t know much about bread but whatever they are doing here, the bread tastes 100 times better than Subway Sandwich. The food here is amazing and light enough so you can still function. The coffee comes in one size...and it&amp;#39;s pretty small but I guess coming from the states, where everything is big, small coffee is just a part if the Singapore culture of efficiency. If u r nearby or staying in one of the condos...def try this place out. The owner is super passionate and will spend a few minutes talking about his delicious creations"
chef-icon-nature-bakery-singapore,2WM3DmJG-wUrndxkMVtRsQ,"{'link': '/user_details?userid=2WM3DmJG-wUrndxkMVtRsQ', 'src': 'https://s3-media0.fl.yelpcdn.com/photo/wTFNgVbjd8Mm9SieD9XweQ/60s.jpg', 'srcSet': 'https://s3-media0.fl.yelpcdn.com/photo/wTFNgVbjd8Mm9SieD9XweQ/ms.jpg 1.67x,https://s3-media0.fl.yelpcdn.com/photo/wTFNgVbjd8Mm9SieD9XweQ/120s.jpg 2.00x,https://s3-media0.fl.yelpcdn.com/photo/wTFNgVbjd8Mm9SieD9XweQ/90s.jpg 1.50x,https://s3-media0.fl.yelpcdn.com/photo/wTFNgVbjd8Mm9SieD9XweQ/168s.jpg 2.80x,https://s3-media0.fl.yelpcdn.com/photo/wTFNgVbjd8Mm9SieD9XweQ/180s.jpg 3.00x', 'markupDisplayName': 'J L.', 'displayLocation': 'Singapore, Singapore', 'altText': 'J L.', 'userUrl': '/user_details?userid=2WM3DmJG-wUrndxkMVtRsQ', 'partnerAlias': None, 'friendCount': 0, 'photoCount': 1, 'reviewCount': 6, 'eliteYear': None}",3,10/24/2013,[],J L.,en,"Tried coffee after lunch. Standard quality, consider not expensive. Cakes look nice, will leave to next trial. Custom service need improvement, it is probably previaling issue in Singapore hospitality industry."
chef-icon-nature-bakery-singapore,M-g5Bj0yyeBWFdgLiBKThQ,"{'link': '/user_details?userid=M-g5Bj0yyeBWFdgLiBKThQ', 'src': 'https://s3-media0.fl.yelpcdn.com/photo/cwIptd3QDIEslbQrzE0n3w/60s.jpg', 'srcSet': 'https://s3-media0.fl.yelpcdn.com/photo/cwIptd3QDIEslbQrzE0n3w/ms.jpg 1.67x,https://s3-media0.fl.yelpcdn.com/photo/cwIptd3QDIEslbQrzE0n3w/120s.jpg 2.00x,https://s3-media0.fl.yelpcdn.com/photo/cwIptd3QDIEslbQrzE0n3w/90s.jpg 1.50x,https://s3-media0.fl.yelpcdn.com/photo/cwIptd3QDIEslbQrzE0n3w/168s.jpg 2.80x,https://s3-media0.fl.yelpcdn.com/photo/cwIptd3QDIEslbQrzE0n3w/180s.jpg 3.00x', 'markupDisplayName': 'Laurinda W.', 'displayLocation': 'Singapore, Singapore', 'altText': 'Laurinda W.', 'userUrl': '/user_details?userid=M-g5Bj0yyeBWFdgLiBKThQ', 'partnerAlias': None, 'friendCount': 1, 'photoCount': 5, 'reviewCount': 3, 'eliteYear': None}",5,10/16/2012,"[{'src': 'https://s3-media0.fl.yelpcdn.com/bphoto/1g0npaLzVqpoBmeMZcAL9Q/180s.jpg', 'link': '/biz_photos/chef-icon-nature-bakery-singapore?reviewid=E51JwWRc0XjAABuBcq4KeQ&amp;select=1g0npaLzVqpoBmeMZcAL9Q', 'altText': 'Photo of Chef Icon Nature Bakery - Singapore, Singapore. In the Cafe/Bakery', 'width': 180, 'height': 180, 'caption': 'In the Cafe/Bakery'}, {'src': 'https://s3-media0.fl.yelpcdn.com/bphoto/nB-BH0wF_VnTXikBOuxdGg/180s.jpg', 'link': '/biz_photos/chef-icon-nature-bakery-singapore?reviewid=E51JwWRc0XjAABuBcq4KeQ&amp;select=nB-BH0wF_VnTXikBOuxdGg', 'altText': 'Photo of Chef Icon Nature Bakery - Singapore, Singapore. Hokkaido Roll (Belgian Chocolate)', 'width': 180, 'height': 180, 'caption': 'Hokkaido Roll (Belgian Chocolate)'}, {'src': 'https://s3-media0.fl.yelpcdn.com/bphoto/7u-juGgxPSpRLzrGmstvNA/180s.jpg', 'link': '/biz_photos/chef-icon-nature-bakery-singapore?reviewid=E51JwWRc0XjAABuBcq4KeQ&amp;select=7u-juGgxPSpRLzrGmstvNA', 'altText': 'Photo of Chef Icon Nature Bakery - Singapore, Singapore. Spiling the filling', 'width': 180, 'height': 180, 'caption': 'Spiling the filling'}, {'src': 'https://s3-media0.fl.yelpcdn.com/bphoto/Kju9eeApwBMBd7NxffGfUQ/180s.jpg', 'link': '/biz_photos/chef-icon-nature-bakery-singapore?reviewid=E51JwWRc0XjAABuBcq4KeQ&amp;select=Kju9eeApwBMBd7NxffGfUQ', 'altText': 'Photo of Chef Icon Nature Bakery - Singapore, Singapore. Yakiniku sandwich with Cafe Latte', 'width': 180, 'height': 180, 'caption': 'Yakiniku sandwich with Cafe Latte'}]",Laurinda W.,en,"Stumbled upon this find as Strangers&amp;#39; Reunion was closed on Tuesday. It is a really hidden gem in a stretch that&amp;#39;s overpopulated with little cafes. What I like about this cafe is that it is unpretentious, serves good, natural food in a very chill out setting. Unfortunately, there isn&amp;#39;t a big capacity for sit ins. 8 people would already be pushing it. I had coffee, the Hokkaido roll (chocolate &amp;amp; strawberry), the Yakiniku Sandwich in my visits there. Everything did not disappoint. The sandwich was fantastic! It was tasty, healthy with fresh greens and yummy yakiniku mushrooms all stuffed into a sesame bread. As for the Hokkaido roll, the sponge cake was moist yet light and fluffy but dense. How did he do it? The strawberry is good with the coffee while the chocolate (Belgian, no less!) was slightly sweeter and heavier on the palate. My colleague bought the Banana chocolate cake and it was heavenly! Moist yet rich with chocolate flavour, it blended really well with the banana as well. The owner, whom I spoke to, mentioned the food has no preservatives which means it also doesn&amp;#39;t sell any products with animal based ingredients. Have been there twice. Would definitely drop by when I&amp;#39;m in the neighbourhood. Love it!"
gong-cha-singapore-48,vDCCEp_bOJ6kcyxZOfkedQ,"{'link': '/user_details?userid=vDCCEp_bOJ6kcyxZOfkedQ', 'src': 'https://s3-media0.fl.yelpcdn.com/photo/9XDPlmL3xR0_R4v8Fd9e3Q/60s.jpg', 'srcSet': 'https://s3-media0.fl.yelpcdn.com/photo/9XDPlmL3xR0_R4v8Fd9e3Q/ms.jpg 1.67x,https://s3-media0.fl.yelpcdn.com/photo/9XDPlmL3xR0_R4v8Fd9e3Q/120s.jpg 2.00x,https://s3-media0.fl.yelpcdn.com/photo/9XDPlmL3xR0_R4v8Fd9e3Q/90s.jpg 1.50x,https://s3-media0.fl.yelpcdn.com/photo/9XDPlmL3xR0_R4v8Fd9e3Q/168s.jpg 2.80x,https://s3-media0.fl.yelpcdn.com/photo/9XDPlmL3xR0_R4v8Fd9e3Q/180s.jpg 3.00x', 'markupDisplayName': 'Marcus L.', 'displayLocation': 'Singapore, Singapore', 'altText': 'Marcus L.', 'userUrl': '/user_details?userid=vDCCEp_bOJ6kcyxZOfkedQ', 'partnerAlias': None, 'friendCount': 532, 'photoCount': 759, 'reviewCount': 361, 'eliteYear': None}",4,6/26/2013,"[{'src': 'https://s3-media0.fl.yelpcdn.com/bphoto/gZgeyC15LHpZb7KE2Y7snA/300s.jpg', 'link': '/biz_photos/gong-cha-singapore-48?reviewid=3yJPCOyew2Xyw0DE6OIJ4w&amp;select=gZgeyC15LHpZb7KE2Y7snA', 'altText': 'Photo of Gong cha - Singapore, Singapore', 'width': 300, 'height': 300, 'caption': None}]",Marcus L.,en,"I&amp;#39;m a little spoiled now, and won&amp;#39;t settle for a Coke any more - I need some bubble tea, and since these guys are everywhere now, it&amp;#39;s an easy choice. Also, because they&amp;#39;re everywhere now, the queues have vanished, which makes me a happy camper. One thing that makes me mad tho - Y U GET RID OF BROWN CRYSTAL JELLY?! That was my favourite, and now I have to pick for herbal jelly (chin chow, essentially) or regular pearls. First world problems, I&amp;#39;ll be the first to admit.<br&gt;<br&gt;These guys are a well-oiled machine, and you get your drink in the length it takes you to read this review... Okay read it a little slower."
gong-cha-singapore-48,NvVj9v3RvQRZuYwnkRjU2w,"{'link': '/user_details?userid=NvVj9v3RvQRZuYwnkRjU2w', 'src': 'https://s3-media0.fl.yelpcdn.com/photo/MR7kPbmI6XLi0_HjJo549w/60s.jpg', 'srcSet': 'https://s3-media0.fl.yelpcdn.com/photo/MR7kPbmI6XLi0_HjJo549w/ms.jpg 1.67x,https://s3-media0.fl.yelpcdn.com/photo/MR7kPbmI6XLi0_HjJo549w/120s.jpg 2.00x,https://s3-media0.fl.yelpcdn.com/photo/MR7kPbmI6XLi0_HjJo549w/90s.jpg 1.50x,https://s3-media0.fl.yelpcdn.com/photo/MR7kPbmI6XLi0_HjJo549w/168s.jpg 2.80x,https://s3-media0.fl.yelpcdn.com/photo/MR7kPbmI6XLi0_HjJo549w/180s.jpg 3.00x', 'markupDisplayName': 'Michael C.', 'displayLocation': 'Bellevue, WA', 'altText': 'Michael C.', 'userUrl': '/user_details?userid=NvVj9v3RvQRZuYwnkRjU2w', 'partnerAlias': None, 'friendCount': 49, 'photoCount': 231, 'reviewCount': 247, 'eliteYear': None}",4,9/11/2013,"[{'src': 'https://s3-media0.fl.yelpcdn.com/bphoto/56zgdipea_KUyNV8lugVHw/300s.jpg', 'link': '/biz_photos/gong-cha-singapore-48?reviewid=m76as5heZH59JVaN14-JOA&amp;select=56zgdipea_KUyNV8lugVHw', 'altText': 'Photo of Gong cha - Singapore, Singapore. Menu', 'width': 300, 'height': 300, 'caption': 'Menu'}]",Michael C.,en,Got the black plum tea with white pearls ($2.90) and caplis green tea with white pearls ($4.00).  Never had the white pearl jellys before and they were excellent.  Crunchy and chewy at the same time :).
ya-kun-kaya-toast-singapore-9,nBfNpAL3wCOc07gDXUtjnw,"{'link': '/user_details?userid=nBfNpAL3wCOc07gDXUtjnw', 'src': 'https://s3-media0.fl.yelpcdn.com/photo/SpVu5XkwKvLz5MELAMYViw/60s.jpg', 'srcSet': 'https://s3-media0.fl.yelpcdn.com/photo/SpVu5XkwKvLz5MELAMYViw/ms.jpg 1.67x,https://s3-media0.fl.yelpcdn.com/photo/SpVu5XkwKvLz5MELAMYViw/120s.jpg 2.00x,https://s3-media0.fl.yelpcdn.com/photo/SpVu5XkwKvLz5MELAMYViw/90s.jpg 1.50x,https://s3-media0.fl.yelpcdn.com/photo/SpVu5XkwKvLz5MELAMYViw/168s.jpg 2.80x,https://s3-media0.fl.yelpcdn.com/photo/SpVu5XkwKvLz5MELAMYViw/180s.jpg 3.00x', 'markupDisplayName': 'Ashley C.', 'displayLocation': 'Oakland, CA', 'altText': 'Ashley C.', 'userUrl': '/user_details?userid=nBfNpAL3wCOc07gDXUtjnw', 'partnerAlias': None, 'friendCount': 447, 'photoCount': 191, 'reviewCount': 227, 'eliteYear': 2022}",5,1/27/2020,[],Ashley C.,en,"This hit the spot and you can find many of them sprawled around Singapore. It was great for an afternoon tea/coffee break, while also substituting as a rest stop for some AC in the hot Singapore weather. <br&gt;<br&gt;I recommend the usual kaya toast with pandan and butter as well as a an iced coffee or kopi. It is made with condensed milk and not your usual iced coffee here, but it&amp;#39;s the right amount of sweetnedd without being overwhelming. This chain has been around for years and I can&amp;#39;t complain. I think the only thing that could make it better was more butter on the bread!"
ya-kun-kaya-toast-singapore-9,2HchhLgGj16aITZGVy0hqA,"{'link': '/user_details?userid=2HchhLgGj16aITZGVy0hqA', 'src': 'https://s3-media0.fl.yelpcdn.com/photo/onG0D73Fg9ZFON8vqM_Tmg/60s.jpg', 'srcSet': 'https://s3-media0.fl.yelpcdn.com/photo/onG0D73Fg9ZFON8vqM_Tmg/ms.jpg 1.67x,https://s3-media0.fl.yelpcdn.com/photo/onG0D73Fg9ZFON8vqM_Tmg/120s.jpg 2.00x,https://s3-media0.fl.yelpcdn.com/photo/onG0D73Fg9ZFON8vqM_Tmg/90s.jpg 1.50x,https://s3-media0.fl.yelpcdn.com/photo/onG0D73Fg9ZFON8vqM_Tmg/168s.jpg 2.80x,https://s3-media0.fl.yelpcdn.com/photo/onG0D73Fg9ZFON8vqM_Tmg/180s.jpg 3.00x', 'markupDisplayName': 'Yi Z.', 'displayLocation': 'Berkeley, CA', 'altText': 'Yi Z.', 'userUrl': '/user_details?userid=2HchhLgGj16aITZGVy0hqA', 'partnerAlias': None, 'friendCount': 861, 'photoCount': 1616, 'reviewCount': 3266, 'eliteYear': 2022}",4,5/3/2019,"[{'src': 'https://s3-media0.fl.yelpcdn.com/bphoto/IFD1MKjbPupQ_5PipG5W8A/300s.jpg', 'link': '/biz_photos/ya-kun-kaya-toast-singapore-9?reviewid=qGyBa6_AfO3F-KuoQa3TBw&amp;select=IFD1MKjbPupQ_5PipG5W8A', 'altText': 'Photo of Ya Kun Kaya Toast - Singapore, Singapore', 'width': 300, 'height': 300, 'caption': None}]",Yi Z.,en,"Ya Kun has dozens of outlets in Singapore but this is the original location. It was conveniently located near our hotel in Chinatown and was a great way to start the morning.<br&gt;<br&gt;It was his first time in Singapore and we shared one order of kaya toast, eggs, and tea. It was not a bad way to spend a few dollars."
ya-kun-kaya-toast-singapore-9,g3HFkZgloxLQCvoJ5Zs5gg,"{'link': '/user_details?userid=g3HFkZgloxLQCvoJ5Zs5gg', 'src': 'https://s3-media0.fl.yelpcdn.com/photo/ph3OjEWGpjWXr9Ha4nTc8g/60s.jpg', 'srcSet': 'https://s3-media0.fl.yelpcdn.com/photo/ph3OjEWGpjWXr9Ha4nTc8g/ms.jpg 1.67x,https://s3-media0.fl.yelpcdn.com/photo/ph3OjEWGpjWXr9Ha4nTc8g/120s.jpg 2.00x,https://s3-media0.fl.yelpcdn.com/photo/ph3OjEWGpjWXr9Ha4nTc8g/90s.jpg 1.50x,https://s3-media0.fl.yelpcdn.com/photo/ph3OjEWGpjWXr9Ha4nTc8g/168s.jpg 2.80x,https://s3-media0.fl.yelpcdn.com/photo/ph3OjEWGpjWXr9Ha4nTc8g/180s.jpg 3.00x', 'markupDisplayName': 'Jana C.', 'displayLocation': 'East Bay, CA', 'altText': 'Jana C.', 'userUrl': '/user_details?userid=g3HFkZgloxLQCvoJ5Zs5gg', 'partnerAlias': None, 'friendCount': 609, 'photoCount': 12997, 'reviewCount': 3173, 'eliteYear': 2022}",4,7/12/2017,"[{'src': 'https://s3-media0.fl.yelpcdn.com/bphoto/1tlkvgP6qkv97hFNPVM1Eg/300s.jpg', 'link': '/biz_photos/ya-kun-kaya-toast-singapore-9?reviewid=7FtqZOWIyiDd87y3wnOJaw&amp;select=1tlkvgP6qkv97hFNPVM1Eg', 'altText': 'Photo of Ya Kun Kaya Toast - Singapore, Singapore. Coco jam', 'width': 300, 'height': 300, 'caption': 'Coco jam'}]",Jana C.,en,"I wanted in on this kaya business, as I saw references to it everywhere. Asked my friend KM what it actually was. Just toast with Asiany brioche-like bread with a slather of coconut jam atop.<br&gt;<br&gt;Liked so much, I ordered it again at Terminal 1 in Changi, where there is also a little first floor kiosk!"
ya-kun-kaya-toast-singapore-9,9lU5zOPluc6Y8JZUL9nzsQ,"{'link': '/user_details?userid=9lU5zOPluc6Y8JZUL9nzsQ', 'src': 'https://s3-media0.fl.yelpcdn.com/photo/985Pg_pTfaJW6aLWG8mzyg/60s.jpg', 'srcSet': 'https://s3-media0.fl.yelpcdn.com/photo/985Pg_pTfaJW6aLWG8mzyg/ms.jpg 1.67x,https://s3-media0.fl.yelpcdn.com/photo/985Pg_pTfaJW6aLWG8mzyg/120s.jpg 2.00x,https://s3-media0.fl.yelpcdn.com/photo/985Pg_pTfaJW6aLWG8mzyg/90s.jpg 1.50x,https://s3-media0.fl.yelpcdn.com/photo/985Pg_pTfaJW6aLWG8mzyg/168s.jpg 2.80x,https://s3-media0.fl.yelpcdn.com/photo/985Pg_pTfaJW6aLWG8mzyg/180s.jpg 3.00x', 'markupDisplayName': 'Veronica C.', 'displayLocation': 'Cupertino, CA', 'altText': 'Veronica C.', 'userUrl': '/user_details?userid=9lU5zOPluc6Y8JZUL9nzsQ', 'partnerAlias': None, 'friendCount': 1183, 'photoCount': 5443, 'reviewCount': 853, 'eliteYear': None}",4,10/16/2018,"[{'src': 'https://s3-media0.fl.yelpcdn.com/bphoto/lbZ4VpInLWacQW_zQS0oGQ/300s.jpg', 'link': '/biz_photos/ya-kun-kaya-toast-singapore-9?reviewid=7cN5Z5hby45f8zehaolLow&amp;select=lbZ4VpInLWacQW_zQS0oGQ', 'altText': 'Photo of Ya Kun Kaya Toast - Singapore, Singapore. Durian kaya toast... *Love*', 'width': 300, 'height': 300, 'caption': 'Durian kaya toast... *Love*'}, {'src': 'https://s3-media0.fl.yelpcdn.com/bphoto/fNOOADhK7e8NGinyVfMifw/300s.jpg', 'link': '/biz_photos/ya-kun-kaya-toast-singapore-9?reviewid=7cN5Z5hby45f8zehaolLow&amp;select=fNOOADhK7e8NGinyVfMifw', 'altText': 'Photo of Ya Kun Kaya Toast - Singapore, Singapore. Chasu toast.', 'width': 300, 'height': 300, 'caption': 'Chasu toast.'}]",Veronica C.,en,"It&amp;#39;s hard to miss Ya Kun Kaya, they are everywhere in Singapore! <br&gt;<br&gt;This particular joint is located near Far East Square, a much bigger venue than the other Ya Kun Kaya outlets. Plus point that they are open at 7: 30 am, to have your early breakfast in solitude. Their menu is simple - it&amp;#39;s all about toast+ coffee/tea + soft boiled eggs, but those three things have served me well!<br&gt;<br&gt;I got the savory chasu toast and the durian kaya toast. The chasu toast was quite flavorful, but the DURIAN kaya toast won a sweet spot in my heart!!  Perfectly toasted crisp bread sandwiching the rich and creamy durian paste added with kaya and butter - delicious and they smell so good *sniff sniff* :P <br&gt;<br&gt;Service was not exactly friendly, but at least they are speedy and efficient. Overall, Ya Kun Kaya Toast is an awesome spot to get your quick breakfast fix. I&amp;#39;ll most definitely be back!"
ya-kun-kaya-toast-singapore-9,fFKhHqwhENswtBQQGGhB9A,"{'link': '/user_details?userid=fFKhHqwhENswtBQQGGhB9A', 'src': 'https://s3-media0.fl.yelpcdn.com/photo/yO6kIVeWoicRMo86SUUwDA/60s.jpg', 'srcSet': 'https://s3-media0.fl.yelpcdn.com/photo/yO6kIVeWoicRMo86SUUwDA/ms.jpg 1.67x,https://s3-media0.fl.yelpcdn.com/photo/yO6kIVeWoicRMo86SUUwDA/120s.jpg 2.00x,https://s3-media0.fl.yelpcdn.com/photo/yO6kIVeWoicRMo86SUUwDA/90s.jpg 1.50x,https://s3-media0.fl.yelpcdn.com/photo/yO6kIVeWoicRMo86SUUwDA/168s.jpg 2.80x,https://s3-media0.fl.yelpcdn.com/photo/yO6kIVeWoicRMo86SUUwDA/180s.jpg 3.00x', 'markupDisplayName': 'Rachel Y.', 'displayLocation': 'Torrance, CA', 'altText': 'Rachel Y.', 'userUrl': '/user_details?userid=fFKhHqwhENswtBQQGGhB9A', 'partnerAlias': None, 'friendCount': 1368, 'photoCount': 1018, 'reviewCount': 334, 'eliteYear': None}",3,10/26/2018,"[{'src': 'https://s3-media0.fl.yelpcdn.com/bphoto/y9i25F5YTTNqUFpuWpAnEQ/300s.jpg', 'link': '/biz_photos/ya-kun-kaya-toast-singapore-9?reviewid=H8orP8fAAIrwljD6HM0zxA&amp;select=y9i25F5YTTNqUFpuWpAnEQ', 'altText': 'Photo of Ya Kun Kaya Toast - Singapore, Singapore. Kaya original toast, peanut butter toast, &amp;amp; eggs!', 'width': 300, 'height': 300, 'caption': 'Kaya original toast, peanut butter toast, &amp; eggs!'}]",Rachel Y.,en,"Despite the many recommendations that came to us from friends to try this place when visiting Singapore, it had just an average impression on us. <br&gt;<br&gt;FOOD:<br&gt;- Kaya Toast +3.5/5<br&gt;It&amp;#39;s just toast with their famous spread &amp;amp; butter. While it is definitely unique, taste-wise it was just ok.<br&gt;- Soft boiled eggs +3.5/5<br&gt;I&amp;#39;m a HUGE fan of eggs and was excited for this but this also was just... ok. <br&gt;<br&gt;SERVICE:<br&gt;- is quick and fast. Be prepared to pay as soon as your food comes out - that&amp;#39;s just the way they roll here. <br&gt;<br&gt;While I would still recommend newcomers to Singapore to try this place when visiting, I would say it&amp;#39;s a one-time visit spot only."
ya-kun-kaya-toast-singapore-9,lUPSEbFRd3jDOM5agGnjWQ,"{'link': '/user_details?userid=lUPSEbFRd3jDOM5agGnjWQ', 'src': 'https://s3-media0.fl.yelpcdn.com/photo/bJj1XlSB5AfImruJ_DvXHQ/60s.jpg', 'srcSet': 'https://s3-media0.fl.yelpcdn.com/photo/bJj1XlSB5AfImruJ_DvXHQ/ms.jpg 1.67x,https://s3-media0.fl.yelpcdn.com/photo/bJj1XlSB5AfImruJ_DvXHQ/120s.jpg 2.00x,https://s3-media0.fl.yelpcdn.com/photo/bJj1XlSB5AfImruJ_DvXHQ/90s.jpg 1.50x,https://s3-media0.fl.yelpcdn.com/photo/bJj1XlSB5AfImruJ_DvXHQ/168s.jpg 2.80x,https://s3-media0.fl.yelpcdn.com/photo/bJj1XlSB5AfImruJ_DvXHQ/180s.jpg 3.00x', 'markupDisplayName': 'Jocelyn C.', 'displayLocation': 'San Antonio, TX', 'altText': 'Jocelyn C.', 'userUrl': '/user_details?userid=lUPSEbFRd3jDOM5agGnjWQ', 'partnerAlias': None, 'friendCount': 1048, 'photoCount': 416, 'reviewCount': 1304, 'eliteYear': 2022}",5,5/6/2016,"[{'src': 'https://s3-media0.fl.yelpcdn.com/bphoto/omQDcjH68uAsDfim89ghqw/300s.jpg', 'link': '/biz_photos/ya-kun-kaya-toast-singapore-9?reviewid=DP7040CWyVUfKXsBrps6ow&amp;select=omQDcjH68uAsDfim89ghqw', 'altText': 'Photo of Ya Kun Kaya Toast - Singapore, Singapore. Singaporean take on dessert for breakfast.', 'width': 300, 'height': 300, 'caption': 'Singaporean take on dessert for breakfast.'}]",Jocelyn C.,en,"Put down that nasty free hostel breakfast and go spend the $6 SGD on breakfast here. Gotta eat kaya toast when in Sing; it&amp;#39;s their version of dessert for breakfast. <br&gt;<br&gt;This is the orig, so skip all the makeup and go sweat it out at breakfast. The sweetened iced coffee is strong and delicious. Runny eggs you should mix a little with soy sauce and salt. Yum. <br&gt;<br&gt;As others suggested, bring wet wipes! Kaya will glue to your fingers, and Sing is a land of BYOT (tissue) wherever you go. <br&gt; <br&gt;Staff is so very friendly, but when the boss lady walks around to collect before you eat, better pay up quick!"
ya-kun-kaya-toast-singapore-9,HN-2o_s91nULyyIBa7x2Vg,"{'link': '/user_details?userid=HN-2o_s91nULyyIBa7x2Vg', 'src': 'https://s3-media0.fl.yelpcdn.com/photo/i6QAS7pdwQbACUXvMsL_hA/60s.jpg', 'srcSet': 'https://s3-media0.fl.yelpcdn.com/photo/i6QAS7pdwQbACUXvMsL_hA/ms.jpg 1.67x,https://s3-media0.fl.yelpcdn.com/photo/i6QAS7pdwQbACUXvMsL_hA/120s.jpg 2.00x,https://s3-media0.fl.yelpcdn.com/photo/i6QAS7pdwQbACUXvMsL_hA/90s.jpg 1.50x,https://s3-media0.fl.yelpcdn.com/photo/i6QAS7pdwQbACUXvMsL_hA/168s.jpg 2.80x,https://s3-media0.fl.yelpcdn.com/photo/i6QAS7pdwQbACUXvMsL_hA/180s.jpg 3.00x', 'markupDisplayName': 'Thomas N.', 'displayLocation': 'Austin, TX', 'altText': 'Thomas N.', 'userUrl': '/user_details?userid=HN-2o_s91nULyyIBa7x2Vg', 'partnerAlias': None, 'friendCount': 316, 'photoCount': 925, 'reviewCount': 135, 'eliteYear': 2022}",5,1/26/2018,"[{'src': 'https://s3-media0.fl.yelpcdn.com/bphoto/UQMWAliaJ7oKEwCf0tgo2w/300s.jpg', 'link': '/biz_photos/ya-kun-kaya-toast-singapore-9?reviewid=6HcuNcG-7Pux3faeLDpx4g&amp;select=UQMWAliaJ7oKEwCf0tgo2w', 'altText': 'Photo of Ya Kun Kaya Toast - Singapore, Singapore', 'width': 300, 'height': 300, 'caption': None}]",Thomas N.,en,"This review is for the coffee only. The black coffee with the condense milk has a very bold flavor, but is easy to drink. Wish this was available in the USA. So good!"
