shop,userid,userinfo,rating,date,photos,username,language,text
cafe-melba-singapore,4y4obgWxi_CL25nRHrhuEA,"{'link': '/user_details?userid=4y4obgWxi_CL25nRHrhuEA', 'src': 'https://s3-media0.fl.yelpcdn.com/photo/laRmHWBo3Kx_2nhLNthgUQ/60s.jpg', 'srcSet': 'https://s3-media0.fl.yelpcdn.com/photo/laRmHWBo3Kx_2nhLNthgUQ/ms.jpg 1.67x,https://s3-media0.fl.yelpcdn.com/photo/laRmHWBo3Kx_2nhLNthgUQ/120s.jpg 2.00x,https://s3-media0.fl.yelpcdn.com/photo/laRmHWBo3Kx_2nhLNthgUQ/90s.jpg 1.50x,https://s3-media0.fl.yelpcdn.com/photo/laRmHWBo3Kx_2nhLNthgUQ/168s.jpg 2.80x,https://s3-media0.fl.yelpcdn.com/photo/laRmHWBo3Kx_2nhLNthgUQ/180s.jpg 3.00x', 'markupDisplayName': 'Ancy N.', 'displayLocation': 'Singapore, Singapore', 'altText': 'Ancy N.', 'userUrl': '/user_details?userid=4y4obgWxi_CL25nRHrhuEA', 'partnerAlias': None, 'friendCount': 72, 'photoCount': 1986, 'reviewCount': 592, 'eliteYear': None}",4,9/23/2012,[],Ancy N.,en,"A surprising find.<br&gt;<br&gt;We were here on a Friday evening and it was surprisingly not crazy busy. Love the chill-out ambience. We were a big group and had no problem finding a table.<br&gt;<br&gt;We only had pizza and truffle fries. Pizza were super thin crust and great for sharing. Think skinny pizza. But if you&amp;#39;re a fan of neopolitan style like I am, then this is good but not great.<br&gt;<br&gt;Great relaxing place to hang out with friends. They seem to do great brunches. So maybe I will be back to try that next time."
cafe-melba-singapore,k0_Z5cdfaNC2F--70UzalQ,"{'link': '/user_details?userid=k0_Z5cdfaNC2F--70UzalQ', 'src': 'https://s3-media0.fl.yelpcdn.com/photo/u_XQ9Xmi__FwHMgYfiuZiw/60s.jpg', 'srcSet': 'https://s3-media0.fl.yelpcdn.com/photo/u_XQ9Xmi__FwHMgYfiuZiw/ms.jpg 1.67x,https://s3-media0.fl.yelpcdn.com/photo/u_XQ9Xmi__FwHMgYfiuZiw/120s.jpg 2.00x,https://s3-media0.fl.yelpcdn.com/photo/u_XQ9Xmi__FwHMgYfiuZiw/90s.jpg 1.50x,https://s3-media0.fl.yelpcdn.com/photo/u_XQ9Xmi__FwHMgYfiuZiw/168s.jpg 2.80x,https://s3-media0.fl.yelpcdn.com/photo/u_XQ9Xmi__FwHMgYfiuZiw/180s.jpg 3.00x', 'markupDisplayName': 'D K.', 'displayLocation': 'Singapore, Singapore', 'altText': 'D K.', 'userUrl': '/user_details?userid=k0_Z5cdfaNC2F--70UzalQ', 'partnerAlias': None, 'friendCount': 3, 'photoCount': 228, 'reviewCount': 223, 'eliteYear': None}",4,9/9/2012,[],D K.,en,"The brunch here is one of the better ones I&amp;#39;ve had in Singapore for the longest time. <br&gt;<br&gt;The ambience here is great and you can spot many other like minded individuals and families here having coffee and enjoying the food.<br&gt;<br&gt;It&amp;#39;s shaded from the sun, thanks to a large awning and there&amp;#39;s ample smoking area. the fans provide just the right amount of breeze should you choose to sit outside, or you can sit in air-conditioned comfort inside and watch the chefs prepare your meal, thanks to an open kitchen concept."
cafe-melba-singapore,9nWcII-Fqn5Hagfib-H76w,"{'link': '/user_details?userid=9nWcII-Fqn5Hagfib-H76w', 'src': 'https://s3-media0.fl.yelpcdn.com/photo/I5idtYNbji1Lh-CrEMlLyQ/60s.jpg', 'srcSet': 'https://s3-media0.fl.yelpcdn.com/photo/I5idtYNbji1Lh-CrEMlLyQ/ms.jpg 1.67x,https://s3-media0.fl.yelpcdn.com/photo/I5idtYNbji1Lh-CrEMlLyQ/120s.jpg 2.00x,https://s3-media0.fl.yelpcdn.com/photo/I5idtYNbji1Lh-CrEMlLyQ/90s.jpg 1.50x,https://s3-media0.fl.yelpcdn.com/photo/I5idtYNbji1Lh-CrEMlLyQ/168s.jpg 2.80x,https://s3-media0.fl.yelpcdn.com/photo/I5idtYNbji1Lh-CrEMlLyQ/180s.jpg 3.00x', 'markupDisplayName': 'Alexis C.', 'displayLocation': 'Singapore, Singapore', 'altText': 'Alexis C.', 'userUrl': '/user_details?userid=9nWcII-Fqn5Hagfib-H76w', 'partnerAlias': None, 'friendCount': 4, 'photoCount': 91, 'reviewCount': 90, 'eliteYear': None}",4,8/26/2012,[],Alexis C.,en,"Ambiance 100%<br&gt;<br&gt;This is the immediate impression when we stepped in to this charming cafe right in the middle of no where one rainy afternoon after lunch. It is so idyllic and very quiet when we were there. We absolutely adored the decor! It felt like someone&amp;#39;s open kitchen, filled with delicious things on the shelves.<br&gt;<br&gt;We only tried their coffees since we already had lunch, but seems like I need to go back again to try the food. I&amp;#39;m already sold on the ambiance, so the food won&amp;#39;t be a big problem. Now, how to get there without driving is the challenge..."
cafe-melba-singapore,jTZf5BolBcfli0cNch4V7Q,"{'link': '/user_details?userid=jTZf5BolBcfli0cNch4V7Q', 'src': 'https://s3-media0.fl.yelpcdn.com/photo/DVwBynugaIuR_FKYWLfpng/60s.jpg', 'srcSet': 'https://s3-media0.fl.yelpcdn.com/photo/DVwBynugaIuR_FKYWLfpng/ms.jpg 1.67x,https://s3-media0.fl.yelpcdn.com/photo/DVwBynugaIuR_FKYWLfpng/120s.jpg 2.00x,https://s3-media0.fl.yelpcdn.com/photo/DVwBynugaIuR_FKYWLfpng/90s.jpg 1.50x,https://s3-media0.fl.yelpcdn.com/photo/DVwBynugaIuR_FKYWLfpng/168s.jpg 2.80x,https://s3-media0.fl.yelpcdn.com/photo/DVwBynugaIuR_FKYWLfpng/180s.jpg 3.00x', 'markupDisplayName': 'Stephanie A.', 'displayLocation': 'Makati, Philippines', 'altText': 'Stephanie A.', 'userUrl': '/user_details?userid=jTZf5BolBcfli0cNch4V7Q', 'partnerAlias': None, 'friendCount': 40, 'photoCount': 197, 'reviewCount': 97, 'eliteYear': 2022}",3,11/23/2012,[],Stephanie A.,en,Nice place but the food is not good at all. Too bad for a place with such nice ambiance...
cafe-melba-singapore,znaofcTB6CKmdUqJSd17iA,"{'link': '/user_details?userid=znaofcTB6CKmdUqJSd17iA', 'src': 'https://s3-media0.fl.yelpcdn.com/photo/XAciovDp_YTENY5b8xoo2A/60s.jpg', 'srcSet': 'https://s3-media0.fl.yelpcdn.com/photo/XAciovDp_YTENY5b8xoo2A/ms.jpg 1.67x,https://s3-media0.fl.yelpcdn.com/photo/XAciovDp_YTENY5b8xoo2A/120s.jpg 2.00x,https://s3-media0.fl.yelpcdn.com/photo/XAciovDp_YTENY5b8xoo2A/90s.jpg 1.50x,https://s3-media0.fl.yelpcdn.com/photo/XAciovDp_YTENY5b8xoo2A/168s.jpg 2.80x,https://s3-media0.fl.yelpcdn.com/photo/XAciovDp_YTENY5b8xoo2A/180s.jpg 3.00x', 'markupDisplayName': 'Sonya C.', 'displayLocation': 'Singapore, Singapore', 'altText': 'Sonya C.', 'userUrl': '/user_details?userid=znaofcTB6CKmdUqJSd17iA', 'partnerAlias': None, 'friendCount': 89, 'photoCount': 303, 'reviewCount': 276, 'eliteYear': None}",2,7/4/2013,[],Sonya C.,en,"okayish australian brunch food hidden away in the goodman arts centre. this place has drawn mixed reviews since opening this year - and I&amp;#39;m about to toss my own undecided judgement into the mix, just so you have as difficult a time as I did of deciding if it&amp;#39;s worth visiting.<br&gt;<br&gt;on second thought, perhaps that&amp;#39;s not the best strategy for ingratiating myself into your favor. so here&amp;#39;s it straight up: this place has great potential, but the food and service are in firm not-travel-worthy-but-I&amp;#39;ll-have-it-if-it&amp;#39;s-there territory. or more succinctly, meh.<br&gt;<br&gt;I admit to wanting to come here for the longest time, despite those reviews: I had seen photos of the gorgeous space in design blogs, and there&amp;#39;s just something incredibly appealing about good lighting for photography.<br&gt;<br&gt;but the place doesn&amp;#39;t look nearly this good (one day I will learn to stop trusting photos) in the daytime - and there was this slight ramshackle shabbiness about it, like they hadn&amp;#39;t bothered to take care of what should be a well-curated space.<br&gt;<br&gt;the pizzas fared the best that day, hands down. we had the chili crab, mushroom and a trifecta of meat products on the three little pigs. these were well-cooked in a wood-fired oven, with a crust that verged between cracker and thin-crust (nothing nearly as flavorful as the famed mozza - but good in its way), and the ingredients were suitably piled on.<br&gt;<br&gt;the other dishes were less interesting: a burger was stacked high and pretty - and so were the pile of pancakes I ordered, which came in a healthy stack of four and drizzled with compote - and the full melba cooked breakfast was a generous plateful of food. but these suffered from bimboticism, having mastered the art of looking good without much substance.<br&gt;<br&gt;so really, if you&amp;#39;re here - head for the pizzas. the other stuff isn&amp;#39;t bad, and actually perhaps on par with some hipsterish cafes, but I don&amp;#39;t think it&amp;#39;s worth traveling for. there is just this pervading sense of unfulfilled potential rather perpetuated also by the sheer nothing-outstanding-ness of both service and food. much better food elsewhere, really."
cafe-melba-singapore,k0_Z5cdfaNC2F--70UzalQ,"{'link': '/user_details?userid=k0_Z5cdfaNC2F--70UzalQ', 'src': 'https://s3-media0.fl.yelpcdn.com/photo/u_XQ9Xmi__FwHMgYfiuZiw/60s.jpg', 'srcSet': 'https://s3-media0.fl.yelpcdn.com/photo/u_XQ9Xmi__FwHMgYfiuZiw/ms.jpg 1.67x,https://s3-media0.fl.yelpcdn.com/photo/u_XQ9Xmi__FwHMgYfiuZiw/120s.jpg 2.00x,https://s3-media0.fl.yelpcdn.com/photo/u_XQ9Xmi__FwHMgYfiuZiw/90s.jpg 1.50x,https://s3-media0.fl.yelpcdn.com/photo/u_XQ9Xmi__FwHMgYfiuZiw/168s.jpg 2.80x,https://s3-media0.fl.yelpcdn.com/photo/u_XQ9Xmi__FwHMgYfiuZiw/180s.jpg 3.00x', 'markupDisplayName': 'D K.', 'displayLocation': 'Singapore, Singapore', 'altText': 'D K.', 'userUrl': '/user_details?userid=k0_Z5cdfaNC2F--70UzalQ', 'partnerAlias': None, 'friendCount': 3, 'photoCount': 228, 'reviewCount': 223, 'eliteYear': None}",4,9/9/2012,[],D K.,en,"The brunch here is one of the better ones I&amp;#39;ve had in Singapore for the longest time. <br&gt;<br&gt;The ambience here is great and you can spot many other like minded individuals and families here having coffee and enjoying the food.<br&gt;<br&gt;It&amp;#39;s shaded from the sun, thanks to a large awning and there&amp;#39;s ample smoking area. the fans provide just the right amount of breeze should you choose to sit outside, or you can sit in air-conditioned comfort inside and watch the chefs prepare your meal, thanks to an open kitchen concept."
cafe-melba-singapore,9nWcII-Fqn5Hagfib-H76w,"{'link': '/user_details?userid=9nWcII-Fqn5Hagfib-H76w', 'src': 'https://s3-media0.fl.yelpcdn.com/photo/I5idtYNbji1Lh-CrEMlLyQ/60s.jpg', 'srcSet': 'https://s3-media0.fl.yelpcdn.com/photo/I5idtYNbji1Lh-CrEMlLyQ/ms.jpg 1.67x,https://s3-media0.fl.yelpcdn.com/photo/I5idtYNbji1Lh-CrEMlLyQ/120s.jpg 2.00x,https://s3-media0.fl.yelpcdn.com/photo/I5idtYNbji1Lh-CrEMlLyQ/90s.jpg 1.50x,https://s3-media0.fl.yelpcdn.com/photo/I5idtYNbji1Lh-CrEMlLyQ/168s.jpg 2.80x,https://s3-media0.fl.yelpcdn.com/photo/I5idtYNbji1Lh-CrEMlLyQ/180s.jpg 3.00x', 'markupDisplayName': 'Alexis C.', 'displayLocation': 'Singapore, Singapore', 'altText': 'Alexis C.', 'userUrl': '/user_details?userid=9nWcII-Fqn5Hagfib-H76w', 'partnerAlias': None, 'friendCount': 4, 'photoCount': 91, 'reviewCount': 90, 'eliteYear': None}",4,8/26/2012,[],Alexis C.,en,"Ambiance 100%<br&gt;<br&gt;This is the immediate impression when we stepped in to this charming cafe right in the middle of no where one rainy afternoon after lunch. It is so idyllic and very quiet when we were there. We absolutely adored the decor! It felt like someone&amp;#39;s open kitchen, filled with delicious things on the shelves.<br&gt;<br&gt;We only tried their coffees since we already had lunch, but seems like I need to go back again to try the food. I&amp;#39;m already sold on the ambiance, so the food won&amp;#39;t be a big problem. Now, how to get there without driving is the challenge..."
cafe-melba-singapore,wQ4iE0PQZy1FF1znVR40Yg,"{'link': '/user_details?userid=wQ4iE0PQZy1FF1znVR40Yg', 'src': 'https://s3-media0.fl.yelpcdn.com/photo/VHg_I7rCgCTHuEVgZqh95w/60s.jpg', 'srcSet': 'https://s3-media0.fl.yelpcdn.com/photo/VHg_I7rCgCTHuEVgZqh95w/ms.jpg 1.67x,https://s3-media0.fl.yelpcdn.com/photo/VHg_I7rCgCTHuEVgZqh95w/120s.jpg 2.00x,https://s3-media0.fl.yelpcdn.com/photo/VHg_I7rCgCTHuEVgZqh95w/90s.jpg 1.50x,https://s3-media0.fl.yelpcdn.com/photo/VHg_I7rCgCTHuEVgZqh95w/168s.jpg 2.80x,https://s3-media0.fl.yelpcdn.com/photo/VHg_I7rCgCTHuEVgZqh95w/180s.jpg 3.00x', 'markupDisplayName': 'Tian D.', 'displayLocation': 'Singapore, Singapore', 'altText': 'Tian D.', 'userUrl': '/user_details?userid=wQ4iE0PQZy1FF1znVR40Yg', 'partnerAlias': None, 'friendCount': 3, 'photoCount': 177, 'reviewCount': 95, 'eliteYear': None}",4,8/7/2012,"[{'src': 'https://s3-media0.fl.yelpcdn.com/bphoto/LtZ0ao1Ebcd3OP0r-XJikQ/180s.jpg', 'link': '/biz_photos/cafe-melba-singapore?reviewid=xmZ5vwiQRfvKnwWt1Gg-1g&amp;select=LtZ0ao1Ebcd3OP0r-XJikQ', 'altText': 'Photo of Cafe Melba - Singapore, Singapore. Rib eye sandwich', 'width': 180, 'height': 180, 'caption': 'Rib eye sandwich'}, {'src': 'https://s3-media0.fl.yelpcdn.com/bphoto/tRNVczvqBDfT3De0k-rJrw/180s.jpg', 'link': '/biz_photos/cafe-melba-singapore?reviewid=xmZ5vwiQRfvKnwWt1Gg-1g&amp;select=tRNVczvqBDfT3De0k-rJrw', 'altText': 'Photo of Cafe Melba - Singapore, Singapore. Restaurant front', 'width': 180, 'height': 180, 'caption': 'Restaurant front'}, {'src': 'https://s3-media0.fl.yelpcdn.com/bphoto/i5GPReOPYav2z4yrHIdJeA/180s.jpg', 'link': '/biz_photos/cafe-melba-singapore?reviewid=xmZ5vwiQRfvKnwWt1Gg-1g&amp;select=i5GPReOPYav2z4yrHIdJeA', 'altText': 'Photo of Cafe Melba - Singapore, Singapore. Melba burger with rocket salad', 'width': 180, 'height': 180, 'caption': 'Melba burger with rocket salad'}, {'src': 'https://s3-media0.fl.yelpcdn.com/bphoto/IWOdl-VNVS8shyJzjnj6yA/180s.jpg', 'link': '/biz_photos/cafe-melba-singapore?reviewid=xmZ5vwiQRfvKnwWt1Gg-1g&amp;select=IWOdl-VNVS8shyJzjnj6yA', 'altText': 'Photo of Cafe Melba - Singapore, Singapore. Coffee :)', 'width': 180, 'height': 180, 'caption': 'Coffee :)'}]",Tian D.,en,"I&amp;#39;ve been eagerly anticipating cafe melba&amp;#39;s opening, and I was not disappointed. The coffee here is the best in the east side of town and is pretty near my place. Happiness!<br&gt;<br&gt;I prefer ordering a piccolo as its stronger and more aromatic. The glasses for the latte are a little big, so the coffee gets quite weak and diluted. <br&gt;<br&gt;I&amp;#39;ve got to say, the service here is pretty good! The waitresses seemed a little hesitant and inexperienced, but yet were friendly and polite.<br&gt;<br&gt;Also, when I asked about the latte tasting weak, the barista came over and recommended the piccolo. After that I noticed they only charged me for my first order. When I brought this up, they said the piccolo was on the house as I was unsatisfied with the latte. :)<br&gt;<br&gt;The food here is of good quality! Ive tried the breakfast menu and was very satisfied with the eggs Benedict and big breakfast. Prices are a little steep but take advantage of the promotions on at the moment!<br&gt;<br&gt;Weekday mains charged at 25% off, while on weekends, you get a free coffee when you order a brunch main before 4pm! Not sure when the promo ends but i was just there last week and it was still on!<br&gt;<br&gt;The rib eye sandwich and chicken pesto sandwich were both lovely, nestled inside very yummy bread. However the buns for the Melba burger were a bit too doughy for me, though the ingredients inside we&amp;#39;re fresh and the beef patty was cooked to a perfect medium rare juicy delight.<br&gt;<br&gt;Great ambience and it&amp;#39;s great for families as there&amp;#39;s a large field out front, and I&amp;#39;ve seen an inflatable bouncy castle on weekends!"
cafe-melba-singapore,T9aL7kkxRYJVkysnFPQefA,"{'link': '/user_details?userid=T9aL7kkxRYJVkysnFPQefA', 'src': 'https://s3-media0.fl.yelpcdn.com/photo/swLzt1unos9sr2VC_fVclw/60s.jpg', 'srcSet': 'https://s3-media0.fl.yelpcdn.com/photo/swLzt1unos9sr2VC_fVclw/ms.jpg 1.67x,https://s3-media0.fl.yelpcdn.com/photo/swLzt1unos9sr2VC_fVclw/120s.jpg 2.00x,https://s3-media0.fl.yelpcdn.com/photo/swLzt1unos9sr2VC_fVclw/90s.jpg 1.50x,https://s3-media0.fl.yelpcdn.com/photo/swLzt1unos9sr2VC_fVclw/168s.jpg 2.80x,https://s3-media0.fl.yelpcdn.com/photo/swLzt1unos9sr2VC_fVclw/180s.jpg 3.00x', 'markupDisplayName': 'Rupak G.', 'displayLocation': 'Singapore, Singapore', 'altText': 'Rupak G.', 'userUrl': '/user_details?userid=T9aL7kkxRYJVkysnFPQefA', 'partnerAlias': None, 'friendCount': 0, 'photoCount': 49, 'reviewCount': 46, 'eliteYear': None}",4,7/16/2012,"[{'src': 'https://s3-media0.fl.yelpcdn.com/bphoto/1X_doel51kJjkj8CE37aLg/300s.jpg', 'link': '/biz_photos/cafe-melba-singapore?reviewid=f1o7Tzc0MymDus41KkbYRA&amp;select=1X_doel51kJjkj8CE37aLg', 'altText': 'Photo of Cafe Melba - Singapore, Singapore', 'width': 300, 'height': 300, 'caption': ''}]",Rupak G.,en,"I am currently in the midst of preparing to record an album at the Goodman arts centre and there aren&amp;#39;t too many options for food in the centre. However i did manage to try a bit of food at Cafe Melba. I had what can be described as a type of pizza basket. It&amp;#39;s clean slices of flour and dough with some meat, vegetable and cheese toppings on it. These pizzas are extremely thin and you may eat them with a choice of 3 sauces that are given to you - pesto, olive and chick peas sauce. The price range is a bit high. The quality of service is pretty good. And the ambience is the best part of the place. They have a very cool outdoor space seating area with wooden benches and tables. They also have pretty excellent coffee. It&amp;#39;s a chillout sunday sort of a place for me."
cafe-melba-singapore,KIcZfbtAEHNoWqre4yHcPw,"{'link': '/user_details?userid=KIcZfbtAEHNoWqre4yHcPw', 'src': 'https://s3-media0.fl.yelpcdn.com/photo/xYjDIRL18EmWhepb51i1DQ/60s.jpg', 'srcSet': 'https://s3-media0.fl.yelpcdn.com/photo/xYjDIRL18EmWhepb51i1DQ/ms.jpg 1.67x,https://s3-media0.fl.yelpcdn.com/photo/xYjDIRL18EmWhepb51i1DQ/120s.jpg 2.00x,https://s3-media0.fl.yelpcdn.com/photo/xYjDIRL18EmWhepb51i1DQ/90s.jpg 1.50x,https://s3-media0.fl.yelpcdn.com/photo/xYjDIRL18EmWhepb51i1DQ/168s.jpg 2.80x,https://s3-media0.fl.yelpcdn.com/photo/xYjDIRL18EmWhepb51i1DQ/180s.jpg 3.00x', 'markupDisplayName': 'Jac S.', 'displayLocation': 'Singapore, Singapore', 'altText': 'Jac S.', 'userUrl': '/user_details?userid=KIcZfbtAEHNoWqre4yHcPw', 'partnerAlias': None, 'friendCount': 30, 'photoCount': 400, 'reviewCount': 312, 'eliteYear': None}",4,7/10/2012,"[{'src': 'https://s3-media0.fl.yelpcdn.com/bphoto/JX2TDtT1plbrvd2he8eoRQ/180s.jpg', 'link': '/biz_photos/cafe-melba-singapore?reviewid=cwNWEpgL2uCfu-SEzwMRUQ&amp;select=JX2TDtT1plbrvd2he8eoRQ', 'altText': 'Photo of Cafe Melba - Singapore, Singapore. Green view from inside Cafe Melba', 'width': 180, 'height': 180, 'caption': 'Green view from inside Cafe Melba'}, {'src': 'https://s3-media0.fl.yelpcdn.com/bphoto/24znbiANRjT8Psky6Xvk6w/180s.jpg', 'link': '/biz_photos/cafe-melba-singapore?reviewid=cwNWEpgL2uCfu-SEzwMRUQ&amp;select=24znbiANRjT8Psky6Xvk6w', 'altText': 'Photo of Cafe Melba - Singapore, Singapore. Wood Fire Ovens for firing pizzas', 'width': 180, 'height': 180, 'caption': 'Wood Fire Ovens for firing pizzas'}, {'src': 'https://s3-media0.fl.yelpcdn.com/bphoto/Hg--mJogWT0wnxns45oyLQ/180s.jpg', 'link': '/biz_photos/cafe-melba-singapore?reviewid=cwNWEpgL2uCfu-SEzwMRUQ&amp;select=Hg--mJogWT0wnxns45oyLQ', 'altText': 'Photo of Cafe Melba - Singapore, Singapore. Delicious Dark Chocolate Fudge Cake with berries and cream', 'width': 180, 'height': 180, 'caption': 'Delicious Dark Chocolate Fudge Cake with berries and cream'}, {'src': 'https://s3-media0.fl.yelpcdn.com/bphoto/gAa8FZoQB5F9GK08RVgBGw/180s.jpg', 'link': '/biz_photos/cafe-melba-singapore?reviewid=cwNWEpgL2uCfu-SEzwMRUQ&amp;select=gAa8FZoQB5F9GK08RVgBGw', 'altText': 'Photo of Cafe Melba - Singapore, Singapore. Table Setting', 'width': 180, 'height': 180, 'caption': 'Table Setting'}]",Jac S.,en,"This Australian bistro is a little gem hidden away in the Goodman Arts Centre (GAC) - it opens up to a green field, and combined with the high ceilings, glass panels and wooden decor give it a warm and inviting feeling where you feel you can sit and chill out the entire afternoon.<br&gt;<br&gt;The menu is quite extensive - there&amp;#39;s all-day breakfasts, along with your requisite starters, main courses, pizzas, sarnies (that&amp;#39;s sandwiches for the non-aussies). My table had the Eggs Benedict with bacon or salmon (both yum), the portobello mushroom stack with a pasta side (also good), and a 12-inch personal pizza baked in their on-site wood fire kiln! My favourite bit would be desserts, which are not on the menu but displayed on the counter for you to pick. That day we had a lovely decadent chocolate cake that came with additional berries and cream... super rich and awesome! <br&gt;<br&gt;For the thirsty, the caffeine addicts in my group pronounced the Cafe Melba cuppa good, and there&amp;#39;s quite a long list of alcoholic drinks for you to sip and wind down to at the end of the day. All in all this bistro is a welcome addition to GAC, and makes a great option when one is a little too lazy or the weather is too insane to head out to the hawker centres nearby.<br&gt;<br&gt;P/S: Cafe Melba has a special Neighbours card with discounts and perks for its fellow tenants at GAC... check with the staff to find out more!"
traditional-haig-road-putu-piring-singapore-3,NwVyki35xOcaxhMzHNtHDQ,"{'link': '/user_details?userid=NwVyki35xOcaxhMzHNtHDQ', 'src': 'https://s3-media0.fl.yelpcdn.com/photo/6vQYvUm2HaeIFDLPas4xTw/60s.jpg', 'srcSet': 'https://s3-media0.fl.yelpcdn.com/photo/6vQYvUm2HaeIFDLPas4xTw/ms.jpg 1.67x,https://s3-media0.fl.yelpcdn.com/photo/6vQYvUm2HaeIFDLPas4xTw/120s.jpg 2.00x,https://s3-media0.fl.yelpcdn.com/photo/6vQYvUm2HaeIFDLPas4xTw/90s.jpg 1.50x,https://s3-media0.fl.yelpcdn.com/photo/6vQYvUm2HaeIFDLPas4xTw/168s.jpg 2.80x,https://s3-media0.fl.yelpcdn.com/photo/6vQYvUm2HaeIFDLPas4xTw/180s.jpg 3.00x', 'markupDisplayName': 'Chantelle T.', 'displayLocation': 'Edinburgh, United Kingdom', 'altText': 'Chantelle T.', 'userUrl': '/user_details?userid=NwVyki35xOcaxhMzHNtHDQ', 'partnerAlias': None, 'friendCount': 2933, 'photoCount': 2058, 'reviewCount': 422, 'eliteYear': None}",5,2/21/2017,"[{'src': 'https://s3-media0.fl.yelpcdn.com/bphoto/rcN8q3HCTR6L3cj0YoGovw/300s.jpg', 'link': '/biz_photos/traditional-haig-road-putu-piring-singapore-3?reviewid=UR9v-A4iOX3uIs3H0w1qeA&amp;select=rcN8q3HCTR6L3cj0YoGovw', 'altText': 'Photo of Traditional Haig Road Putu Piring - Singapore, Singapore', 'width': 300, 'height': 300, 'caption': None}, {'src': 'https://s3-media0.fl.yelpcdn.com/bphoto/mz-iMykeOitUEYvXILwMqw/300s.jpg', 'link': '/biz_photos/traditional-haig-road-putu-piring-singapore-3?reviewid=UR9v-A4iOX3uIs3H0w1qeA&amp;select=mz-iMykeOitUEYvXILwMqw', 'altText': 'Photo of Traditional Haig Road Putu Piring - Singapore, Singapore', 'width': 300, 'height': 300, 'caption': None}]",Chantelle T.,en,"So I bookmarked this place when I was last in Singapore four months ago and completely forgot to stop by. Luckily, I had another chance on my current trip and am so happy I finally did. <br&gt;<br&gt;I&amp;#39;ve never tried Putu Piring before today and to be honest, wasn&amp;#39;t even all that sure what to expect. They&amp;#39;re flat discs of coconut filled with a concoction of palm sugar then steamed and served with banana leaf. <br&gt;<br&gt;They&amp;#39;re soft, fluffy, slightly sweet and served warm. It was unlike anything I&amp;#39;ve eaten before and was super delicious served alongside grated coconut. <br&gt;<br&gt;They&amp;#39;re made fresh on the spot so expect a small wait. Cost is so cheap, $2 for 5 (considered one serve). Totally worth giving a try and now one of my favorite places for cheap eats in Singapore."
traditional-haig-road-putu-piring-singapore-3,iOIh76ksP5kDzD8L2EX9Ow,"{'link': '/user_details?userid=iOIh76ksP5kDzD8L2EX9Ow', 'src': 'https://s3-media0.fl.yelpcdn.com/photo/TGrlzemiQlLNopQMNLPjmA/60s.jpg', 'srcSet': 'https://s3-media0.fl.yelpcdn.com/photo/TGrlzemiQlLNopQMNLPjmA/ms.jpg 1.67x,https://s3-media0.fl.yelpcdn.com/photo/TGrlzemiQlLNopQMNLPjmA/120s.jpg 2.00x,https://s3-media0.fl.yelpcdn.com/photo/TGrlzemiQlLNopQMNLPjmA/90s.jpg 1.50x,https://s3-media0.fl.yelpcdn.com/photo/TGrlzemiQlLNopQMNLPjmA/168s.jpg 2.80x,https://s3-media0.fl.yelpcdn.com/photo/TGrlzemiQlLNopQMNLPjmA/180s.jpg 3.00x', 'markupDisplayName': 'Farrah Y.', 'displayLocation': 'Los Angeles, CA', 'altText': 'Farrah Y.', 'userUrl': '/user_details?userid=iOIh76ksP5kDzD8L2EX9Ow', 'partnerAlias': None, 'friendCount': 3, 'photoCount': 29, 'reviewCount': 35, 'eliteYear': None}",5,11/24/2019,"[{'src': 'https://s3-media0.fl.yelpcdn.com/bphoto/qNubU4yVu0Qpz0WdfkIHww/300s.jpg', 'link': '/biz_photos/traditional-haig-road-putu-piring-singapore-3?reviewid=UeE9h7OULLC1a7Fa76Y_Vg&amp;select=qNubU4yVu0Qpz0WdfkIHww', 'altText': 'Photo of Traditional Haig Road Putu Piring - Singapore, Singapore. Palm sugar filling', 'width': 300, 'height': 300, 'caption': 'Palm sugar filling'}, {'src': 'https://s3-media0.fl.yelpcdn.com/bphoto/OoZZr5Cc3ccawT6A63H_ug/300s.jpg', 'link': '/biz_photos/traditional-haig-road-putu-piring-singapore-3?reviewid=UeE9h7OULLC1a7Fa76Y_Vg&amp;select=OoZZr5Cc3ccawT6A63H_ug', 'altText': 'Photo of Traditional Haig Road Putu Piring - Singapore, Singapore. Steaming magic', 'width': 300, 'height': 300, 'caption': 'Steaming magic'}]",Farrah Y.,en,Craving putu piring today and went to this local stall  inside of a food court. Such a pleasurable treat! Not too sweet and comes with very generous sprinkles of coconut.<br&gt;My advice: GET AT LEAST TWO BOXES
