shop,userid,userinfo,rating,date,photos,username,language,text
dean-and-deluca-singapore-4,qK33YxMmj3nE_7nzxXNbog,"{'link': '/user_details?userid=qK33YxMmj3nE_7nzxXNbog', 'src': 'https://s3-media0.fl.yelpcdn.com/photo/7diHnQNHJ2KGDhcaLaB0OA/60s.jpg', 'srcSet': 'https://s3-media0.fl.yelpcdn.com/photo/7diHnQNHJ2KGDhcaLaB0OA/ms.jpg 1.67x,https://s3-media0.fl.yelpcdn.com/photo/7diHnQNHJ2KGDhcaLaB0OA/120s.jpg 2.00x,https://s3-media0.fl.yelpcdn.com/photo/7diHnQNHJ2KGDhcaLaB0OA/90s.jpg 1.50x,https://s3-media0.fl.yelpcdn.com/photo/7diHnQNHJ2KGDhcaLaB0OA/168s.jpg 2.80x,https://s3-media0.fl.yelpcdn.com/photo/7diHnQNHJ2KGDhcaLaB0OA/180s.jpg 3.00x', 'markupDisplayName': 'L W.', 'displayLocation': 'Singapore, Singapore', 'altText': 'L W.', 'userUrl': '/user_details?userid=qK33YxMmj3nE_7nzxXNbog', 'partnerAlias': None, 'friendCount': 7, 'photoCount': 61, 'reviewCount': 65, 'eliteYear': None}",4,2/14/2015,"[{'src': 'https://s3-media0.fl.yelpcdn.com/bphoto/e9dAPsu9SY2H2HSgf9Ns2A/300s.jpg', 'link': '/biz_photos/dean-and-deluca-singapore-4?reviewid=XCZbydYoT3X593ELV9-ugw&amp;select=e9dAPsu9SY2H2HSgf9Ns2A', 'altText': 'Photo of Dean &amp; Deluca - Singapore, Singapore. A hot mess! aka eggs iberico', 'width': 300, 'height': 300, 'caption': 'A hot mess! aka eggs iberico'}]",L W.,en,"Generous portions! And decent coffee. Not the best coffee in the world, but decent. They had some nice breakfast options at lunch time and it was completely and utterly deserted on a weekday (except for us). So if you can get over to HillV2 on a weekday - why not?"
dean-and-deluca-singapore-4,58lmYbSJgBTVN6dU7AVs3g,"{'link': '/user_details?userid=58lmYbSJgBTVN6dU7AVs3g', 'src': 'https://s3-media0.fl.yelpcdn.com/photo/L6-HFTQe7iqNKeqDMYfEKw/60s.jpg', 'srcSet': 'https://s3-media0.fl.yelpcdn.com/photo/L6-HFTQe7iqNKeqDMYfEKw/ms.jpg 1.67x,https://s3-media0.fl.yelpcdn.com/photo/L6-HFTQe7iqNKeqDMYfEKw/120s.jpg 2.00x,https://s3-media0.fl.yelpcdn.com/photo/L6-HFTQe7iqNKeqDMYfEKw/90s.jpg 1.50x,https://s3-media0.fl.yelpcdn.com/photo/L6-HFTQe7iqNKeqDMYfEKw/168s.jpg 2.80x,https://s3-media0.fl.yelpcdn.com/photo/L6-HFTQe7iqNKeqDMYfEKw/180s.jpg 3.00x', 'markupDisplayName': 'Joanne C.', 'displayLocation': 'Washington, DC', 'altText': 'Joanne C.', 'userUrl': '/user_details?userid=58lmYbSJgBTVN6dU7AVs3g', 'partnerAlias': None, 'friendCount': 130, 'photoCount': 224, 'reviewCount': 96, 'eliteYear': None}",3,1/19/2020,"[{'src': 'https://s3-media0.fl.yelpcdn.com/bphoto/-tZm1w9ZXS3piYxWWSji2Q/300s.jpg', 'link': '/biz_photos/dean-and-deluca-singapore-4?reviewid=hmN65I7T4lfN6i1XrqJ8BQ&amp;select=-tZm1w9ZXS3piYxWWSji2Q', 'altText': 'Photo of Dean &amp; Deluca - Singapore, Singapore', 'width': 300, 'height': 300, 'caption': None}]",Joanne C.,en,Decided to grab a quick lunch here. Modern vibes and spacious seating but definitely on the more expensive side. We got pasta and panini but honestly neither of them impressed us. Chicken in the pasta was way too dry and the dish wasn&amp;#39;t too flavorful. Same issue with the panini. We didn&amp;#39;t try their drinks so maybe that&amp;#39;s their selling point. Great place to chill but skip the dining.
dean-and-deluca-singapore-4,g-P058qnhLVXnEZYKBaVug,"{'link': '/user_details?userid=g-P058qnhLVXnEZYKBaVug', 'src': 'https://s3-media0.fl.yelpcdn.com/photo/36HFEbP1tXDRdCmQFx-DaA/60s.jpg', 'srcSet': 'https://s3-media0.fl.yelpcdn.com/photo/36HFEbP1tXDRdCmQFx-DaA/ms.jpg 1.67x,https://s3-media0.fl.yelpcdn.com/photo/36HFEbP1tXDRdCmQFx-DaA/120s.jpg 2.00x,https://s3-media0.fl.yelpcdn.com/photo/36HFEbP1tXDRdCmQFx-DaA/90s.jpg 1.50x,https://s3-media0.fl.yelpcdn.com/photo/36HFEbP1tXDRdCmQFx-DaA/168s.jpg 2.80x,https://s3-media0.fl.yelpcdn.com/photo/36HFEbP1tXDRdCmQFx-DaA/180s.jpg 3.00x', 'markupDisplayName': 'Alyssa Chloe T.', 'displayLocation': 'Singapore, Singapore', 'altText': 'Alyssa Chloe T.', 'userUrl': '/user_details?userid=g-P058qnhLVXnEZYKBaVug', 'partnerAlias': None, 'friendCount': 101, 'photoCount': 128, 'reviewCount': 82, 'eliteYear': None}",3,3/10/2016,"[{'src': 'https://s3-media0.fl.yelpcdn.com/bphoto/ItmmW7ysi9_8m5p6cHZSVw/300s.jpg', 'link': '/biz_photos/dean-and-deluca-singapore-4?reviewid=Dk9TzZcNf_g9lyXzID60IA&amp;select=ItmmW7ysi9_8m5p6cHZSVw', 'altText': 'Photo of Dean &amp; Deluca - Singapore, Singapore', 'width': 300, 'height': 300, 'caption': None}, {'src': 'https://s3-media0.fl.yelpcdn.com/bphoto/TxwJr1sw6QnGTlcecJgiDg/300s.jpg', 'link': '/biz_photos/dean-and-deluca-singapore-4?reviewid=Dk9TzZcNf_g9lyXzID60IA&amp;select=TxwJr1sw6QnGTlcecJgiDg', 'altText': 'Photo of Dean &amp; Deluca - Singapore, Singapore', 'width': 300, 'height': 300, 'caption': None}]",Alyssa Chloe T.,en,"Nice, quiet place - though it may be a little bit out of the way for those people who don&amp;#39;t drive (but I guess you can always check out their other outlets in Orchard Central!)<br&gt;<br&gt;Food wise, it was good. I would recommend their truffle carbonara - comes with a poached egg! Their wagyu lasagna was average - meat was well done though! Portions were very generous as well!<br&gt;<br&gt;Service by their manager was really good. The staff kind of forgot the lasagna so we ended up waiting for a really long time, so she brought us some soup and bread so we wouldn&amp;#39;t starve in the meantime. With that said, the soup had a piece of paper in it, rendering it virtually inedible :/"
dean-and-deluca-singapore-4,E3v2IZpOgvn2hAWaEzyLqQ,"{'link': '/user_details?userid=E3v2IZpOgvn2hAWaEzyLqQ', 'src': 'https://s3-media0.fl.yelpcdn.com/photo/psS4DbjXJU3pqn-jMUiHcg/60s.jpg', 'srcSet': 'https://s3-media0.fl.yelpcdn.com/photo/psS4DbjXJU3pqn-jMUiHcg/ms.jpg 1.67x,https://s3-media0.fl.yelpcdn.com/photo/psS4DbjXJU3pqn-jMUiHcg/120s.jpg 2.00x,https://s3-media0.fl.yelpcdn.com/photo/psS4DbjXJU3pqn-jMUiHcg/90s.jpg 1.50x,https://s3-media0.fl.yelpcdn.com/photo/psS4DbjXJU3pqn-jMUiHcg/168s.jpg 2.80x,https://s3-media0.fl.yelpcdn.com/photo/psS4DbjXJU3pqn-jMUiHcg/180s.jpg 3.00x', 'markupDisplayName': 'Ernst H.', 'displayLocation': 'Singapore, Singapore', 'altText': 'Ernst H.', 'userUrl': '/user_details?userid=E3v2IZpOgvn2hAWaEzyLqQ', 'partnerAlias': None, 'friendCount': 33, 'photoCount': 409, 'reviewCount': 43, 'eliteYear': None}",4,11/9/2014,"[{'src': 'https://s3-media0.fl.yelpcdn.com/bphoto/gPmultE8kfOU0yK5BIztag/180s.jpg', 'link': '/biz_photos/dean-and-deluca-singapore-4?reviewid=-tmuNsGQYkC2xpm1r4WLfQ&amp;select=gPmultE8kfOU0yK5BIztag', 'altText': 'Photo of Dean &amp; Deluca - Singapore, Singapore. Bread pudding', 'width': 180, 'height': 180, 'caption': 'Bread pudding'}, {'src': 'https://s3-media0.fl.yelpcdn.com/bphoto/9C38y0IIk4xQcYj2k1Z3eQ/180s.jpg', 'link': '/biz_photos/dean-and-deluca-singapore-4?reviewid=-tmuNsGQYkC2xpm1r4WLfQ&amp;select=9C38y0IIk4xQcYj2k1Z3eQ', 'altText': 'Photo of Dean &amp; Deluca - Singapore, Singapore', 'width': 180, 'height': 180, 'caption': None}, {'src': 'https://s3-media0.fl.yelpcdn.com/bphoto/ise0KDF6oKAlp8nfrlE3kQ/180s.jpg', 'link': '/biz_photos/dean-and-deluca-singapore-4?reviewid=-tmuNsGQYkC2xpm1r4WLfQ&amp;select=ise0KDF6oKAlp8nfrlE3kQ', 'altText': 'Photo of Dean &amp; Deluca - Singapore, Singapore', 'width': 180, 'height': 180, 'caption': None}, {'src': 'https://s3-media0.fl.yelpcdn.com/bphoto/_wt_Rq8U7PMW8P-G5DECVw/180s.jpg', 'link': '/biz_photos/dean-and-deluca-singapore-4?reviewid=-tmuNsGQYkC2xpm1r4WLfQ&amp;select=_wt_Rq8U7PMW8P-G5DECVw', 'altText': 'Photo of Dean &amp; Deluca - Singapore, Singapore', 'width': 180, 'height': 180, 'caption': None}]",Ernst H.,en,"Another excellent eatery in the new Hillv2 mall. Lots of organic stuff and healthy drinks, although cheeseburger is also on the menu.<br&gt;Very contemporary atmosphere, brand new and icy cold aircon, accompanied by (too much) thumping music. It&amp;#39;s nice for a quick meal. Don&amp;#39;t stick around too long."
dean-and-deluca-singapore-4,oZX3sHIPk9GIWbdd7Iopsg,"{'link': '/user_details?userid=oZX3sHIPk9GIWbdd7Iopsg', 'src': 'https://s3-media0.fl.yelpcdn.com/assets/srv0/yelp_styleguide/514f6997a318/assets/img/default_avatars/user_60_square.png', 'srcSet': None, 'markupDisplayName': 'Xiong Z.', 'displayLocation': 'Bukit Panjang, Singapore, Singapore', 'altText': 'Xiong Z.', 'userUrl': '/user_details?userid=oZX3sHIPk9GIWbdd7Iopsg', 'partnerAlias': None, 'friendCount': 0, 'photoCount': None, 'reviewCount': 1, 'eliteYear': None}",4,9/2/2017,[],Xiong Z.,en,Really great pastas and salads :) really empty and spacious and lovely ambience as well will highly recommend
nom-singapore,yn1y6UBwP3GKEFfglxTKnA,"{'link': '/user_details?userid=yn1y6UBwP3GKEFfglxTKnA', 'src': 'https://s3-media0.fl.yelpcdn.com/photo/NOh7q6y7gfNRFlfT0dQ8ZA/60s.jpg', 'srcSet': 'https://s3-media0.fl.yelpcdn.com/photo/NOh7q6y7gfNRFlfT0dQ8ZA/ms.jpg 1.67x,https://s3-media0.fl.yelpcdn.com/photo/NOh7q6y7gfNRFlfT0dQ8ZA/120s.jpg 2.00x,https://s3-media0.fl.yelpcdn.com/photo/NOh7q6y7gfNRFlfT0dQ8ZA/90s.jpg 1.50x,https://s3-media0.fl.yelpcdn.com/photo/NOh7q6y7gfNRFlfT0dQ8ZA/168s.jpg 2.80x,https://s3-media0.fl.yelpcdn.com/photo/NOh7q6y7gfNRFlfT0dQ8ZA/180s.jpg 3.00x', 'markupDisplayName': 'Serene T.', 'displayLocation': 'Singapore, Singapore', 'altText': 'Serene T.', 'userUrl': '/user_details?userid=yn1y6UBwP3GKEFfglxTKnA', 'partnerAlias': None, 'friendCount': 7, 'photoCount': 219, 'reviewCount': 79, 'eliteYear': None}",4,11/22/2014,"[{'src': 'https://s3-media0.fl.yelpcdn.com/bphoto/3CjYLS5b37B5rxlClf4cjA/180s.jpg', 'link': '/biz_photos/nom-singapore?reviewid=MyxO25V2_Gc5W4qPA8lHLg&amp;select=3CjYLS5b37B5rxlClf4cjA', 'altText': 'Photo of NOM - Singapore, Singapore. Salted caramel rainbow cake', 'width': 180, 'height': 180, 'caption': 'Salted caramel rainbow cake'}, {'src': 'https://s3-media0.fl.yelpcdn.com/bphoto/ITAizYG46uBniraI7RN2yg/180s.jpg', 'link': '/biz_photos/nom-singapore?reviewid=MyxO25V2_Gc5W4qPA8lHLg&amp;select=ITAizYG46uBniraI7RN2yg', 'altText': 'Photo of NOM - Singapore, Singapore. Beer.b fish n chips', 'width': 180, 'height': 180, 'caption': 'Beer.b fish n chips'}, {'src': 'https://s3-media0.fl.yelpcdn.com/bphoto/luD5xJcqRzORGPMyvZrcfg/180s.jpg', 'link': '/biz_photos/nom-singapore?reviewid=MyxO25V2_Gc5W4qPA8lHLg&amp;select=luD5xJcqRzORGPMyvZrcfg', 'altText': 'Photo of NOM - Singapore, Singapore. Breakfast roasti', 'width': 180, 'height': 180, 'caption': 'Breakfast roasti'}, {'src': 'https://s3-media0.fl.yelpcdn.com/bphoto/W85TB2M9TYQtj56Pb9HyPQ/180s.jpg', 'link': '/biz_photos/nom-singapore?reviewid=MyxO25V2_Gc5W4qPA8lHLg&amp;select=W85TB2M9TYQtj56Pb9HyPQ', 'altText': 'Photo of NOM - Singapore, Singapore. Iced lemon tea and chili chocolate', 'width': 180, 'height': 180, 'caption': 'Iced lemon tea and chili chocolate'}]",Serene T.,en,"Venue is located at a ulu area. Food here are nice. Had ordered their Beer <a href=""/redir?url=http%3A%2F%2Fb.fish&amp;amp;s=91283a4c4b5270ced98bdea33d4f49890d7360f53eda9292fdb384d0cbc39e5b"" target=""_blank"" rel=""nofollow""&gt;b.fish</a&gt; n chips, breakfast roasti and salted caramel rainbow cake. <br&gt;<br&gt;Beer.b fish n chips cost $12.90 and tastes nice. Do try this out. <br&gt;<br&gt;Breakfast roasti cost $14.90 and tastes not too bad too. <br&gt;<br&gt;And ordered iced lemon tea and chili chocolate. The chili chocolate tastes a little spicy but surprisingly nice. Do try out if you like trying new flavor. <br&gt;<br&gt;The salted caramel rainbow cake is superb! Cost $7.90<br&gt;Still have Oreo and chocolate ones too. Definitely a must try!"
nom-singapore,dCSfgihxACerBBSGmcHOxA,"{'link': '/user_details?userid=dCSfgihxACerBBSGmcHOxA', 'src': 'https://s3-media0.fl.yelpcdn.com/photo/WS_Zf3J7BJmXP-TzlogwAg/60s.jpg', 'srcSet': 'https://s3-media0.fl.yelpcdn.com/photo/WS_Zf3J7BJmXP-TzlogwAg/ms.jpg 1.67x,https://s3-media0.fl.yelpcdn.com/photo/WS_Zf3J7BJmXP-TzlogwAg/120s.jpg 2.00x,https://s3-media0.fl.yelpcdn.com/photo/WS_Zf3J7BJmXP-TzlogwAg/90s.jpg 1.50x,https://s3-media0.fl.yelpcdn.com/photo/WS_Zf3J7BJmXP-TzlogwAg/168s.jpg 2.80x,https://s3-media0.fl.yelpcdn.com/photo/WS_Zf3J7BJmXP-TzlogwAg/180s.jpg 3.00x', 'markupDisplayName': 'Richard B.', 'displayLocation': 'London, United Kingdom', 'altText': 'Richard B.', 'userUrl': '/user_details?userid=dCSfgihxACerBBSGmcHOxA', 'partnerAlias': None, 'friendCount': 48, 'photoCount': 170, 'reviewCount': 135, 'eliteYear': None}",3,6/4/2016,"[{'src': 'https://s3-media0.fl.yelpcdn.com/bphoto/usYjS-vZn54AvWGnK93Czg/300s.jpg', 'link': '/biz_photos/nom-singapore?reviewid=B7hy8VoJhz56z3vlS2WzRw&amp;select=usYjS-vZn54AvWGnK93Czg', 'altText': 'Photo of NOM - Singapore, Singapore. Laksa pizza! Interesting, but it&amp;#39;ll never beat an actual Bowl of laksa', 'width': 300, 'height': 300, 'caption': ""Laksa pizza! Interesting, but it'll never beat an actual Bowl of laksa""}]",Richard B.,en,"I came by here for dinner after work, seeing that they close late (11pm!). It&amp;#39;s located at the first floor of McPherson community centre, and utilises their wifi. It&amp;#39;s very spacious, and it&amp;#39;s even got a small slide in the corner for kids to play in. I wasn&amp;#39;t that hungry, and ended up ordering their truffle fries and their laksa pizza, along with a &amp;#39;matcha Kopi&amp;#39;.<br&gt;<br&gt;Their menu is pretty extensive and locally inspired, including things like a Chili crab pasta and a salted egg yolk prawn pasta. They also do burgers and pizzas. The laksa pizza I had was interesting conceptually, consisting of their own homemade bread topped with prawns, fishcake, curry leaves and boiled egg. I enjoyed it as it was a thin crust, but honestly it felt more like a glorified bakery bread. It wasn&amp;#39;t bad, but at $16.90, it&amp;#39;s a little steep. As for the truffle fries, the truffles it was topped with were questionable. <br&gt;<br&gt;However, I have to admit that I really like the layout, and it&amp;#39;s very communal. The staff need some work in terms of explaining the menu, but otherwise, I actually really liked the coffee! They also do a salted caramel latte, so next time I might try it. They&amp;#39;re apparently famous for their rainbow cake, which looked really delectable, and topped with things like cookies and cream and salted caramel. Overall, seems like a good place to do some studying and work if you&amp;#39;re in the area, though more for coffee and dessert than the food, which is a tad overpriced. Might try their pasta next time! Definitely a good concept to put it in a CC, I&amp;#39;ll have to come back again and update my review then, with photos of the rainbow cake!"
nom-singapore,H8mXfh5XgGCqmMLwVH7k5A,"{'link': '/user_details?userid=H8mXfh5XgGCqmMLwVH7k5A', 'src': 'https://s3-media0.fl.yelpcdn.com/photo/_9Tjfd7rCOKCYLEUzAJLHw/60s.jpg', 'srcSet': 'https://s3-media0.fl.yelpcdn.com/photo/_9Tjfd7rCOKCYLEUzAJLHw/ms.jpg 1.67x,https://s3-media0.fl.yelpcdn.com/photo/_9Tjfd7rCOKCYLEUzAJLHw/120s.jpg 2.00x,https://s3-media0.fl.yelpcdn.com/photo/_9Tjfd7rCOKCYLEUzAJLHw/90s.jpg 1.50x,https://s3-media0.fl.yelpcdn.com/photo/_9Tjfd7rCOKCYLEUzAJLHw/168s.jpg 2.80x,https://s3-media0.fl.yelpcdn.com/photo/_9Tjfd7rCOKCYLEUzAJLHw/180s.jpg 3.00x', 'markupDisplayName': 'Melissa Y.', 'displayLocation': 'Singapore, Singapore', 'altText': 'Melissa Y.', 'userUrl': '/user_details?userid=H8mXfh5XgGCqmMLwVH7k5A', 'partnerAlias': None, 'friendCount': 558, 'photoCount': 6125, 'reviewCount': 521, 'eliteYear': 2022}",2,12/30/2014,"[{'src': 'https://s3-media0.fl.yelpcdn.com/bphoto/pzCTt3wXsn8VqPX5SNlKTA/180s.jpg', 'link': '/biz_photos/nom-singapore?reviewid=2OjTvP6A1vltm9GE9E3U3Q&amp;select=pzCTt3wXsn8VqPX5SNlKTA', 'altText': 'Photo of NOM - Singapore, Singapore. Slow roasted bird leg', 'width': 180, 'height': 180, 'caption': 'Slow roasted bird leg'}, {'src': 'https://s3-media0.fl.yelpcdn.com/bphoto/NLtNtdyFkEaa5WcaDqMxVw/180s.jpg', 'link': '/biz_photos/nom-singapore?reviewid=2OjTvP6A1vltm9GE9E3U3Q&amp;select=NLtNtdyFkEaa5WcaDqMxVw', 'altText': 'Photo of NOM - Singapore, Singapore. Portobello fingers are a rip off at $9.90', 'width': 180, 'height': 180, 'caption': 'Portobello fingers are a rip off at $9.90'}, {'src': 'https://s3-media0.fl.yelpcdn.com/bphoto/b3h5nLyqoi94W0t00ampiQ/180s.jpg', 'link': '/biz_photos/nom-singapore?reviewid=2OjTvP6A1vltm9GE9E3U3Q&amp;select=b3h5nLyqoi94W0t00ampiQ', 'altText': 'Photo of NOM - Singapore, Singapore. Smoked salmon and Rosti which was a disappointment, standards have dropped', 'width': 180, 'height': 180, 'caption': 'Smoked salmon and Rosti which was a disappointment, standards have dropped'}, {'src': 'https://s3-media0.fl.yelpcdn.com/bphoto/JwXD3zl1-S5kgkQXObLA2g/180s.jpg', 'link': '/biz_photos/nom-singapore?reviewid=2OjTvP6A1vltm9GE9E3U3Q&amp;select=JwXD3zl1-S5kgkQXObLA2g', 'altText': 'Photo of NOM - Singapore, Singapore. Rainbow cheesecake FTW!! $7.90 each!', 'width': 180, 'height': 180, 'caption': 'Rainbow cheesecake FTW!! $7.90 each!'}]",Melissa Y.,en,"I called in to make a reservation for 5 which we ended up being a party of 8 with a child. NOM&amp;#39;s interior is set up with several square tables so they can be very flexible with any party size. A great plus point over fixed sized booths, which only accomodate so many people.<br&gt;<br&gt; <br&gt;This is the entrance of NOM at MacPherson Community Club on a tuesday night 8pm. I parked across the street, at the HDB car park and there was a summon aunty walking around checking coupons, so do take note!<br&gt;<br&gt; <br&gt;Cheese and tomato pizza was okay, nothing fancy. Big enough to share.<br&gt; <br&gt;For the kids meal, we got pasta and the gravy tasted fine, except for the pasta penne itself, it was abit hard.<br&gt; <br&gt;Their chicken leg was done pretty decently and the meat pretty much fell off the bone and you wouldn&amp;#39;t need a knife to eat this cleanly. So thumbs up for this.<br&gt;<br&gt;I liked it better when they served full portobellos. For $9.90, this is literally one or at most two portobello mushroom caps sliced up, breaded and fried. Totally a rip off.<br&gt;<br&gt;Everyone loved the ribs, even though I found it a bit too hard, there was only one bone in there though. So tons of meat for sharing.<br&gt;<br&gt;Being that this is my second time, I figured I knew what I wanted. But I was so wrong, the quality has dropped. I am not sure if I would be back for the rosti. Refer to my previous review in SEPT/OCT and see the pictures of the Rosti, it looks so different. I even feedbacked to the young waitress whom politely asked if I wanted the Rosti recooked, but I said, forget it, my friends had already dug into it. But even my friend who came in JB, mentioned that Marches&amp;#39; Rosti is so much better and even cheaper than this. <br&gt;<br&gt;So, the newest addition to NOM is their rainbow cheesecakes which I did not see in September. It is quite solid, so I know for sure there&amp;#39;s at least 2 blocks of Philadelphia cream cheese in there or more. It can be quite gerlat, so do share it, so just eat it and run 10km at the gym the next day.<br&gt;<br&gt;I had tried their chocolate and oreo rainbow cakes before and this was my first time trying their salted caramel cake. Everyone really liked the salted caramel rainbow cake smile And some of my friends mentioned that they would be back to try other cakes, definitely not the Rosti though.<br&gt; <br&gt;At $8.90 a slice, rainbow cakes here aren&amp;#39;t cheap but they&amp;#39;re at least decent. The Rainbow cakes were priced at $7.90 a slice just 2 months ago.. :(<br&gt;<br&gt;I&amp;#39;m glad that NOM is sensible enough to price this rainbow cheesecake at $7.90, one dollar less than the rainbow cake itself. Being that I do bake cakes, I also know well that a rainbow cheesecake takes ALOT less time to make than a normal rainbow buttercream/sponge cake.<br&gt;<br&gt;The best upside to NOM is that it is nett priced, but I believe their prices seem to be going up some dumb reason."
nom-singapore,fAY7S51J_9uMMZRVTO8f3w,"{'link': '/user_details?userid=fAY7S51J_9uMMZRVTO8f3w', 'src': 'https://s3-media0.fl.yelpcdn.com/photo/OSd0-uF-LN_rUuv7TJp8dA/60s.jpg', 'srcSet': 'https://s3-media0.fl.yelpcdn.com/photo/OSd0-uF-LN_rUuv7TJp8dA/ms.jpg 1.67x,https://s3-media0.fl.yelpcdn.com/photo/OSd0-uF-LN_rUuv7TJp8dA/120s.jpg 2.00x,https://s3-media0.fl.yelpcdn.com/photo/OSd0-uF-LN_rUuv7TJp8dA/90s.jpg 1.50x,https://s3-media0.fl.yelpcdn.com/photo/OSd0-uF-LN_rUuv7TJp8dA/168s.jpg 2.80x,https://s3-media0.fl.yelpcdn.com/photo/OSd0-uF-LN_rUuv7TJp8dA/180s.jpg 3.00x', 'markupDisplayName': 'Nora S.', 'displayLocation': 'Singapore, Singapore', 'altText': 'Nora S.', 'userUrl': '/user_details?userid=fAY7S51J_9uMMZRVTO8f3w', 'partnerAlias': None, 'friendCount': 1, 'photoCount': 15, 'reviewCount': 8, 'eliteYear': None}",3,6/27/2015,"[{'src': 'https://s3-media0.fl.yelpcdn.com/bphoto/V9CWbkPZB59iOSnZ_3uxyw/180s.jpg', 'link': '/biz_photos/nom-singapore?reviewid=PhX48rew_RfUzBa_06nYSg&amp;select=V9CWbkPZB59iOSnZ_3uxyw', 'altText': 'Photo of NOM - Singapore, Singapore. Blackstone eggs benedict', 'width': 180, 'height': 180, 'caption': 'Blackstone eggs benedict'}, {'src': 'https://s3-media0.fl.yelpcdn.com/bphoto/y1JXGtl1nJUWq9JHcfDGUw/180s.jpg', 'link': '/biz_photos/nom-singapore?reviewid=PhX48rew_RfUzBa_06nYSg&amp;select=y1JXGtl1nJUWq9JHcfDGUw', 'altText': 'Photo of NOM - Singapore, Singapore. Atlanta eggs benedict', 'width': 180, 'height': 180, 'caption': 'Atlanta eggs benedict'}, {'src': 'https://s3-media0.fl.yelpcdn.com/bphoto/khxVFe3KSfZvzGBitUM0mg/180s.jpg', 'link': '/biz_photos/nom-singapore?reviewid=PhX48rew_RfUzBa_06nYSg&amp;select=khxVFe3KSfZvzGBitUM0mg', 'altText': 'Photo of NOM - Singapore, Singapore. Truffle fries', 'width': 180, 'height': 180, 'caption': 'Truffle fries'}, {'src': 'https://s3-media0.fl.yelpcdn.com/bphoto/qK6xMarwx3TUX-tQ2MoPMg/180s.jpg', 'link': '/biz_photos/nom-singapore?reviewid=PhX48rew_RfUzBa_06nYSg&amp;select=qK6xMarwx3TUX-tQ2MoPMg', 'altText': 'Photo of NOM - Singapore, Singapore. Chocolate rainbow cake', 'width': 180, 'height': 180, 'caption': 'Chocolate rainbow cake'}]",Nora S.,en,"We went to NOM for brunch on a Saturday. It wasn&amp;#39;t too crowded, there was just another family there with us. My first impression of the place was that it was bare and clinical, with the stark white walls, cement floor and white tables and chairs. It felt.. cold. The mandopop music played through the speakers made me feel even more like an outsider.<br&gt;<br&gt;I would say the food was average. We had the atlanta eggs benedict, blackstone eggs benedict, truffle fries and chocolate rainbow cake. <br&gt;<br&gt;Let&amp;#39;s start with the best part- the cake. We got it only because it&amp;#39;s supposedly the thing you must try if you&amp;#39;re there. I&amp;#39;ve never been a fan of rainbow cake because they don&amp;#39;t really taste like rainbows (cheat my feelings, you know?), but I&amp;#39;m glad I tried this one. The sponge was moist, fluffy and full of flavour, even without the chocolate icing. The icing was decadent - rich, creamy chocolatey goodness that melts in your mouth (and in your hands, I checked). <br&gt;<br&gt;The truffle fries were amazing as fries, not so much as truffle fries. They were actually cut potatoes and I believe they were air-fried or baked, so they were not greasy. The fries were crispy on the surface and hot on the inside. Unfortunately, we could barely taste the truffles. In terms of taste, the shaved parmesan on top had more impact.<br&gt;<br&gt;The poached eggs were not that great, to be honest. They were almost cold by the time they were served, and one out the 4 was not runny in the middle. Toasting the english muffins and grilling the tomatoes would have improved the dishes, i think.<br&gt;<br&gt;In summary, as NOM is quite out of the way for those who don&amp;#39;t live in Macpherson, I think I&amp;#39;d need a stronger reason to go back. The cakes are definitely tempting, so i&amp;#39;d stop by for those if i&amp;#39;m nearby."
