shop,userid,userinfo,rating,date,photos,username,language,text
twg-tea-at-swissotel-the-stamford-singapore,K74S1UK7QjAhWnkXIN0nhg,"{'link': '/user_details?userid=K74S1UK7QjAhWnkXIN0nhg', 'src': 'https://s3-media0.fl.yelpcdn.com/photo/af_7fk_2eXo0C4Uha08pyA/60s.jpg', 'srcSet': 'https://s3-media0.fl.yelpcdn.com/photo/af_7fk_2eXo0C4Uha08pyA/ms.jpg 1.67x,https://s3-media0.fl.yelpcdn.com/photo/af_7fk_2eXo0C4Uha08pyA/120s.jpg 2.00x,https://s3-media0.fl.yelpcdn.com/photo/af_7fk_2eXo0C4Uha08pyA/90s.jpg 1.50x,https://s3-media0.fl.yelpcdn.com/photo/af_7fk_2eXo0C4Uha08pyA/168s.jpg 2.80x,https://s3-media0.fl.yelpcdn.com/photo/af_7fk_2eXo0C4Uha08pyA/180s.jpg 3.00x', 'markupDisplayName': 'Jessalyn P.', 'displayLocation': 'Sacramento, CA', 'altText': 'Jessalyn P.', 'userUrl': '/user_details?userid=K74S1UK7QjAhWnkXIN0nhg', 'partnerAlias': None, 'friendCount': 432, 'photoCount': 2223, 'reviewCount': 205, 'eliteYear': 2022}",5,4/15/2019,"[{'src': 'https://s3-media0.fl.yelpcdn.com/bphoto/hwgfMGH1hNLb9KbH05rwoQ/180s.jpg', 'link': '/biz_photos/twg-tea-at-swissotel-the-stamford-singapore?reviewid=G5jdQpNApCtR8rFAvi-MOw&amp;select=hwgfMGH1hNLb9KbH05rwoQ', 'altText': 'Photo of TWG Tea at Swissotel The Stamford - Singapore, Singapore. Decor and seating.', 'width': 180, 'height': 180, 'caption': 'Decor and seating.'}, {'src': 'https://s3-media0.fl.yelpcdn.com/bphoto/6frO-qfMQ7HJRcnHZpGPfA/180s.jpg', 'link': '/biz_photos/twg-tea-at-swissotel-the-stamford-singapore?reviewid=G5jdQpNApCtR8rFAvi-MOw&amp;select=6frO-qfMQ7HJRcnHZpGPfA', 'altText': 'Photo of TWG Tea at Swissotel The Stamford - Singapore, Singapore. Chocolate Coffee cake had chocolate covered pop rock candies.', 'width': 180, 'height': 180, 'caption': 'Chocolate Coffee cake had chocolate covered pop rock candies.'}, {'src': 'https://s3-media0.fl.yelpcdn.com/bphoto/XSQodgjbcPr8YBiybroXeA/180s.jpg', 'link': '/biz_photos/twg-tea-at-swissotel-the-stamford-singapore?reviewid=G5jdQpNApCtR8rFAvi-MOw&amp;select=XSQodgjbcPr8YBiybroXeA', 'altText': 'Photo of TWG Tea at Swissotel The Stamford - Singapore, Singapore. Enjoying afternoon tea with my love.', 'width': 180, 'height': 180, 'caption': 'Enjoying afternoon tea with my love.'}, {'src': 'https://s3-media0.fl.yelpcdn.com/bphoto/QR3j99rkFfd_WqmjQvwqEQ/180s.jpg', 'link': '/biz_photos/twg-tea-at-swissotel-the-stamford-singapore?reviewid=G5jdQpNApCtR8rFAvi-MOw&amp;select=QR3j99rkFfd_WqmjQvwqEQ', 'altText': 'Photo of TWG Tea at Swissotel The Stamford - Singapore, Singapore. Tea accessories decor and seating.', 'width': 180, 'height': 180, 'caption': 'Tea accessories decor and seating.'}]",Jessalyn P.,en,"Afternoon tea has been a timeless English tradition and it&amp;#39;s becoming a popular past time in Singapore as well. <br&gt;<br&gt;Nestled in the lobby of a luxurious hotel, Swissotel The Stamford provides an elegant and chic ambiance surrounded by orchids and vibrant tea accessories makes for the perfect backdrop and further impressing guests with their impeccable service.<br&gt;<br&gt;An exquisite selection of teas, pastries, finger sandwiches, decadent desserts and more are on offer to be enjoyed by your nearest and dearest. <br&gt;<br&gt;All TWG staffs are required to be &amp;#34;connoisseurs&amp;#34; and have an extensive knowledge of their products as to provide top notch service to guests on the search for a certain aroma or flavor. <br&gt;<br&gt;There are two options for the afternoon tea experience. The &amp;#34;Fortune &amp;#34; and &amp;#34;Parisian&amp;#34;. The Fortune is the way to go for those wanting something lighter. It features a three-tiered platter served with finger sandwiches, pastries and macarons, all of which comes with a few options that you can choose from. Hot or Iced tea included for $40. $11 supplement for tea for each additional person. <br&gt;<br&gt;We opted for the pastrami sandwich, chocolate/strawberry/tiramisu macarons and finished off with a chocolate coffee cake that was just heavenly with a chocolate covered pop-rock candies giving it a whimsical texture in every bite. All were delightful and the strawberry vanilla infused tea as well as the classic green tea were both a deliciously sophisticated pairings. <br&gt;<br&gt;The perfect spot for afternoon tea with friends."
twg-tea-at-swissotel-the-stamford-singapore,gfqrQR-JyGM6ijoTPGqkUA,"{'link': '/user_details?userid=gfqrQR-JyGM6ijoTPGqkUA', 'src': 'https://s3-media0.fl.yelpcdn.com/photo/MTYPXUL6haDmx_6N919VBQ/60s.jpg', 'srcSet': 'https://s3-media0.fl.yelpcdn.com/photo/MTYPXUL6haDmx_6N919VBQ/ms.jpg 1.67x,https://s3-media0.fl.yelpcdn.com/photo/MTYPXUL6haDmx_6N919VBQ/120s.jpg 2.00x,https://s3-media0.fl.yelpcdn.com/photo/MTYPXUL6haDmx_6N919VBQ/90s.jpg 1.50x,https://s3-media0.fl.yelpcdn.com/photo/MTYPXUL6haDmx_6N919VBQ/168s.jpg 2.80x,https://s3-media0.fl.yelpcdn.com/photo/MTYPXUL6haDmx_6N919VBQ/180s.jpg 3.00x', 'markupDisplayName': 'Ii T.', 'displayLocation': '生野区, Osaka, Japan', 'altText': 'Ii T.', 'userUrl': '/user_details?userid=gfqrQR-JyGM6ijoTPGqkUA', 'partnerAlias': None, 'friendCount': 2, 'photoCount': 3258, 'reviewCount': 573, 'eliteYear': None}",3,1/2/2021,"[{'src': 'https://s3-media0.fl.yelpcdn.com/bphoto/v47abtH5Hv6XCWJmCtdc7Q/300s.jpg', 'link': '/biz_photos/twg-tea-at-swissotel-the-stamford-singapore?reviewid=uYMppqj07yDBy9olztlLpg&amp;select=v47abtH5Hv6XCWJmCtdc7Q', 'altText': 'Photo of TWG Tea at Swissotel The Stamford - Singapore, Singapore', 'width': 300, 'height': 300, 'caption': ''}, {'src': 'https://s3-media0.fl.yelpcdn.com/bphoto/fBI1CA3-ooooWnSkTUDPbw/300s.jpg', 'link': '/biz_photos/twg-tea-at-swissotel-the-stamford-singapore?reviewid=uYMppqj07yDBy9olztlLpg&amp;select=fBI1CA3-ooooWnSkTUDPbw', 'altText': 'Photo of TWG Tea at Swissotel The Stamford - Singapore, Singapore', 'width': 300, 'height': 300, 'caption': ''}]",Ii T.,en,"It&amp;#39;s a little-known spot, as it was in the reviews of other people.<br&gt;<br&gt;I was able to buy souvenirs immediately."
twg-tea-at-swissotel-the-stamford-singapore,IxlGycX5KMNnQBPjBW7sug,"{'link': '/user_details?userid=IxlGycX5KMNnQBPjBW7sug', 'src': 'https://s3-media0.fl.yelpcdn.com/photo/POu7hqQnWnOSyp_ByH_wUA/60s.jpg', 'srcSet': 'https://s3-media0.fl.yelpcdn.com/photo/POu7hqQnWnOSyp_ByH_wUA/ms.jpg 1.67x,https://s3-media0.fl.yelpcdn.com/photo/POu7hqQnWnOSyp_ByH_wUA/120s.jpg 2.00x,https://s3-media0.fl.yelpcdn.com/photo/POu7hqQnWnOSyp_ByH_wUA/90s.jpg 1.50x,https://s3-media0.fl.yelpcdn.com/photo/POu7hqQnWnOSyp_ByH_wUA/168s.jpg 2.80x,https://s3-media0.fl.yelpcdn.com/photo/POu7hqQnWnOSyp_ByH_wUA/180s.jpg 3.00x', 'markupDisplayName': 'Priscilla R.', 'displayLocation': 'Queens, Queens, NY', 'altText': 'Priscilla R.', 'userUrl': '/user_details?userid=IxlGycX5KMNnQBPjBW7sug', 'partnerAlias': None, 'friendCount': 40, 'photoCount': 571, 'reviewCount': 129, 'eliteYear': 2022}",5,2/21/2020,"[{'src': 'https://s3-media0.fl.yelpcdn.com/bphoto/VzsSxEZz6jXM7SuDEPqPdA/180s.jpg', 'link': '/biz_photos/twg-tea-at-swissotel-the-stamford-singapore?reviewid=7INz2R1OagumMki2MQGUMQ&amp;select=VzsSxEZz6jXM7SuDEPqPdA', 'altText': 'Photo of TWG Tea at Swissotel The Stamford - Singapore, Singapore', 'width': 180, 'height': 180, 'caption': None}, {'src': 'https://s3-media0.fl.yelpcdn.com/bphoto/d-1BExnbQHHbaNf8WZMYHQ/180s.jpg', 'link': '/biz_photos/twg-tea-at-swissotel-the-stamford-singapore?reviewid=7INz2R1OagumMki2MQGUMQ&amp;select=d-1BExnbQHHbaNf8WZMYHQ', 'altText': 'Photo of TWG Tea at Swissotel The Stamford - Singapore, Singapore', 'width': 180, 'height': 180, 'caption': None}, {'src': 'https://s3-media0.fl.yelpcdn.com/bphoto/3fPejdsTQsUMyQWFSYbeJg/180s.jpg', 'link': '/biz_photos/twg-tea-at-swissotel-the-stamford-singapore?reviewid=7INz2R1OagumMki2MQGUMQ&amp;select=3fPejdsTQsUMyQWFSYbeJg', 'altText': 'Photo of TWG Tea at Swissotel The Stamford - Singapore, Singapore', 'width': 180, 'height': 180, 'caption': None}, {'src': 'https://s3-media0.fl.yelpcdn.com/bphoto/d09AcdXkq4ENjlXoJhN4Pw/180s.jpg', 'link': '/biz_photos/twg-tea-at-swissotel-the-stamford-singapore?reviewid=7INz2R1OagumMki2MQGUMQ&amp;select=d09AcdXkq4ENjlXoJhN4Pw', 'altText': 'Photo of TWG Tea at Swissotel The Stamford - Singapore, Singapore', 'width': 180, 'height': 180, 'caption': None}]",Priscilla R.,en,Amazing experience here!! Do not go anywhere else for your tea experience!! Trent was so informative and knowledgeable  and an amazing help. He was so patient informative and clearly loves what he does. The tea options are amazing and plentiful! A must see In Singapore
little-farms-singapore,BlEFnOjUxS_IRXYW0uZ3Hg,"{'link': '/user_details?userid=BlEFnOjUxS_IRXYW0uZ3Hg', 'src': 'https://s3-media0.fl.yelpcdn.com/photo/O108Khp_kOmQYqcNGEuQ2w/60s.jpg', 'srcSet': 'https://s3-media0.fl.yelpcdn.com/photo/O108Khp_kOmQYqcNGEuQ2w/ms.jpg 1.67x,https://s3-media0.fl.yelpcdn.com/photo/O108Khp_kOmQYqcNGEuQ2w/120s.jpg 2.00x,https://s3-media0.fl.yelpcdn.com/photo/O108Khp_kOmQYqcNGEuQ2w/90s.jpg 1.50x,https://s3-media0.fl.yelpcdn.com/photo/O108Khp_kOmQYqcNGEuQ2w/168s.jpg 2.80x,https://s3-media0.fl.yelpcdn.com/photo/O108Khp_kOmQYqcNGEuQ2w/180s.jpg 3.00x', 'markupDisplayName': 'Karissa L.', 'displayLocation': 'Singapore, Singapore', 'altText': 'Karissa L.', 'userUrl': '/user_details?userid=BlEFnOjUxS_IRXYW0uZ3Hg', 'partnerAlias': None, 'friendCount': 13, 'photoCount': 55, 'reviewCount': 42, 'eliteYear': None}",5,3/18/2016,"[{'src': 'https://s3-media0.fl.yelpcdn.com/bphoto/jOkiAIIrqbA5r0rpLixouw/300s.jpg', 'link': '/biz_photos/little-farms-singapore?reviewid=DxsuTEbQOXJN1WK5aFQ_KQ&amp;select=jOkiAIIrqbA5r0rpLixouw', 'altText': 'Photo of Little Farms - Singapore, Singapore. One of these 5286363 specialty jars is truffle mayo', 'width': 300, 'height': 300, 'caption': 'One of these 5286363 specialty jars is truffle mayo'}, {'src': 'https://s3-media0.fl.yelpcdn.com/bphoto/vGWaTUsFEx3MVq156nikeA/300s.jpg', 'link': '/biz_photos/little-farms-singapore?reviewid=DxsuTEbQOXJN1WK5aFQ_KQ&amp;select=vGWaTUsFEx3MVq156nikeA', 'altText': 'Photo of Little Farms - Singapore, Singapore. For all your ethically reared and farm fresh grocery needs', 'width': 300, 'height': 300, 'caption': 'For all your ethically reared and farm fresh grocery needs'}]",Karissa L.,en,"This place makes Cold Storage seem sad and basic.<br&gt;<br&gt;It isn&amp;#39;t very big, but just one turn around the store took forever because I was essentially fascinated with every single item. Also I&amp;#39;m quite sure this has the highest density of items labeled &amp;#34;organic&amp;#34; in all of Singapore. <br&gt;<br&gt;So fear not River Valley. Whether it&amp;#39;s truffle mayo, fresh squid ink spaghetti, salted cucumber soda, or rosemary-thyme-vanilla oil you&amp;#39;re running low on (and I&amp;#39;m really just scraping the organic iceberg with these items), Little Farms has got your back."
little-farms-singapore,4pPjvEjYc2gSxF6JISDLvw,"{'link': '/user_details?userid=4pPjvEjYc2gSxF6JISDLvw', 'src': 'https://s3-media0.fl.yelpcdn.com/photo/_s5_Kq-k2dmoEXO9APjV1Q/60s.jpg', 'srcSet': 'https://s3-media0.fl.yelpcdn.com/photo/_s5_Kq-k2dmoEXO9APjV1Q/ms.jpg 1.67x,https://s3-media0.fl.yelpcdn.com/photo/_s5_Kq-k2dmoEXO9APjV1Q/120s.jpg 2.00x,https://s3-media0.fl.yelpcdn.com/photo/_s5_Kq-k2dmoEXO9APjV1Q/90s.jpg 1.50x,https://s3-media0.fl.yelpcdn.com/photo/_s5_Kq-k2dmoEXO9APjV1Q/168s.jpg 2.80x,https://s3-media0.fl.yelpcdn.com/photo/_s5_Kq-k2dmoEXO9APjV1Q/180s.jpg 3.00x', 'markupDisplayName': 'Meni B.', 'displayLocation': 'Singapore, Singapore', 'altText': 'Meni B.', 'userUrl': '/user_details?userid=4pPjvEjYc2gSxF6JISDLvw', 'partnerAlias': None, 'friendCount': 0, 'photoCount': None, 'reviewCount': 3, 'eliteYear': None}",5,12/14/2016,[],Meni B.,en,"I applaud Little Farms for its exceptional customer service ethos. Deliveries to my home always arrive within the selected timeframes, the customer service representative is always polite and if I have any issues with the products I buy they are dealt with promptly, professionally and always to my satisfaction. Keep it up Little Farms! Thank you!"
little-farms-singapore,RViz7acKcjL18uxLoCpcKg,"{'link': '/user_details?userid=RViz7acKcjL18uxLoCpcKg', 'src': 'https://s3-media0.fl.yelpcdn.com/photo/LCW5bWlYTzawm_-p_Nv9iw/60s.jpg', 'srcSet': 'https://s3-media0.fl.yelpcdn.com/photo/LCW5bWlYTzawm_-p_Nv9iw/ms.jpg 1.67x,https://s3-media0.fl.yelpcdn.com/photo/LCW5bWlYTzawm_-p_Nv9iw/120s.jpg 2.00x,https://s3-media0.fl.yelpcdn.com/photo/LCW5bWlYTzawm_-p_Nv9iw/90s.jpg 1.50x,https://s3-media0.fl.yelpcdn.com/photo/LCW5bWlYTzawm_-p_Nv9iw/168s.jpg 2.80x,https://s3-media0.fl.yelpcdn.com/photo/LCW5bWlYTzawm_-p_Nv9iw/180s.jpg 3.00x', 'markupDisplayName': 'Anne C.', 'displayLocation': 'Singapore, Singapore', 'altText': 'Anne C.', 'userUrl': '/user_details?userid=RViz7acKcjL18uxLoCpcKg', 'partnerAlias': None, 'friendCount': 97, 'photoCount': 10, 'reviewCount': 3, 'eliteYear': None}",4,2/27/2017,[],Anne C.,en,fresh and quality items. allows you to buy veggies with small amount. perfect for the one who lives alone.
coffee-nowhere-singapore-3,3KYixk4HwDBFFBwws__tkw,"{'link': '/user_details?userid=3KYixk4HwDBFFBwws__tkw', 'src': 'https://s3-media0.fl.yelpcdn.com/photo/NmkvTSyvSE1J0h89ZO0SKQ/60s.jpg', 'srcSet': 'https://s3-media0.fl.yelpcdn.com/photo/NmkvTSyvSE1J0h89ZO0SKQ/ms.jpg 1.67x,https://s3-media0.fl.yelpcdn.com/photo/NmkvTSyvSE1J0h89ZO0SKQ/120s.jpg 2.00x,https://s3-media0.fl.yelpcdn.com/photo/NmkvTSyvSE1J0h89ZO0SKQ/90s.jpg 1.50x,https://s3-media0.fl.yelpcdn.com/photo/NmkvTSyvSE1J0h89ZO0SKQ/168s.jpg 2.80x,https://s3-media0.fl.yelpcdn.com/photo/NmkvTSyvSE1J0h89ZO0SKQ/180s.jpg 3.00x', 'markupDisplayName': 'Paul N.', 'displayLocation': 'Singapore, Singapore', 'altText': 'Paul N.', 'userUrl': '/user_details?userid=3KYixk4HwDBFFBwws__tkw', 'partnerAlias': None, 'friendCount': 44, 'photoCount': 272, 'reviewCount': 70, 'eliteYear': None}",3,4/30/2016,"[{'src': 'https://s3-media0.fl.yelpcdn.com/bphoto/O52XyPuYkiBAwKd6MhESHQ/300s.jpg', 'link': '/biz_photos/coffee-nowhere-singapore-3?reviewid=j8aae0URHAEePqqklLL_Tw&amp;select=O52XyPuYkiBAwKd6MhESHQ', 'altText': 'Photo of Coffee Nowhere - Singapore, Singapore. Only for the sweet of tooth.', 'width': 300, 'height': 300, 'caption': 'Only for the sweet of tooth.'}]",Paul N.,en,"Friendly staff, half decent coffee, but the wait for food is too long. 20 mins for cheesy fries? 40 mins for an eggs Ben? Not acceptable. <br&gt;<br&gt;Food itself is okay, but not worth waiting so long for."
coffee-nowhere-singapore-3,ki_yJao2TS82vb0c4orZmw,"{'link': '/user_details?userid=ki_yJao2TS82vb0c4orZmw', 'src': 'https://s3-media0.fl.yelpcdn.com/photo/2EZ9F8hpkuJa9LyV2OufuA/60s.jpg', 'srcSet': 'https://s3-media0.fl.yelpcdn.com/photo/2EZ9F8hpkuJa9LyV2OufuA/ms.jpg 1.67x,https://s3-media0.fl.yelpcdn.com/photo/2EZ9F8hpkuJa9LyV2OufuA/120s.jpg 2.00x,https://s3-media0.fl.yelpcdn.com/photo/2EZ9F8hpkuJa9LyV2OufuA/90s.jpg 1.50x,https://s3-media0.fl.yelpcdn.com/photo/2EZ9F8hpkuJa9LyV2OufuA/168s.jpg 2.80x,https://s3-media0.fl.yelpcdn.com/photo/2EZ9F8hpkuJa9LyV2OufuA/180s.jpg 3.00x', 'markupDisplayName': 'Daphne O.', 'displayLocation': 'Singapore, Singapore', 'altText': 'Daphne O.', 'userUrl': '/user_details?userid=ki_yJao2TS82vb0c4orZmw', 'partnerAlias': None, 'friendCount': 5, 'photoCount': 4, 'reviewCount': 1, 'eliteYear': None}",2,12/14/2014,"[{'src': 'https://s3-media0.fl.yelpcdn.com/bphoto/P3zJn6HyImn7hl-1NXXa0A/300s.jpg', 'link': '/biz_photos/coffee-nowhere-singapore-3?reviewid=z8gzATnEBE0PjG-AoUkUNw&amp;select=P3zJn6HyImn7hl-1NXXa0A', 'altText': 'Photo of Coffee Nowhere - Singapore, Singapore', 'width': 300, 'height': 300, 'caption': None}]",Daphne O.,en,"A new cafe in the west.. Not much to shout about. Coffee was a little over priced at $5.80 for a flat white that was slightly burnt. The marble cheesecake made up for it though, rich and creamy with a good base.  Service was average, the staff seemed a little untrained. Most tables even though empty was left dirty with crumbs from the previous diner. Would recommend a visit only if you happen to be in the building."
coffee-nowhere-singapore-3,yRkapfYEc28JHi61r2w2_Q,"{'link': '/user_details?userid=yRkapfYEc28JHi61r2w2_Q', 'src': 'https://s3-media0.fl.yelpcdn.com/assets/srv0/yelp_styleguide/514f6997a318/assets/img/default_avatars/user_60_square.png', 'srcSet': None, 'markupDisplayName': 'Phyllis T.', 'displayLocation': 'Clementi, Singapore, Singapore', 'altText': 'Phyllis T.', 'userUrl': '/user_details?userid=yRkapfYEc28JHi61r2w2_Q', 'partnerAlias': None, 'friendCount': 0, 'photoCount': None, 'reviewCount': 1, 'eliteYear': None}",1,4/8/2018,[],Phyllis T.,en,"On Sunday 8 April, we went to Coffeenowhere, West Coast Plaza at 7.15pm For dinner. As I tried the braised pork belly rice last Monday and it was good, so I recommended it to my husband. We ordered 2 sets and a carbonara. After waiting for 15 min, the Carbonara came and a further 5 minutes, the pork belly rice came. The mixed vegetables (corn, peas, carrots) were sour in both bowls! They were obviously stale. We informed the staff. She asked us if we wanted 2 new sets and we said yes but without the vegetables. After waiting for 15min, the new bowls came. This time round we found that the braised eggs were not only unusually hard but sour too! Before I left, I feedback to the counter staff. She asked me if the eggs were really sour. I said yes and they should try it and that we had a very experience dining there. I asked her how could the restaurant sell stale food. She just said sorry sorry. That&amp;#39;s all! <br&gt;<br&gt;P/s: The table was not clean with crumbs leftover by previous diners."
flock-café-singapore,hon-bFdldJTHnwPfRDbEzg,"{'link': '/user_details?userid=hon-bFdldJTHnwPfRDbEzg', 'src': 'https://s3-media0.fl.yelpcdn.com/photo/3lbUcUHzpBN8rbwudwTYvA/60s.jpg', 'srcSet': 'https://s3-media0.fl.yelpcdn.com/photo/3lbUcUHzpBN8rbwudwTYvA/ms.jpg 1.67x,https://s3-media0.fl.yelpcdn.com/photo/3lbUcUHzpBN8rbwudwTYvA/120s.jpg 2.00x,https://s3-media0.fl.yelpcdn.com/photo/3lbUcUHzpBN8rbwudwTYvA/90s.jpg 1.50x,https://s3-media0.fl.yelpcdn.com/photo/3lbUcUHzpBN8rbwudwTYvA/168s.jpg 2.80x,https://s3-media0.fl.yelpcdn.com/photo/3lbUcUHzpBN8rbwudwTYvA/180s.jpg 3.00x', 'markupDisplayName': 'Nate N.', 'displayLocation': 'Lone Tree, CO', 'altText': 'Nate N.', 'userUrl': '/user_details?userid=hon-bFdldJTHnwPfRDbEzg', 'partnerAlias': None, 'friendCount': 73, 'photoCount': 278, 'reviewCount': 130, 'eliteYear': 2022}",4,8/1/2019,"[{'src': 'https://s3-media0.fl.yelpcdn.com/bphoto/WPzC09tQqy-3vZH504Gk4w/180s.jpg', 'link': '/biz_photos/flock-caf%C3%A9-singapore?reviewid=PblQO8bU4Xe-YGl0IMJdrg&amp;select=WPzC09tQqy-3vZH504Gk4w', 'altText': 'Photo of Flock Café - Singapore, Singapore. Chicken Alfredo', 'width': 180, 'height': 180, 'caption': 'Chicken Alfredo'}, {'src': 'https://s3-media0.fl.yelpcdn.com/bphoto/gBv36QiHUCDOydK6E2I5YQ/180s.jpg', 'link': '/biz_photos/flock-caf%C3%A9-singapore?reviewid=PblQO8bU4Xe-YGl0IMJdrg&amp;select=gBv36QiHUCDOydK6E2I5YQ', 'altText': 'Photo of Flock Café - Singapore, Singapore. Front counter', 'width': 180, 'height': 180, 'caption': 'Front counter'}, {'src': 'https://s3-media0.fl.yelpcdn.com/bphoto/Zo4ZLQR9C8AyLlXI7r37Zg/180s.jpg', 'link': '/biz_photos/flock-caf%C3%A9-singapore?reviewid=PblQO8bU4Xe-YGl0IMJdrg&amp;select=Zo4ZLQR9C8AyLlXI7r37Zg', 'altText': 'Photo of Flock Café - Singapore, Singapore. Front of cafe', 'width': 180, 'height': 180, 'caption': 'Front of cafe'}, {'src': 'https://s3-media0.fl.yelpcdn.com/bphoto/iVzrxjK1y6pVfiRgd2i_zA/180s.jpg', 'link': '/biz_photos/flock-caf%C3%A9-singapore?reviewid=PblQO8bU4Xe-YGl0IMJdrg&amp;select=iVzrxjK1y6pVfiRgd2i_zA', 'altText': 'Photo of Flock Café - Singapore, Singapore. Strawberry smoothie', 'width': 180, 'height': 180, 'caption': 'Strawberry smoothie'}]",Nate N.,en,"This is a minute walk away from where I&amp;#39;m staying and looked inviting for brunch.  I had a strawberry smoothie, waffles bacon scrambled eggs and avocado for breakfast.  Cool comfortable atmosphere and good selection of breakfast brunch and lunch items on their menu.<br&gt;<br&gt;Will definitely come again for brunch or lunch"
flock-café-singapore,8Rfj4OjX4G3-18M8eYWfbA,"{'link': '/user_details?userid=8Rfj4OjX4G3-18M8eYWfbA', 'src': 'https://s3-media0.fl.yelpcdn.com/photo/mv8m4p3yYGVZsSDwvljOBQ/60s.jpg', 'srcSet': 'https://s3-media0.fl.yelpcdn.com/photo/mv8m4p3yYGVZsSDwvljOBQ/ms.jpg 1.67x,https://s3-media0.fl.yelpcdn.com/photo/mv8m4p3yYGVZsSDwvljOBQ/120s.jpg 2.00x,https://s3-media0.fl.yelpcdn.com/photo/mv8m4p3yYGVZsSDwvljOBQ/90s.jpg 1.50x,https://s3-media0.fl.yelpcdn.com/photo/mv8m4p3yYGVZsSDwvljOBQ/168s.jpg 2.80x,https://s3-media0.fl.yelpcdn.com/photo/mv8m4p3yYGVZsSDwvljOBQ/180s.jpg 3.00x', 'markupDisplayName': 'Na N.', 'displayLocation': 'Pasadena, CA', 'altText': 'Na N.', 'userUrl': '/user_details?userid=8Rfj4OjX4G3-18M8eYWfbA', 'partnerAlias': None, 'friendCount': 2, 'photoCount': 178, 'reviewCount': 114, 'eliteYear': None}",3,5/6/2022,"[{'src': 'https://s3-media0.fl.yelpcdn.com/bphoto/TmSWUqy-RL6lmU59adjl9A/180s.jpg', 'link': '/biz_photos/flock-caf%C3%A9-singapore?reviewid=5POtnUQ9aExFTuaEMl9PGQ&amp;select=TmSWUqy-RL6lmU59adjl9A', 'altText': 'Photo of Flock Café - Singapore, Singapore. View from cafe', 'width': 180, 'height': 180, 'caption': 'View from cafe'}, {'src': 'https://s3-media0.fl.yelpcdn.com/bphoto/H3ROnXzEVMWKq-_6JVPNbA/180s.jpg', 'link': '/biz_photos/flock-caf%C3%A9-singapore?reviewid=5POtnUQ9aExFTuaEMl9PGQ&amp;select=H3ROnXzEVMWKq-_6JVPNbA', 'altText': 'Photo of Flock Café - Singapore, Singapore. Outdoor patio', 'width': 180, 'height': 180, 'caption': 'Outdoor patio'}, {'src': 'https://s3-media0.fl.yelpcdn.com/bphoto/p9LiziIEzOwMW3JBry7spQ/180s.jpg', 'link': '/biz_photos/flock-caf%C3%A9-singapore?reviewid=5POtnUQ9aExFTuaEMl9PGQ&amp;select=p9LiziIEzOwMW3JBry7spQ', 'altText': 'Photo of Flock Café - Singapore, Singapore. Scrambled eggs &amp;amp; salmon croissant with Cappucino; Avocado toast with Long Black', 'width': 180, 'height': 180, 'caption': 'Scrambled eggs &amp; salmon croissant with Cappucino; Avocado toast with Long Black'}]",Na N.,en,"Coincidentally passed after morning walk. <br&gt;<br&gt;Outdoor is the first option for me as I&amp;#39;m craving fresh air.<br&gt;<br&gt;Preferred scrambled eggs and salmon croissant vs Avocado Toast. Coffee is alright. Not strong enough for me. It taste Robusta. <br&gt;<br&gt;Overall, price is quite high with the portion and taste wise. <br&gt;Plus serving is so-so."
flock-café-singapore,oGtf2Wbi2Wq6TTJecDZFMQ,"{'link': '/user_details?userid=oGtf2Wbi2Wq6TTJecDZFMQ', 'src': 'https://s3-media0.fl.yelpcdn.com/photo/u9rvUXlNujpVRC8bb6Arig/60s.jpg', 'srcSet': 'https://s3-media0.fl.yelpcdn.com/photo/u9rvUXlNujpVRC8bb6Arig/ms.jpg 1.67x,https://s3-media0.fl.yelpcdn.com/photo/u9rvUXlNujpVRC8bb6Arig/120s.jpg 2.00x,https://s3-media0.fl.yelpcdn.com/photo/u9rvUXlNujpVRC8bb6Arig/90s.jpg 1.50x,https://s3-media0.fl.yelpcdn.com/photo/u9rvUXlNujpVRC8bb6Arig/168s.jpg 2.80x,https://s3-media0.fl.yelpcdn.com/photo/u9rvUXlNujpVRC8bb6Arig/180s.jpg 3.00x', 'markupDisplayName': 'Jason L.', 'displayLocation': 'Singapore, Singapore', 'altText': 'Jason L.', 'userUrl': '/user_details?userid=oGtf2Wbi2Wq6TTJecDZFMQ', 'partnerAlias': None, 'friendCount': 52, 'photoCount': 839, 'reviewCount': 142, 'eliteYear': None}",3,4/9/2019,"[{'src': 'https://s3-media0.fl.yelpcdn.com/bphoto/6aHrhHMRY2QrqryfYW0PEA/180s.jpg', 'link': '/biz_photos/flock-caf%C3%A9-singapore?reviewid=ifOe3VMIOSMdfcSVagtJzA&amp;select=6aHrhHMRY2QrqryfYW0PEA', 'altText': 'Photo of Flock Café - Singapore, Singapore', 'width': 180, 'height': 180, 'caption': None}, {'src': 'https://s3-media0.fl.yelpcdn.com/bphoto/bOrThsuenJGtN6NrzLgRsg/180s.jpg', 'link': '/biz_photos/flock-caf%C3%A9-singapore?reviewid=ifOe3VMIOSMdfcSVagtJzA&amp;select=bOrThsuenJGtN6NrzLgRsg', 'altText': 'Photo of Flock Café - Singapore, Singapore', 'width': 180, 'height': 180, 'caption': None}, {'src': 'https://s3-media0.fl.yelpcdn.com/bphoto/fVeXPnjmNuTnGIoBwSztcQ/180s.jpg', 'link': '/biz_photos/flock-caf%C3%A9-singapore?reviewid=ifOe3VMIOSMdfcSVagtJzA&amp;select=fVeXPnjmNuTnGIoBwSztcQ', 'altText': 'Photo of Flock Café - Singapore, Singapore. A dead ant on the lettuce', 'width': 180, 'height': 180, 'caption': 'A dead ant on the lettuce'}]",Jason L.,en,"Flock or Flop?<br&gt;<br&gt;Had wanted to have lunch Hua Bee Restaurant but had unfortunately got there too late. <br&gt;<br&gt;Deciding that it was way too hot and we were way too hungry to look elsewhere, we decided to give Flock Cafe a try, seeing how popular it was. <br&gt;<br&gt;Flock&amp;#39;s Scrambled Eggs and Toast($7.50 + $2.50 for a side of baked beans) <br&gt;I have to admit, the scrambled eggs were pretty decent. Good texture, not over cooked. The sautéed mushrooms were forgettable, baked beans were.... well.... tasted canned and the sourdough was unfortunately pretty hard and crunchy (almost like a crouton). <br&gt;<br&gt;Scrambled Eggs &amp;amp; Croissant w/ Crispy Bacon ($15.90)<br&gt;<br&gt;Scrambled Eggs, consistent with mine so that&amp;#39;s a good sign. The croissant was pretty buttery and was nice and flakey. Bacons were fried nice and crispy (although I&amp;#39;m more of the juicy tender bacon person than the crispy sort).<br&gt;The salad was an after though and came looking a bit limp and old. The most disappointing? The salad wasn&amp;#39;t washed clean. The wife was just about to take a bit and suddenly noticed a dead ant on one of the lettuce leaves. Tsk tsk. Big disappointment. <br&gt;<br&gt;Overall, while the Eggs were pretty good but everything else seemed like an after though. Definitely not a place we&amp;#39;re chose to come back to."
