shop,userid,userinfo,rating,date,photos,username,language,text
ya-kun-kaya-toast-singapore-20,CWc7mlNrgpPOKGX6Tw4B4g,"{'link': '/user_details?userid=CWc7mlNrgpPOKGX6Tw4B4g', 'src': 'https://s3-media0.fl.yelpcdn.com/photo/u5cWyKRwBx6N43CJEEiDvg/60s.jpg', 'srcSet': 'https://s3-media0.fl.yelpcdn.com/photo/u5cWyKRwBx6N43CJEEiDvg/ms.jpg 1.67x,https://s3-media0.fl.yelpcdn.com/photo/u5cWyKRwBx6N43CJEEiDvg/120s.jpg 2.00x,https://s3-media0.fl.yelpcdn.com/photo/u5cWyKRwBx6N43CJEEiDvg/90s.jpg 1.50x,https://s3-media0.fl.yelpcdn.com/photo/u5cWyKRwBx6N43CJEEiDvg/168s.jpg 2.80x,https://s3-media0.fl.yelpcdn.com/photo/u5cWyKRwBx6N43CJEEiDvg/180s.jpg 3.00x', 'markupDisplayName': 'Iggy I.', 'displayLocation': 'Midway City, CA', 'altText': 'Iggy I.', 'userUrl': '/user_details?userid=CWc7mlNrgpPOKGX6Tw4B4g', 'partnerAlias': None, 'friendCount': 960, 'photoCount': 2456, 'reviewCount': 320, 'eliteYear': None}",4,12/30/2018,"[{'src': 'https://s3-media0.fl.yelpcdn.com/bphoto/XOAnVOyeOA4pS1JGjCTLUA/180s.jpg', 'link': '/biz_photos/ya-kun-kaya-toast-singapore-20?reviewid=hHfj5VxVkfYdVSiT4fAppA&amp;select=XOAnVOyeOA4pS1JGjCTLUA', 'altText': 'Photo of Ya Kun Kaya Toast - Singapore, Singapore', 'width': 180, 'height': 180, 'caption': None}, {'src': 'https://s3-media0.fl.yelpcdn.com/bphoto/iVqapvjjTt1BADPDjGYDbw/180s.jpg', 'link': '/biz_photos/ya-kun-kaya-toast-singapore-20?reviewid=hHfj5VxVkfYdVSiT4fAppA&amp;select=iVqapvjjTt1BADPDjGYDbw', 'altText': 'Photo of Ya Kun Kaya Toast - Singapore, Singapore', 'width': 180, 'height': 180, 'caption': None}, {'src': 'https://s3-media0.fl.yelpcdn.com/bphoto/_9roBKxUMKJ4FhIYTY2FNw/180s.jpg', 'link': '/biz_photos/ya-kun-kaya-toast-singapore-20?reviewid=hHfj5VxVkfYdVSiT4fAppA&amp;select=_9roBKxUMKJ4FhIYTY2FNw', 'altText': 'Photo of Ya Kun Kaya Toast - Singapore, Singapore', 'width': 180, 'height': 180, 'caption': None}, {'src': 'https://s3-media0.fl.yelpcdn.com/bphoto/YjgOnDmkubus3J7M3V056Q/180s.jpg', 'link': '/biz_photos/ya-kun-kaya-toast-singapore-20?reviewid=hHfj5VxVkfYdVSiT4fAppA&amp;select=YjgOnDmkubus3J7M3V056Q', 'altText': 'Photo of Ya Kun Kaya Toast - Singapore, Singapore', 'width': 180, 'height': 180, 'caption': None}]",Iggy I.,en,"I found the Asian secret to staying Skinny in Singapore. Eat here. The toast you eat is one piece of bread, open up the middle of the bread and stuff it with yummy stuff. Cut down the need for eating 2 pieces of bread (excess carbs) in a sandwich. I also found the secret why Singapore is SO Clean. No trash or junk on the ground. There are no napkins at restaurants. So no opportunity for you to litter your napkins on the ground. And we bring our own tissue."
ya-kun-kaya-toast-singapore-20,dBBQLSNK3xyowDow3wSQLg,"{'link': '/user_details?userid=dBBQLSNK3xyowDow3wSQLg', 'src': 'https://s3-media0.fl.yelpcdn.com/photo/5z9e8UXjEsPIm4LFtWn_Gw/60s.jpg', 'srcSet': 'https://s3-media0.fl.yelpcdn.com/photo/5z9e8UXjEsPIm4LFtWn_Gw/ms.jpg 1.67x,https://s3-media0.fl.yelpcdn.com/photo/5z9e8UXjEsPIm4LFtWn_Gw/120s.jpg 2.00x,https://s3-media0.fl.yelpcdn.com/photo/5z9e8UXjEsPIm4LFtWn_Gw/90s.jpg 1.50x,https://s3-media0.fl.yelpcdn.com/photo/5z9e8UXjEsPIm4LFtWn_Gw/168s.jpg 2.80x,https://s3-media0.fl.yelpcdn.com/photo/5z9e8UXjEsPIm4LFtWn_Gw/180s.jpg 3.00x', 'markupDisplayName': 'Tammi T.', 'displayLocation': 'Orange County, CA', 'altText': 'Tammi T.', 'userUrl': '/user_details?userid=dBBQLSNK3xyowDow3wSQLg', 'partnerAlias': None, 'friendCount': 104, 'photoCount': 74, 'reviewCount': 451, 'eliteYear': None}",4,6/29/2013,[],Tammi T.,en,"Forget Starbucks, whenever there&amp;#39;s Yakun I head straight for its coffee. Not all local coffee shops are the same, Yakun is just richer and has its own unique flavor. <br&gt;Whenever I go shopping at Far East Plaza I recharge at this outlet when I&amp;#39;m tired from walking."
ya-kun-kaya-toast-singapore-20,C3XbF6HcAsieBxIR68E8FA,"{'link': '/user_details?userid=C3XbF6HcAsieBxIR68E8FA', 'src': 'https://s3-media0.fl.yelpcdn.com/assets/srv0/yelp_styleguide/514f6997a318/assets/img/default_avatars/user_60_square.png', 'srcSet': None, 'markupDisplayName': 'gem g.', 'displayLocation': 'Whitehall, PA', 'altText': 'gem g.', 'userUrl': '/user_details?userid=C3XbF6HcAsieBxIR68E8FA', 'partnerAlias': None, 'friendCount': 0, 'photoCount': 17, 'reviewCount': 89, 'eliteYear': None}",2,12/29/2015,[],gem g.,en,Avg food and drink. Not much to cheer . This is regular and no i got to have it factor. Sorry cannot give 5 stars. My wife kaya taste better than yours.
ya-kun-kaya-toast-singapore-20,L5qnan1MZhuF8LetcU-Ziw,"{'link': '/user_details?userid=L5qnan1MZhuF8LetcU-Ziw', 'src': 'https://s3-media0.fl.yelpcdn.com/photo/46gyKGzTxvZuuvKvqp2E8g/60s.jpg', 'srcSet': 'https://s3-media0.fl.yelpcdn.com/photo/46gyKGzTxvZuuvKvqp2E8g/ms.jpg 1.67x,https://s3-media0.fl.yelpcdn.com/photo/46gyKGzTxvZuuvKvqp2E8g/120s.jpg 2.00x,https://s3-media0.fl.yelpcdn.com/photo/46gyKGzTxvZuuvKvqp2E8g/90s.jpg 1.50x,https://s3-media0.fl.yelpcdn.com/photo/46gyKGzTxvZuuvKvqp2E8g/168s.jpg 2.80x,https://s3-media0.fl.yelpcdn.com/photo/46gyKGzTxvZuuvKvqp2E8g/180s.jpg 3.00x', 'markupDisplayName': 'Shu Ling T.', 'displayLocation': 'Singapore, Singapore', 'altText': 'Shu Ling T.', 'userUrl': '/user_details?userid=L5qnan1MZhuF8LetcU-Ziw', 'partnerAlias': None, 'friendCount': 7, 'photoCount': 347, 'reviewCount': 330, 'eliteYear': None}",4,8/28/2012,[],Shu Ling T.,en,"This is one of the Ya Kun outlets that is always buzzing with activity. It is quite a nice place to rest your feet after a whole day of shopping. The service is good, and there are considerably a lot of seats for such a small shop space. I like that their staff are familiar with the regulars and make friendly exchanges. The taste of the food and drink is also up to the Ya Kun standard; nothing that needs to be complained about really."
qiji-singapore-3,8Stq_lmhHw8Gt459P_4c7g,"{'link': '/user_details?userid=8Stq_lmhHw8Gt459P_4c7g', 'src': 'https://s3-media0.fl.yelpcdn.com/photo/-sBfGGGvRLrlhQhhpmgjsQ/60s.jpg', 'srcSet': 'https://s3-media0.fl.yelpcdn.com/photo/-sBfGGGvRLrlhQhhpmgjsQ/ms.jpg 1.67x,https://s3-media0.fl.yelpcdn.com/photo/-sBfGGGvRLrlhQhhpmgjsQ/120s.jpg 2.00x,https://s3-media0.fl.yelpcdn.com/photo/-sBfGGGvRLrlhQhhpmgjsQ/90s.jpg 1.50x,https://s3-media0.fl.yelpcdn.com/photo/-sBfGGGvRLrlhQhhpmgjsQ/168s.jpg 2.80x,https://s3-media0.fl.yelpcdn.com/photo/-sBfGGGvRLrlhQhhpmgjsQ/180s.jpg 3.00x', 'markupDisplayName': 'Ping L.', 'displayLocation': 'Parkland, FL', 'altText': 'Ping L.', 'userUrl': '/user_details?userid=8Stq_lmhHw8Gt459P_4c7g', 'partnerAlias': None, 'friendCount': 70, 'photoCount': 108, 'reviewCount': 177, 'eliteYear': None}",4,5/2/2016,"[{'src': 'https://s3-media0.fl.yelpcdn.com/bphoto/yghVOY1_NGQ7B4_r94q9xg/300s.jpg', 'link': '/biz_photos/qiji-singapore-3?reviewid=OHdxIgBZ-culR3wsiUdbCg&amp;select=yghVOY1_NGQ7B4_r94q9xg', 'altText': 'Photo of Qiji - Singapore, Singapore. Tauhu goreng (Deep fried beancurd)', 'width': 300, 'height': 300, 'caption': 'Tauhu goreng (Deep fried beancurd)'}]",Ping L.,en,"Star Visa food options are geared more for the expats staying around the area. Qiji provides an option for those looking for everyday price options. They serve the local favorites, ranging from Nasi Lemak to Mee Siam. For just below $5, you can get a complete set of Nasi Lemak that comes with a fried chicken or fried fish.<br&gt;<br&gt;The seatings are cleaner and in an air-conditioned environment although you are paying for hawker food prices. The staff are mostly friendly although there is one or two that don&amp;#39;t seem to understand English. <br&gt;<br&gt;Flavor-wise, they are as good as the Ananas but with a bigger portion and freshly prepared. Recommend if you want something cheap and fast!"
jim-foods-supplier-singapore,hC1HjO-Tye6dar3Bg0aZMw,"{'link': '/user_details?userid=hC1HjO-Tye6dar3Bg0aZMw', 'src': 'https://s3-media0.fl.yelpcdn.com/photo/pvQ1NZZ0ALsrMNkY0go8sw/60s.jpg', 'srcSet': 'https://s3-media0.fl.yelpcdn.com/photo/pvQ1NZZ0ALsrMNkY0go8sw/ms.jpg 1.67x,https://s3-media0.fl.yelpcdn.com/photo/pvQ1NZZ0ALsrMNkY0go8sw/120s.jpg 2.00x,https://s3-media0.fl.yelpcdn.com/photo/pvQ1NZZ0ALsrMNkY0go8sw/90s.jpg 1.50x,https://s3-media0.fl.yelpcdn.com/photo/pvQ1NZZ0ALsrMNkY0go8sw/168s.jpg 2.80x,https://s3-media0.fl.yelpcdn.com/photo/pvQ1NZZ0ALsrMNkY0go8sw/180s.jpg 3.00x', 'markupDisplayName': 'Huiyin S.', 'displayLocation': 'Singapore, Singapore', 'altText': 'Huiyin S.', 'userUrl': '/user_details?userid=hC1HjO-Tye6dar3Bg0aZMw', 'partnerAlias': None, 'friendCount': 5, 'photoCount': 259, 'reviewCount': 230, 'eliteYear': None}",5,8/9/2012,"[{'src': 'https://s3-media0.fl.yelpcdn.com/bphoto/W0RUXt7NhtOKRj7QGuryuw/300s.jpg', 'link': '/biz_photos/jim-foods-supplier-singapore?reviewid=g3VbMybbQ8pZ4Xu1ZWo0ug&amp;select=W0RUXt7NhtOKRj7QGuryuw', 'altText': 'Photo of Jim Foods Supplier - Singapore, Singapore', 'width': 300, 'height': 300, 'caption': ''}]",Huiyin S.,en,"Located at a quiet corner near Serangoon Stadium, Jim Foods Supplier is probably one of the safer bets when it comes to getting fresh seafood - especially crabs. The juicy, succulent, sweet kind. My cousins swear by this shop: they come here regularly when they want their monthly fix of crabs and other seafood for grilling and barbecuing. The shop prides itself on being a major importer of the latter, and starts selling them in the early morning. The shop opens as early as 7-8am.<br&gt;<br&gt;If you&amp;#39;re looking for fresh scallops in amounts equalling or exceeding 0.5kg, Jim Foods deals with high-quality frozen scallops (I had a quote of $18 for half a kg). You should call ahead in the morning (maybe 8am or so) to check if they have them available before you head down. On one occasion, I called at 11am and they said they had run out. On another occasion, I reached the place at around 8.45am and the person there told me that availability for scallops was never an issue. In light of contradictory evidence, it&amp;#39;s best you play safe and call first!"
jim-foods-supplier-singapore,v8qGcoS2C-85RBofEYOwWg,"{'link': '/user_details?userid=v8qGcoS2C-85RBofEYOwWg', 'src': 'https://s3-media0.fl.yelpcdn.com/assets/srv0/yelp_styleguide/514f6997a318/assets/img/default_avatars/user_60_square.png', 'srcSet': None, 'markupDisplayName': 'Tan P.', 'displayLocation': 'Singapore, Singapore', 'altText': 'Tan P.', 'userUrl': '/user_details?userid=v8qGcoS2C-85RBofEYOwWg', 'partnerAlias': None, 'friendCount': 0, 'photoCount': None, 'reviewCount': 1, 'eliteYear': None}",4,3/16/2013,[],Tan P.,en,"if you are looking for crabs of good quality then this is the place to buy. they might not have the cheapest price around town but the quality and freshness can always be assured. i&amp;#39;ve been buying crabs for my family from them since a few years ago and i can say that they have the freshest crabs. they also have quite a large variety of frozen foods selling a a cheaper price than ntuc. i always buy frozen food and crabs for any steamboat parties i have. but be sure to call them in advance to ask if they have any crabs left as on some occasions that i make the trip down, the crabs have already been sold out or are reserved so remember to call to avoid disappointment. i heard from a few friends that they supply to coffee shops, restaurants and large scale hotels all over singapore!"
ps-cafe-singapore-9,StgCZRGuZwphZNtpWsjBRg,"{'link': '/user_details?userid=StgCZRGuZwphZNtpWsjBRg', 'src': 'https://s3-media0.fl.yelpcdn.com/photo/KEGjRp5M2M0RZpGo7YXUhw/60s.jpg', 'srcSet': 'https://s3-media0.fl.yelpcdn.com/photo/KEGjRp5M2M0RZpGo7YXUhw/ms.jpg 1.67x,https://s3-media0.fl.yelpcdn.com/photo/KEGjRp5M2M0RZpGo7YXUhw/120s.jpg 2.00x,https://s3-media0.fl.yelpcdn.com/photo/KEGjRp5M2M0RZpGo7YXUhw/90s.jpg 1.50x,https://s3-media0.fl.yelpcdn.com/photo/KEGjRp5M2M0RZpGo7YXUhw/168s.jpg 2.80x,https://s3-media0.fl.yelpcdn.com/photo/KEGjRp5M2M0RZpGo7YXUhw/180s.jpg 3.00x', 'markupDisplayName': 'Asma A.', 'displayLocation': 'Atlanta, GA', 'altText': 'Asma A.', 'userUrl': '/user_details?userid=StgCZRGuZwphZNtpWsjBRg', 'partnerAlias': None, 'friendCount': 114, 'photoCount': 138, 'reviewCount': 469, 'eliteYear': 2022}",2,9/16/2019,[],Asma A.,en,Came here for coffee only-- the coffee was not good at all.. very disappointed.<br&gt;<br&gt;Food prices are pretty expensive too-- I would give this place a $$$. I really wish they had a outdoor seating area that wasn&amp;#39;t enclosed in glass. <br&gt;<br&gt;Staff is friendly. Overall not impressed.
ps-cafe-singapore-9,9eXnvnPsuenlW0oFxQvzJg,"{'link': '/user_details?userid=9eXnvnPsuenlW0oFxQvzJg', 'src': 'https://s3-media0.fl.yelpcdn.com/photo/2hYW0obGMrWF_qu5PGzhxg/60s.jpg', 'srcSet': 'https://s3-media0.fl.yelpcdn.com/photo/2hYW0obGMrWF_qu5PGzhxg/ms.jpg 1.67x,https://s3-media0.fl.yelpcdn.com/photo/2hYW0obGMrWF_qu5PGzhxg/120s.jpg 2.00x,https://s3-media0.fl.yelpcdn.com/photo/2hYW0obGMrWF_qu5PGzhxg/90s.jpg 1.50x,https://s3-media0.fl.yelpcdn.com/photo/2hYW0obGMrWF_qu5PGzhxg/168s.jpg 2.80x,https://s3-media0.fl.yelpcdn.com/photo/2hYW0obGMrWF_qu5PGzhxg/180s.jpg 3.00x', 'markupDisplayName': 'Kevin D.', 'displayLocation': 'New York, NY', 'altText': 'Kevin D.', 'userUrl': '/user_details?userid=9eXnvnPsuenlW0oFxQvzJg', 'partnerAlias': None, 'friendCount': 1, 'photoCount': 28, 'reviewCount': 2, 'eliteYear': None}",3,10/1/2021,[],Kevin D.,en,"The food was good even though a little over priced, but I&amp;#39;m guessing you are paying for the location. There is a few good view of the Bay but I wish it was an open outdoor instead of glass enclosed but still nice view."
ps-cafe-singapore-9,uPspCTs9oNCrkaWI7BlTkQ,"{'link': '/user_details?userid=uPspCTs9oNCrkaWI7BlTkQ', 'src': 'https://s3-media0.fl.yelpcdn.com/photo/yv2EZO32cI7PpD3CsXt02A/60s.jpg', 'srcSet': 'https://s3-media0.fl.yelpcdn.com/photo/yv2EZO32cI7PpD3CsXt02A/ms.jpg 1.67x,https://s3-media0.fl.yelpcdn.com/photo/yv2EZO32cI7PpD3CsXt02A/120s.jpg 2.00x,https://s3-media0.fl.yelpcdn.com/photo/yv2EZO32cI7PpD3CsXt02A/90s.jpg 1.50x,https://s3-media0.fl.yelpcdn.com/photo/yv2EZO32cI7PpD3CsXt02A/168s.jpg 2.80x,https://s3-media0.fl.yelpcdn.com/photo/yv2EZO32cI7PpD3CsXt02A/180s.jpg 3.00x', 'markupDisplayName': 'Dino S.', 'displayLocation': 'Stanford, CA', 'altText': 'Dino S.', 'userUrl': '/user_details?userid=uPspCTs9oNCrkaWI7BlTkQ', 'partnerAlias': None, 'friendCount': 8, 'photoCount': 3, 'reviewCount': 12, 'eliteYear': None}",2,10/7/2017,[],Dino S.,en,Not accommodative host. Don&amp;#39;t bother turning up without reservation. <br&gt;1015am Sunday 8 Oct. we turn up with no reservation to a half empty restaurant and must have reservation to sit because of incoming reservations at 11am. They couldn&amp;#39;t turn us around even after we offer to leave by 11am. Also couldn&amp;#39;t sit in bar area as it only for drinking not eating.
ps-cafe-singapore-9,lbGL5-4bnZXskSoF7853UA,"{'link': '/user_details?userid=lbGL5-4bnZXskSoF7853UA', 'src': 'https://s3-media0.fl.yelpcdn.com/assets/srv0/yelp_styleguide/514f6997a318/assets/img/default_avatars/user_60_square.png', 'srcSet': None, 'markupDisplayName': 'Anthony L.', 'displayLocation': 'Bedok, Singapore, Singapore', 'altText': 'Anthony L.', 'userUrl': '/user_details?userid=lbGL5-4bnZXskSoF7853UA', 'partnerAlias': None, 'friendCount': 0, 'photoCount': None, 'reviewCount': 1, 'eliteYear': None}",1,2/3/2018,[],Anthony L.,en,"Worst place I have ever been to. After order our food for 50mins still no food showing up on our table. Every time I asked, is another 8 mins, another 5 mins, and so on, till we got so fedup and we just walk out. The waitress and manager dont bother to ask if we would like to have something first while waiting for the food even when we told them we are very hungry. Totally not customer oriented."
jenny-bakery-singapore-singapore-2,SzJ3Fcmj_qFTI5_JrMhZEw,"{'link': '/user_details?userid=SzJ3Fcmj_qFTI5_JrMhZEw', 'src': 'https://s3-media0.fl.yelpcdn.com/photo/yHGbDXcT5QK2MDPkW4NMdQ/60s.jpg', 'srcSet': 'https://s3-media0.fl.yelpcdn.com/photo/yHGbDXcT5QK2MDPkW4NMdQ/ms.jpg 1.67x,https://s3-media0.fl.yelpcdn.com/photo/yHGbDXcT5QK2MDPkW4NMdQ/120s.jpg 2.00x,https://s3-media0.fl.yelpcdn.com/photo/yHGbDXcT5QK2MDPkW4NMdQ/90s.jpg 1.50x,https://s3-media0.fl.yelpcdn.com/photo/yHGbDXcT5QK2MDPkW4NMdQ/168s.jpg 2.80x,https://s3-media0.fl.yelpcdn.com/photo/yHGbDXcT5QK2MDPkW4NMdQ/180s.jpg 3.00x', 'markupDisplayName': 'Jeannie L.', 'displayLocation': 'Singapore, Singapore', 'altText': 'Jeannie L.', 'userUrl': '/user_details?userid=SzJ3Fcmj_qFTI5_JrMhZEw', 'partnerAlias': None, 'friendCount': 28, 'photoCount': 391, 'reviewCount': 228, 'eliteYear': None}",4,3/20/2016,[],Jeannie L.,en,"Crumbly, melt-in-your-mouth butter cookies fresh from Hong Kong. <br&gt;<br&gt;This *is* the famed Jenny Bakery from Hong Kong, and Singapore is the FIRST official store outside HK. The fresh butter cookies are airflown directly from HK factory to Singapore by DHL.<br&gt;<br&gt;Just like in Hong Kong, the cookies come in their signature teddy bear tin. Not every cookie flavor is available, and payment is cash only. Each customer is restricted to a maximum 3 tin purchase, stock is limited, and they might sell out early so call ahead. You can also reserve cookies online on their website, for in-store pickup.<br&gt;<br&gt;I have no idea why their first store is buried under a nondescript block of apartments in Ang Mo Kio. It&amp;#39;s a short hike from Ang Mo Kio MRT station, but it&amp;#39;s not visible from the street. Check the directions on google maps before going there.<br&gt;<br&gt;I personally like the coffee flavored cookie, but I find the price of S$45 for the large can of cookies rather steep. (The small can costs S$25) It&amp;#39;s much cheaper buying them in Hong Kong but hey - the trip to Ang Mo Kio is much nearer."
jard-by-sarnies-singapore,5mOW6BKTYPVa1OPyLStVFg,"{'link': '/user_details?userid=5mOW6BKTYPVa1OPyLStVFg', 'src': 'https://s3-media0.fl.yelpcdn.com/photo/fPitMRdkz8Jb302v6_4CgA/60s.jpg', 'srcSet': 'https://s3-media0.fl.yelpcdn.com/photo/fPitMRdkz8Jb302v6_4CgA/ms.jpg 1.67x,https://s3-media0.fl.yelpcdn.com/photo/fPitMRdkz8Jb302v6_4CgA/120s.jpg 2.00x,https://s3-media0.fl.yelpcdn.com/photo/fPitMRdkz8Jb302v6_4CgA/90s.jpg 1.50x,https://s3-media0.fl.yelpcdn.com/photo/fPitMRdkz8Jb302v6_4CgA/168s.jpg 2.80x,https://s3-media0.fl.yelpcdn.com/photo/fPitMRdkz8Jb302v6_4CgA/180s.jpg 3.00x', 'markupDisplayName': 'Sonia T.', 'displayLocation': 'Hong Kong', 'altText': 'Sonia T.', 'userUrl': '/user_details?userid=5mOW6BKTYPVa1OPyLStVFg', 'partnerAlias': None, 'friendCount': 562, 'photoCount': 13, 'reviewCount': 942, 'eliteYear': None}",3,9/7/2016,[],Sonia T.,en,"Working in Asia Square, I am always on the hunt for a quick, healthy lunch.  Always.  So, when a collegue read that Jar&amp;#39;d by Sarnies opened up, I was all for it.  I had been making salads in jars for a few years (thanks to Pintrest) and was curious how this idea was going to translate to a business.  I loved the branding, and the concept, and the fact that I could keep the jar, so off we went to the Raffles basement to get our salads.  It&amp;#39;s a small little kiosk like everything else down there, but easy enough to find.  They had a few options, a vegetarian zoodle (zucchini noodles I think with a thai dressing) a chicken pesto one, a tuna one, and one other one I forgot.  They also serve them in two sizes, and the prices vary depending on the protein.  My friend got the vegetarian one ($14) and I went for the tuna one ($16) both were the smaller jars, but the salad was quite a bit, and I only finished about half.  They also serve coffee, and this coconut whip thingy that is supposed to be like soft serve, but according to my friend who had it tasted like nothing.  I have to admit my tuna one was pretty disappointing.  It had seaweed (which was just weird, and the taste was off putting) as well as lots of other good veggies.  The tuna was good and fresh, and I liked the dressing.  I really think the seaweed just killed it.    My friend who had the veg said that there was just no flavor, and needed more spice, or a stronger dressing to help the lack of protein.  You do get a $1 off if you bring back the jar.I&amp;#39;ll go back and get the chicken pesto and try and it, as the service was really good, it was quick, kinda decently priced, and I really like the concept."
wild-honey-singapore-3,aFXnLTwv-dWdbFC-2b-kdg,"{'link': '/user_details?userid=aFXnLTwv-dWdbFC-2b-kdg', 'src': 'https://s3-media0.fl.yelpcdn.com/photo/E1egjQwujJpQ-eOVR_FDiA/60s.jpg', 'srcSet': 'https://s3-media0.fl.yelpcdn.com/photo/E1egjQwujJpQ-eOVR_FDiA/ms.jpg 1.67x,https://s3-media0.fl.yelpcdn.com/photo/E1egjQwujJpQ-eOVR_FDiA/120s.jpg 2.00x,https://s3-media0.fl.yelpcdn.com/photo/E1egjQwujJpQ-eOVR_FDiA/90s.jpg 1.50x,https://s3-media0.fl.yelpcdn.com/photo/E1egjQwujJpQ-eOVR_FDiA/168s.jpg 2.80x,https://s3-media0.fl.yelpcdn.com/photo/E1egjQwujJpQ-eOVR_FDiA/180s.jpg 3.00x', 'markupDisplayName': 'Gaik Ni Esther L.', 'displayLocation': 'Singapore, Singapore', 'altText': 'Gaik Ni Esther L.', 'userUrl': '/user_details?userid=aFXnLTwv-dWdbFC-2b-kdg', 'partnerAlias': None, 'friendCount': 12, 'photoCount': 263, 'reviewCount': 70, 'eliteYear': None}",4,8/12/2017,"[{'src': 'https://s3-media0.fl.yelpcdn.com/bphoto/ZEZWN0nBP1q-lqj_nViCzg/300s.jpg', 'link': '/biz_photos/wild-honey-singapore-3?reviewid=B_2r7vgxEGdfukynN6rJFQ&amp;select=ZEZWN0nBP1q-lqj_nViCzg', 'altText': 'Photo of Wild Honey - Singapore, Singapore. Brownie with vanilla ice cream', 'width': 300, 'height': 300, 'caption': 'Brownie with vanilla ice cream'}, {'src': 'https://s3-media0.fl.yelpcdn.com/bphoto/p0ifY8sVSC95CDLjlErS5w/300s.jpg', 'link': '/biz_photos/wild-honey-singapore-3?reviewid=B_2r7vgxEGdfukynN6rJFQ&amp;select=p0ifY8sVSC95CDLjlErS5w', 'altText': 'Photo of Wild Honey - Singapore, Singapore. Scandinavian', 'width': 300, 'height': 300, 'caption': 'Scandinavian'}]",Gaik Ni Esther L.,en,"Late lunch.. found this place inside the Scott Plaza. <br&gt;Surprisingly, it&amp;#39;s almost full house at 3pm+. Ordered a cold brew single origin. It was actually quite good, even slightly better than Starbucks and far better than TCC. And the price is reasonable $5.50. <br&gt;I ordered the all day breakfast, Scandinavian. Salmon wrapped with asparagus, on top of deep fried thin hash brown (I hope I got it right), drizzled with hollandaise dressing. Sadly, I didn&amp;#39;t like it. Not at all. Especially I didn&amp;#39;t know what to do with the tomatoes. The deep fried &amp;#34;nest&amp;#34; made of hash brown was very tough and oily, I was slightly worry about it flew out of my plate when I cut it with knife. That would be embarrassing. I didn&amp;#39;t finish the main, I thus ordered a brownie with vanilla ice cream. Not bad! Good for sharing. Too much for one person. <br&gt;Conclusion, a place good for coffee and dessert."
wild-honey-singapore-3,bqJNDwrpF-vULjAVAh_LyQ,"{'link': '/user_details?userid=bqJNDwrpF-vULjAVAh_LyQ', 'src': 'https://s3-media0.fl.yelpcdn.com/photo/85ok9UcLdTkw87AcvQOHxQ/60s.jpg', 'srcSet': 'https://s3-media0.fl.yelpcdn.com/photo/85ok9UcLdTkw87AcvQOHxQ/ms.jpg 1.67x,https://s3-media0.fl.yelpcdn.com/photo/85ok9UcLdTkw87AcvQOHxQ/120s.jpg 2.00x,https://s3-media0.fl.yelpcdn.com/photo/85ok9UcLdTkw87AcvQOHxQ/90s.jpg 1.50x,https://s3-media0.fl.yelpcdn.com/photo/85ok9UcLdTkw87AcvQOHxQ/168s.jpg 2.80x,https://s3-media0.fl.yelpcdn.com/photo/85ok9UcLdTkw87AcvQOHxQ/180s.jpg 3.00x', 'markupDisplayName': 'Christina N.', 'displayLocation': 'Redwood City, CA', 'altText': 'Christina N.', 'userUrl': '/user_details?userid=bqJNDwrpF-vULjAVAh_LyQ', 'partnerAlias': None, 'friendCount': 356, 'photoCount': 2517, 'reviewCount': 1531, 'eliteYear': 2022}",3,12/28/2016,"[{'src': 'https://s3-media0.fl.yelpcdn.com/bphoto/3iAeclJALV_bqPoRLzMQXw/180s.jpg', 'link': '/biz_photos/wild-honey-singapore-3?reviewid=e6JV17Jgw3kAm6XBW-GeFA&amp;select=3iAeclJALV_bqPoRLzMQXw', 'altText': 'Photo of Wild Honey - Singapore, Singapore', 'width': 180, 'height': 180, 'caption': ''}, {'src': 'https://s3-media0.fl.yelpcdn.com/bphoto/IBCCFEb_zEQPh4Kd-QXw8A/180s.jpg', 'link': '/biz_photos/wild-honey-singapore-3?reviewid=e6JV17Jgw3kAm6XBW-GeFA&amp;select=IBCCFEb_zEQPh4Kd-QXw8A', 'altText': 'Photo of Wild Honey - Singapore, Singapore', 'width': 180, 'height': 180, 'caption': ''}, {'src': 'https://s3-media0.fl.yelpcdn.com/bphoto/fyQiXsfYQr_QpnQGpm7Xjw/180s.jpg', 'link': '/biz_photos/wild-honey-singapore-3?reviewid=e6JV17Jgw3kAm6XBW-GeFA&amp;select=fyQiXsfYQr_QpnQGpm7Xjw', 'altText': 'Photo of Wild Honey - Singapore, Singapore', 'width': 180, 'height': 180, 'caption': ''}]",Christina N.,en,"Who can say no to all day breakfast? Prices here seem a little on the high side but portions are comparatively larger. <br&gt;<br&gt;The food was decent, and I did enjoy my spanish hash, but it didnt wow me. I guess I&amp;#39;m paying more for the ambience, the comfortable seats and the strong AC. <br&gt;<br&gt;Great place for a meetup with friends where food isnt the focus."
wild-honey-singapore-3,KEKjsMVzI60TpfM8MLC_1w,"{'link': '/user_details?userid=KEKjsMVzI60TpfM8MLC_1w', 'src': 'https://s3-media0.fl.yelpcdn.com/assets/srv0/yelp_styleguide/514f6997a318/assets/img/default_avatars/user_60_square.png', 'srcSet': None, 'markupDisplayName': 'Amiee X.', 'displayLocation': 'Westwood, Los Angeles, CA', 'altText': 'Amiee X.', 'userUrl': '/user_details?userid=KEKjsMVzI60TpfM8MLC_1w', 'partnerAlias': None, 'friendCount': 0, 'photoCount': None, 'reviewCount': 10, 'eliteYear': None}",4,1/4/2021,[],Amiee X.,en,"Food is pretty good. Though a bit pricy, the portion is big too. I like the drinks particularly. The milkshake is quite healthy feeling and fast food too"
