shop,userid,userinfo,rating,date,photos,username,language,text
level33-singapore-4,flSaZwD9S3J-fKdaOzQ12Q,"{'link': '/user_details?userid=flSaZwD9S3J-fKdaOzQ12Q', 'src': 'https://s3-media0.fl.yelpcdn.com/assets/srv0/yelp_styleguide/514f6997a318/assets/img/default_avatars/user_60_square.png', 'srcSet': None, 'markupDisplayName': 'Hisayoshi O.', 'displayLocation': 'Morristown, NJ', 'altText': 'Hisayoshi O.', 'userUrl': '/user_details?userid=flSaZwD9S3J-fKdaOzQ12Q', 'partnerAlias': None, 'friendCount': 22, 'photoCount': 4, 'reviewCount': 20, 'eliteYear': None}",2,9/30/2016,[],Hisayoshi O.,en,"They have gotten some selections of beer, thought it is over priced for the view that you get - nothing outstanding in terms of selections either. <br&gt;<br&gt;Their food doesn&amp;#39;t taste good at all - I have tried their platter, lamb, and pork and all of them were big disappointment.<br&gt;<br&gt;It&amp;#39;s just conveniently located and thus I brought my leadership team and customer a few times, but a few visits have proven that it&amp;#39;s not really a place to go for food. Atmosphere and the view are what you are paying the high price."
level33-singapore-4,1tQfj737uhgdKcQ-5akTdA,"{'link': '/user_details?userid=1tQfj737uhgdKcQ-5akTdA', 'src': 'https://s3-media0.fl.yelpcdn.com/photo/snrPD9k0S3TLbBvo6_w23g/60s.jpg', 'srcSet': 'https://s3-media0.fl.yelpcdn.com/photo/snrPD9k0S3TLbBvo6_w23g/ms.jpg 1.67x,https://s3-media0.fl.yelpcdn.com/photo/snrPD9k0S3TLbBvo6_w23g/120s.jpg 2.00x,https://s3-media0.fl.yelpcdn.com/photo/snrPD9k0S3TLbBvo6_w23g/90s.jpg 1.50x,https://s3-media0.fl.yelpcdn.com/photo/snrPD9k0S3TLbBvo6_w23g/168s.jpg 2.80x,https://s3-media0.fl.yelpcdn.com/photo/snrPD9k0S3TLbBvo6_w23g/180s.jpg 3.00x', 'markupDisplayName': 'Ashish C.', 'displayLocation': 'Singapore, Singapore', 'altText': 'Ashish C.', 'userUrl': '/user_details?userid=1tQfj737uhgdKcQ-5akTdA', 'partnerAlias': None, 'friendCount': 0, 'photoCount': None, 'reviewCount': 75, 'eliteYear': None}",4,8/16/2015,[],Ashish C.,en,Very nice view of the city. Nice range of in house freshly brewed beers that go well with bite plates of sliders.<br&gt;<br&gt;Good value for money lunch buffet as well.
level33-singapore-4,4m1PPtF587WIZTBlT6xh6A,"{'link': '/user_details?userid=4m1PPtF587WIZTBlT6xh6A', 'src': 'https://s3-media0.fl.yelpcdn.com/photo/hlfUY9a7fjHxKHyoeouJAg/60s.jpg', 'srcSet': 'https://s3-media0.fl.yelpcdn.com/photo/hlfUY9a7fjHxKHyoeouJAg/ms.jpg 1.67x,https://s3-media0.fl.yelpcdn.com/photo/hlfUY9a7fjHxKHyoeouJAg/120s.jpg 2.00x,https://s3-media0.fl.yelpcdn.com/photo/hlfUY9a7fjHxKHyoeouJAg/90s.jpg 1.50x,https://s3-media0.fl.yelpcdn.com/photo/hlfUY9a7fjHxKHyoeouJAg/168s.jpg 2.80x,https://s3-media0.fl.yelpcdn.com/photo/hlfUY9a7fjHxKHyoeouJAg/180s.jpg 3.00x', 'markupDisplayName': 'Michael B.', 'displayLocation': 'San Francisco, CA', 'altText': 'Michael B.', 'userUrl': '/user_details?userid=4m1PPtF587WIZTBlT6xh6A', 'partnerAlias': None, 'friendCount': 18, 'photoCount': 43, 'reviewCount': 178, 'eliteYear': None}",5,4/24/2016,[],Michael B.,en,"Love this place. The beer is average but the food, service, and views are all top-notch. I especially recommend the Sunday Roast - amazing Yorkshire pud!"
level33-singapore-4,4y4obgWxi_CL25nRHrhuEA,"{'link': '/user_details?userid=4y4obgWxi_CL25nRHrhuEA', 'src': 'https://s3-media0.fl.yelpcdn.com/photo/laRmHWBo3Kx_2nhLNthgUQ/60s.jpg', 'srcSet': 'https://s3-media0.fl.yelpcdn.com/photo/laRmHWBo3Kx_2nhLNthgUQ/ms.jpg 1.67x,https://s3-media0.fl.yelpcdn.com/photo/laRmHWBo3Kx_2nhLNthgUQ/120s.jpg 2.00x,https://s3-media0.fl.yelpcdn.com/photo/laRmHWBo3Kx_2nhLNthgUQ/90s.jpg 1.50x,https://s3-media0.fl.yelpcdn.com/photo/laRmHWBo3Kx_2nhLNthgUQ/168s.jpg 2.80x,https://s3-media0.fl.yelpcdn.com/photo/laRmHWBo3Kx_2nhLNthgUQ/180s.jpg 3.00x', 'markupDisplayName': 'Ancy N.', 'displayLocation': 'Singapore, Singapore', 'altText': 'Ancy N.', 'userUrl': '/user_details?userid=4y4obgWxi_CL25nRHrhuEA', 'partnerAlias': None, 'friendCount': 72, 'photoCount': 1986, 'reviewCount': 592, 'eliteYear': None}",3,9/14/2012,"[{'src': 'https://s3-media0.fl.yelpcdn.com/bphoto/faB-qezaWziLowgUfNdojw/180s.jpg', 'link': '/biz_photos/level33-singapore-4?reviewid=I_V9wvKkGcRkf2UpCbxcow&amp;select=faB-qezaWziLowgUfNdojw', 'altText': 'Photo of LeVeL33 - Singapore, Singapore', 'width': 180, 'height': 180, 'caption': ''}, {'src': 'https://s3-media0.fl.yelpcdn.com/bphoto/u8o1SpZtQScUsXpakMscQA/180s.jpg', 'link': '/biz_photos/level33-singapore-4?reviewid=I_V9wvKkGcRkf2UpCbxcow&amp;select=u8o1SpZtQScUsXpakMscQA', 'altText': 'Photo of LeVeL33 - Singapore, Singapore', 'width': 180, 'height': 180, 'caption': ''}, {'src': 'https://s3-media0.fl.yelpcdn.com/bphoto/jdfjO16fdgyffUJRkzMBoA/180s.jpg', 'link': '/biz_photos/level33-singapore-4?reviewid=I_V9wvKkGcRkf2UpCbxcow&amp;select=jdfjO16fdgyffUJRkzMBoA', 'altText': 'Photo of LeVeL33 - Singapore, Singapore. View of MBS from level 33', 'width': 180, 'height': 180, 'caption': 'View of MBS from level 33'}, {'src': 'https://s3-media0.fl.yelpcdn.com/bphoto/gkyzPWKXfLVLDgTnpSg4gA/180s.jpg', 'link': '/biz_photos/level33-singapore-4?reviewid=I_V9wvKkGcRkf2UpCbxcow&amp;select=gkyzPWKXfLVLDgTnpSg4gA', 'altText': 'Photo of LeVeL33 - Singapore, Singapore. View from Level 33', 'width': 180, 'height': 180, 'caption': 'View from Level 33'}]",Ancy N.,en,"4- stars for the view....minus one for the food/drinks/price.<br&gt;<br&gt;I was only here for drinks. Heard enough bad reviews about the food for me to waste any calories here. It&amp;#39;s a microbrewery and the beers are ok. nothing mind-blowing.<br&gt;<br&gt;Snag a table outdoor in the evening, and you will wow any guest that you bring there. Of all the rooftop bars surrounding the Bay, I think this place has the best view. Come in the evening and you can watch the sunset and the changing colors across the entire city. Enjoy!"
level33-singapore-4,sevJTIdT5gOilaz7YPHQMA,"{'link': '/user_details?userid=sevJTIdT5gOilaz7YPHQMA', 'src': 'https://s3-media0.fl.yelpcdn.com/photo/Lg2GPxVh5_2V5PPXO050lQ/60s.jpg', 'srcSet': 'https://s3-media0.fl.yelpcdn.com/photo/Lg2GPxVh5_2V5PPXO050lQ/ms.jpg 1.67x,https://s3-media0.fl.yelpcdn.com/photo/Lg2GPxVh5_2V5PPXO050lQ/120s.jpg 2.00x,https://s3-media0.fl.yelpcdn.com/photo/Lg2GPxVh5_2V5PPXO050lQ/90s.jpg 1.50x,https://s3-media0.fl.yelpcdn.com/photo/Lg2GPxVh5_2V5PPXO050lQ/168s.jpg 2.80x,https://s3-media0.fl.yelpcdn.com/photo/Lg2GPxVh5_2V5PPXO050lQ/180s.jpg 3.00x', 'markupDisplayName': 'Sanne B.', 'displayLocation': 'Greve Strand, Denmark', 'altText': 'Sanne B.', 'userUrl': '/user_details?userid=sevJTIdT5gOilaz7YPHQMA', 'partnerAlias': None, 'friendCount': 165, 'photoCount': 917, 'reviewCount': 534, 'eliteYear': None}",2,12/6/2016,[],Sanne B.,en,"You come here for the amazing view of Singapore at night, not the beer. They might brew their own beer here, but they really aren&amp;#39;t very good at it. The beer is alright, but not interesting or worth the price tag. On top of that, I&amp;#39;m not sure that understand what an IPA is. Their Indian Pale Ale certainly haven&amp;#39;t seen too much of the lovely hops. A pale ale, yes, but not indian."
level33-singapore-4,B_jE8roGb94yymQls5cbyA,"{'link': '/user_details?userid=B_jE8roGb94yymQls5cbyA', 'src': 'https://s3-media0.fl.yelpcdn.com/photo/obh1OHdzVmAi80x71emmAA/60s.jpg', 'srcSet': 'https://s3-media0.fl.yelpcdn.com/photo/obh1OHdzVmAi80x71emmAA/ms.jpg 1.67x,https://s3-media0.fl.yelpcdn.com/photo/obh1OHdzVmAi80x71emmAA/120s.jpg 2.00x,https://s3-media0.fl.yelpcdn.com/photo/obh1OHdzVmAi80x71emmAA/90s.jpg 1.50x,https://s3-media0.fl.yelpcdn.com/photo/obh1OHdzVmAi80x71emmAA/168s.jpg 2.80x,https://s3-media0.fl.yelpcdn.com/photo/obh1OHdzVmAi80x71emmAA/180s.jpg 3.00x', 'markupDisplayName': 'Theresa S.', 'displayLocation': 'Sherwood, OR', 'altText': 'Theresa S.', 'userUrl': '/user_details?userid=B_jE8roGb94yymQls5cbyA', 'partnerAlias': None, 'friendCount': 3, 'photoCount': 1, 'reviewCount': 103, 'eliteYear': None}",5,9/29/2016,[],Theresa S.,en,Went here recently on a business trip. Prices are higher here than in the U.S. but thought for the quality and ambiance that the price was reasonable. I had the chicken which was amazing and my co-workers had the steak. All entrees were incredible. We had the scallops and beef tartare for appetizers. The scallops were just OK. Nothing fantastic. But the beef was excellent. The view is amazing. I would most certainly come back on my next business trip.
level33-singapore-4,Cojb7WLNEuHTIQbYSBo1Kw,"{'link': '/user_details?userid=Cojb7WLNEuHTIQbYSBo1Kw', 'src': 'https://s3-media0.fl.yelpcdn.com/photo/cJWwAB81PoEB3qATBJSLJg/60s.jpg', 'srcSet': 'https://s3-media0.fl.yelpcdn.com/photo/cJWwAB81PoEB3qATBJSLJg/ms.jpg 1.67x,https://s3-media0.fl.yelpcdn.com/photo/cJWwAB81PoEB3qATBJSLJg/120s.jpg 2.00x,https://s3-media0.fl.yelpcdn.com/photo/cJWwAB81PoEB3qATBJSLJg/90s.jpg 1.50x,https://s3-media0.fl.yelpcdn.com/photo/cJWwAB81PoEB3qATBJSLJg/168s.jpg 2.80x,https://s3-media0.fl.yelpcdn.com/photo/cJWwAB81PoEB3qATBJSLJg/180s.jpg 3.00x', 'markupDisplayName': 'Karl David B.', 'displayLocation': 'Singapore, Singapore', 'altText': 'Karl David B.', 'userUrl': '/user_details?userid=Cojb7WLNEuHTIQbYSBo1Kw', 'partnerAlias': None, 'friendCount': 3, 'photoCount': 13, 'reviewCount': 6, 'eliteYear': None}",3,1/23/2016,[],Karl David B.,en,"I was trying to make online reservation for dinner on 13th January but the website indicated N/A. I then called few times but transferred to auto voice machine. After few attempts finally a lady answered my call and made the reservation for us.  Went earlier than our schedule time and received a warm welcome from hostess. The food was delicious but some servers need more polishing in terms of talking to guests and body language, One server was pouring my glass with water while talking to another waiter at the other side. Some waitress are very attentive and polite while others seems to be blind when I was raising my hand to get their attention to Ask for water while my partner was coughing. Nice view and food but service needs a lift."
level33-singapore-4,J4sv-OKmwoCE1YmMLdhKog,"{'link': '/user_details?userid=J4sv-OKmwoCE1YmMLdhKog', 'src': 'https://s3-media0.fl.yelpcdn.com/photo/kpLypflrg2Pi_YJRvor3VA/60s.jpg', 'srcSet': 'https://s3-media0.fl.yelpcdn.com/photo/kpLypflrg2Pi_YJRvor3VA/ms.jpg 1.67x,https://s3-media0.fl.yelpcdn.com/photo/kpLypflrg2Pi_YJRvor3VA/120s.jpg 2.00x,https://s3-media0.fl.yelpcdn.com/photo/kpLypflrg2Pi_YJRvor3VA/90s.jpg 1.50x,https://s3-media0.fl.yelpcdn.com/photo/kpLypflrg2Pi_YJRvor3VA/168s.jpg 2.80x,https://s3-media0.fl.yelpcdn.com/photo/kpLypflrg2Pi_YJRvor3VA/180s.jpg 3.00x', 'markupDisplayName': 'Mel P.', 'displayLocation': 'Melbourne, Australia', 'altText': 'Mel P.', 'userUrl': '/user_details?userid=J4sv-OKmwoCE1YmMLdhKog', 'partnerAlias': None, 'friendCount': 777, 'photoCount': 1298, 'reviewCount': 683, 'eliteYear': None}",2,11/2/2013,[],Mel P.,en,"There was no way we could resist a visit to a brewery 33 stories above Singapore. The views are most definitely worth the visit. Possibly even better than at MBS, because you get to see the enormous building in all its glory, as well as its surrounds. <br&gt;<br&gt;As for the place itself? The beer is expensive and extremely bland. I&amp;#39;d take a Tiger over the offerings here for a fraction of the price. The food is just as bad, if not worse. Super expensive pub-fare, very bland. <br&gt;<br&gt;Honestly, all of this is to be expected. This place is all about the wow factor and they are hardly the first restaurant to capitalise on the tourist trade! We enjoyed our visit as a must-stop on our list and were happy to pay for the beer as the price of entry."
level33-singapore-4,QJ3t1d_-9wIjMi1S58_ivw,"{'link': '/user_details?userid=QJ3t1d_-9wIjMi1S58_ivw', 'src': 'https://s3-media0.fl.yelpcdn.com/photo/0QPQnuvKzYgmTB36fBEKfA/60s.jpg', 'srcSet': 'https://s3-media0.fl.yelpcdn.com/photo/0QPQnuvKzYgmTB36fBEKfA/ms.jpg 1.67x,https://s3-media0.fl.yelpcdn.com/photo/0QPQnuvKzYgmTB36fBEKfA/120s.jpg 2.00x,https://s3-media0.fl.yelpcdn.com/photo/0QPQnuvKzYgmTB36fBEKfA/90s.jpg 1.50x,https://s3-media0.fl.yelpcdn.com/photo/0QPQnuvKzYgmTB36fBEKfA/168s.jpg 2.80x,https://s3-media0.fl.yelpcdn.com/photo/0QPQnuvKzYgmTB36fBEKfA/180s.jpg 3.00x', 'markupDisplayName': 'Caroline F.', 'displayLocation': 'Windsor, United Kingdom', 'altText': 'Caroline F.', 'userUrl': '/user_details?userid=QJ3t1d_-9wIjMi1S58_ivw', 'partnerAlias': None, 'friendCount': 154, 'photoCount': 71, 'reviewCount': 131, 'eliteYear': None}",2,10/22/2015,[],Caroline F.,en,"Great view of Marina Bay sands and decent beer and great food.  We had their version of a charcuterie, sizzling beer and fish and some amazing bread and dips.  We had to wait for a table outside but the staff was good about not asking people to block us which was nice since we had waited an hour for a table with a view.<br&gt;<br&gt;But it all went downhill when we got the bill.  The reason we had sizzling beef and fish was because we had ordered the fish, but they brought us the beef.  For their mistake they let us keep the beef while they brought out the fish. They said no charge.  Of course, it ended up on the bill.  When I pointed it out the guy went back to fix it.  When he came back the charge was still on because he had &amp;#34;called his manager and his manager had said that we had ordered one in the first round and the other in the 2nd round.&amp;#34;  There were no two rounds so I&amp;#39;m not sure if the server was lying or the &amp;#39;manager&amp;#39; he called but regardless I said it wasn&amp;#39;t acceptable and to take it off the bill.  He came back with it off but what is with that?  And then when we were paying cash and sorting it out, he was like &amp;#34;don&amp;#39;t you think it&amp;#39;d be easier to put on your card?&amp;#34;  Felt very odd he was trying to force a credit card transaction.  The whole end was sketchy and ruined what had been a good night.  Unacceptable service."
level33-singapore-4,wDwwazbzYP7iUjV6DYgyKA,"{'link': '/user_details?userid=wDwwazbzYP7iUjV6DYgyKA', 'src': 'https://s3-media0.fl.yelpcdn.com/photo/nrSNaR9Euv9kq5gCicKsYQ/60s.jpg', 'srcSet': 'https://s3-media0.fl.yelpcdn.com/photo/nrSNaR9Euv9kq5gCicKsYQ/ms.jpg 1.67x,https://s3-media0.fl.yelpcdn.com/photo/nrSNaR9Euv9kq5gCicKsYQ/120s.jpg 2.00x,https://s3-media0.fl.yelpcdn.com/photo/nrSNaR9Euv9kq5gCicKsYQ/90s.jpg 1.50x,https://s3-media0.fl.yelpcdn.com/photo/nrSNaR9Euv9kq5gCicKsYQ/168s.jpg 2.80x,https://s3-media0.fl.yelpcdn.com/photo/nrSNaR9Euv9kq5gCicKsYQ/180s.jpg 3.00x', 'markupDisplayName': 'Dmitriy V.', 'displayLocation': 'Bayfront, Singapore, Singapore', 'altText': 'Dmitriy V.', 'userUrl': '/user_details?userid=wDwwazbzYP7iUjV6DYgyKA', 'partnerAlias': None, 'friendCount': 229, 'photoCount': 38, 'reviewCount': 130, 'eliteYear': None}",4,6/28/2016,[],Dmitriy V.,en,"A pretty awesome view, in fact one of my favorites in Singapore without requiring a cover charge. While a dinner here is pricy and I have only tried it once (was delicious). The drinks are very reasonably priced and their own craft beer and craft beer cocktails are well worth the visit. Sometimes the balcony gets rather crowded but usually you can get a table after 20-30 minute wait or can always enjoy the view and come back inside for drinks. Overall I highly recommend to visit here. In terms of food - I had the steak + shrimp combo dish and it was well prepared and presented though expensive!"
level33-singapore-4,mLNFKajc56CqeZA6WkgREQ,"{'link': '/user_details?userid=mLNFKajc56CqeZA6WkgREQ', 'src': 'https://s3-media0.fl.yelpcdn.com/photo/SQiG5aNGsFOMeScmSlw40A/60s.jpg', 'srcSet': 'https://s3-media0.fl.yelpcdn.com/photo/SQiG5aNGsFOMeScmSlw40A/ms.jpg 1.67x,https://s3-media0.fl.yelpcdn.com/photo/SQiG5aNGsFOMeScmSlw40A/120s.jpg 2.00x,https://s3-media0.fl.yelpcdn.com/photo/SQiG5aNGsFOMeScmSlw40A/90s.jpg 1.50x,https://s3-media0.fl.yelpcdn.com/photo/SQiG5aNGsFOMeScmSlw40A/168s.jpg 2.80x,https://s3-media0.fl.yelpcdn.com/photo/SQiG5aNGsFOMeScmSlw40A/180s.jpg 3.00x', 'markupDisplayName': 'Amanda L.', 'displayLocation': 'Sunnyvale, CA', 'altText': 'Amanda L.', 'userUrl': '/user_details?userid=mLNFKajc56CqeZA6WkgREQ', 'partnerAlias': None, 'friendCount': 96, 'photoCount': 1274, 'reviewCount': 334, 'eliteYear': None}",4,2/16/2013,"[{'src': 'https://s3-media0.fl.yelpcdn.com/bphoto/lpwdTdVbrnoPXWrbwoz8Ew/180s.jpg', 'link': '/biz_photos/level33-singapore-4?reviewid=BjAKcu8XpxA1gMNbXc8f5Q&amp;select=lpwdTdVbrnoPXWrbwoz8Ew', 'altText': 'Photo of LeVeL33 - Singapore, Singapore', 'width': 180, 'height': 180, 'caption': None}, {'src': 'https://s3-media0.fl.yelpcdn.com/bphoto/NUg8DbaQplUfUVM3n5O5KQ/180s.jpg', 'link': '/biz_photos/level33-singapore-4?reviewid=BjAKcu8XpxA1gMNbXc8f5Q&amp;select=NUg8DbaQplUfUVM3n5O5KQ', 'altText': 'Photo of LeVeL33 - Singapore, Singapore', 'width': 180, 'height': 180, 'caption': None}, {'src': 'https://s3-media0.fl.yelpcdn.com/bphoto/re11BCHgSk3-zSmpfhV-uQ/180s.jpg', 'link': '/biz_photos/level33-singapore-4?reviewid=BjAKcu8XpxA1gMNbXc8f5Q&amp;select=re11BCHgSk3-zSmpfhV-uQ', 'altText': 'Photo of LeVeL33 - Singapore, Singapore', 'width': 180, 'height': 180, 'caption': None}, {'src': 'https://s3-media0.fl.yelpcdn.com/bphoto/d40wtvnbyJU5iDJz9lIsRg/180s.jpg', 'link': '/biz_photos/level33-singapore-4?reviewid=BjAKcu8XpxA1gMNbXc8f5Q&amp;select=d40wtvnbyJU5iDJz9lIsRg', 'altText': 'Photo of LeVeL33 - Singapore, Singapore', 'width': 180, 'height': 180, 'caption': None}]",Amanda L.,en,"The Food - We had the Vday set meal so I am not sure if all the items listed here are on the regular menu. <br&gt;<br&gt;1. Starters: <br&gt;- Fresh rolls with 3 different types of butter (love butter!!!)<br&gt;- Scallop (my favorite) &amp;amp; pork belly <br&gt;- Foie gras (excellent &amp;amp; Normally, I don&amp;#39;t like this dish but this one was good. Whatever else I write will be an understatement for foie gras lovers so I&amp;#39;ll stop here. <br&gt;<br&gt;2. Mains: <br&gt;- Overall, quite disappointing especially after the spectacular starters. I have a feeling that this place excels in its niche - starters/finger food/desserts &amp;amp; (of course) cocktails/beers. However, not in their mains.  <br&gt;- The pan fried sea bass had a fishy smell that was not musk well which really irks me. Another big downer was that the fillet had so much small-annoying-hard-to-see bones in it. Beware! It was a chore to debone it and isn&amp;#39;t worth the effort because it wasn&amp;#39;t even that tasty to begin with. <br&gt;- Beef. I ordered mine medium-well. A precarious task because as most restaurants do not do this well. It comes often comes out over cooked (well-done). Level 33 was no exception. Also, they topped the steak with a strong cheese (melted on top of it) which really overpowered the flavor of the steak. The steak sauce was great but they gave too little of it, and whilst I tried to ration my meat to sauce ratio carefully in the end the sauce ran out before the meat. <br&gt;<br&gt;3. Desserts: <br&gt;- Chocolate lava cake - Good! I love who they balanced out the sweetness of the chocolate with sea salt and cream cheese at the side. <br&gt;- Mascarpone - Great!!! even though they got our order wrong! We were suppose to have the banana dessert (whatever that was, it was recommended by our server) but this was excellent! I am a big fan of mascarpone so I might be biased. If you like cheesey-sweet treats like me, this one is definitely for you! <br&gt;<br&gt;4. Drinks: <br&gt;- Excellent. I am not a big fan of beer. In fact, I NEVER order it. However, this microbrewery has changed my opinion. All their cocktails are beer based (I believe) and they were sooo good (with the exception of the stout. I am still, and forever will be NOT A FAN OF STOUT. The bitterness puts me off.) Even the plain beer alone is good. It has a really light taste, even lighter than Heikien.<br&gt;- Paris - Love x2! Very sweet though. <br&gt;- Blond mojito - Love x3. My favorite drink. <br&gt;- Beer - Love<br&gt;- Unknown stout cocktail with berries - Cannot Love, because of my predisposition to be biased against stout!!! The bf thought it was ok though. <br&gt;<br&gt;The Service <br&gt;- Good. The waiter was kind enough to throw in 2 free drinks. The first because I hinted it looked good. The second because our desserts took 45min to come. <br&gt;- Really appreciated their effort to be efficient. <br&gt;- They had a pre-set the dining table with a rose &amp;amp; a box of chocolates so definitely good news for the guys. Half the work has already been done for you. <br&gt;<br&gt;The View<br&gt;- It was AWESOME. Overlooking the entire marina bay :) How singapore has grown. I feel old already! <br&gt;- It&amp;#39;s a bit chilly up there so definitely bring a jacket along. <br&gt;<br&gt;Overall: Will definitely be back here again with friends to grab a cocktail &amp;amp; snack on some starters."
level33-singapore-4,kKzv6PG0p_lsEDFtwyJepA,"{'link': '/user_details?userid=kKzv6PG0p_lsEDFtwyJepA', 'src': 'https://s3-media0.fl.yelpcdn.com/assets/srv0/yelp_styleguide/514f6997a318/assets/img/default_avatars/user_60_square.png', 'srcSet': None, 'markupDisplayName': 'Travel M.', 'displayLocation': 'Singapore, Singapore', 'altText': 'Travel M.', 'userUrl': '/user_details?userid=kKzv6PG0p_lsEDFtwyJepA', 'partnerAlias': None, 'friendCount': 0, 'photoCount': 3, 'reviewCount': 84, 'eliteYear': None}",3,6/17/2018,[],Travel M.,en,"Came here before during weekday and was impressed with appetiser buffet.  Returned for the roast Sunday lunch and was less impressed.  The food was just decent and the service was very Ho-hum.  Except for the kids menus and plastic cutlery there wasnt even paper or crayons to draw, let alone toys.  The dessert was very very average.  Go there for the beer, cocktail and the view (which was stunning even on a hazy day) but we wouldn&amp;#39;t be rushing back."
level33-singapore-4,zaRbg_2odA-J95AdHiZPjg,"{'link': '/user_details?userid=zaRbg_2odA-J95AdHiZPjg', 'src': 'https://s3-media0.fl.yelpcdn.com/photo/g6ExKJngEjPlGTJ4OWf-pw/60s.jpg', 'srcSet': 'https://s3-media0.fl.yelpcdn.com/photo/g6ExKJngEjPlGTJ4OWf-pw/ms.jpg 1.67x,https://s3-media0.fl.yelpcdn.com/photo/g6ExKJngEjPlGTJ4OWf-pw/120s.jpg 2.00x,https://s3-media0.fl.yelpcdn.com/photo/g6ExKJngEjPlGTJ4OWf-pw/90s.jpg 1.50x,https://s3-media0.fl.yelpcdn.com/photo/g6ExKJngEjPlGTJ4OWf-pw/168s.jpg 2.80x,https://s3-media0.fl.yelpcdn.com/photo/g6ExKJngEjPlGTJ4OWf-pw/180s.jpg 3.00x', 'markupDisplayName': 'Chris H.', 'displayLocation': 'San Francisco, CA', 'altText': 'Chris H.', 'userUrl': '/user_details?userid=zaRbg_2odA-J95AdHiZPjg', 'partnerAlias': None, 'friendCount': 40, 'photoCount': 2, 'reviewCount': 29, 'eliteYear': None}",5,9/16/2016,[],Chris H.,en,Great service. Great view. Great time. F1 Thunder in background is icing on the cake . . .  A MUST visit while in Singapore.
level33-singapore-4,690cxERsi3FBEoBOb2MOoQ,"{'link': '/user_details?userid=690cxERsi3FBEoBOb2MOoQ', 'src': 'https://s3-media0.fl.yelpcdn.com/photo/ioIcQYFrO-Fiku3KNNn5vg/60s.jpg', 'srcSet': 'https://s3-media0.fl.yelpcdn.com/photo/ioIcQYFrO-Fiku3KNNn5vg/ms.jpg 1.67x,https://s3-media0.fl.yelpcdn.com/photo/ioIcQYFrO-Fiku3KNNn5vg/120s.jpg 2.00x,https://s3-media0.fl.yelpcdn.com/photo/ioIcQYFrO-Fiku3KNNn5vg/90s.jpg 1.50x,https://s3-media0.fl.yelpcdn.com/photo/ioIcQYFrO-Fiku3KNNn5vg/168s.jpg 2.80x,https://s3-media0.fl.yelpcdn.com/photo/ioIcQYFrO-Fiku3KNNn5vg/180s.jpg 3.00x', 'markupDisplayName': 'Ryan M.', 'displayLocation': 'Singapore, Singapore', 'altText': 'Ryan M.', 'userUrl': '/user_details?userid=690cxERsi3FBEoBOb2MOoQ', 'partnerAlias': None, 'friendCount': 17, 'photoCount': None, 'reviewCount': 10, 'eliteYear': None}",4,8/16/2015,[],Ryan M.,en,"LeVel33 claims the distinction of being the highest brewery at least in Singapore if not the world. The beer is actually very good including their seasonal brews. It is definitely a sign of the increasing popularity of micro and nano-breweries popping up in Singapore. If you head here for happy hour you can find the beer of your choice for a reasonable price and get a seat outside for the spectacular views of Marina Bay, the Singapore Flyer and the ArtScience Museum. Definitely worth a visit!"
level33-singapore-4,Adzb5v6YpltZ7HmeOzQARg,"{'link': '/user_details?userid=Adzb5v6YpltZ7HmeOzQARg', 'src': 'https://s3-media0.fl.yelpcdn.com/assets/srv0/yelp_styleguide/514f6997a318/assets/img/default_avatars/user_60_square.png', 'srcSet': None, 'markupDisplayName': 'Richard Z.', 'displayLocation': 'Elk Grove, CA', 'altText': 'Richard Z.', 'userUrl': '/user_details?userid=Adzb5v6YpltZ7HmeOzQARg', 'partnerAlias': None, 'friendCount': 148, 'photoCount': 501, 'reviewCount': 349, 'eliteYear': None}",1,12/31/2014,[],Richard Z.,en,"Mid 30&amp;#39;s international traveler walking around town with camera gear, hungry and thirsty. <br&gt;Went to Level 33<br&gt;Took Private Elevator<br&gt;Receptionist didn&amp;#39;t acknowledge me at all. <br&gt;Went to the balcony myself. <br&gt;No table so I stood in a clear section to look at the view. <br&gt;First thing waiter said to me when he saw me is &amp;#34;No Tripod&amp;#34; to take photos. <br&gt;I ask for a menu.<br&gt;Menu never came. <br&gt;I left with my camera, my tripod and my American Express.<br&gt;Went to a food center in China Town<br&gt;Pigged out<br&gt;Went back to the hotel. <br&gt;Writing a review. <br&gt;GREAT VIEW from the balcony tho. <br&gt;Make sure you dress up.<br&gt;Don&amp;#39;t bring your camera gear and act all touristy. LOL<br&gt;It is a fancy place, but unfortunately too fancy for me..."
