shop,userid,userinfo,rating,date,photos,username,language,text
nespresso-boutique-singapore,AIb7LML67T_sdHEJTeC3NQ,"{'link': '/user_details?userid=AIb7LML67T_sdHEJTeC3NQ', 'src': 'https://s3-media0.fl.yelpcdn.com/photo/HHfnQFArQ5go20PB6JuhNQ/60s.jpg', 'srcSet': 'https://s3-media0.fl.yelpcdn.com/photo/HHfnQFArQ5go20PB6JuhNQ/ms.jpg 1.67x,https://s3-media0.fl.yelpcdn.com/photo/HHfnQFArQ5go20PB6JuhNQ/120s.jpg 2.00x,https://s3-media0.fl.yelpcdn.com/photo/HHfnQFArQ5go20PB6JuhNQ/90s.jpg 1.50x,https://s3-media0.fl.yelpcdn.com/photo/HHfnQFArQ5go20PB6JuhNQ/168s.jpg 2.80x,https://s3-media0.fl.yelpcdn.com/photo/HHfnQFArQ5go20PB6JuhNQ/180s.jpg 3.00x', 'markupDisplayName': 'Arunima K.', 'displayLocation': 'Singapore, Singapore', 'altText': 'Arunima K.', 'userUrl': '/user_details?userid=AIb7LML67T_sdHEJTeC3NQ', 'partnerAlias': None, 'friendCount': 4, 'photoCount': 17, 'reviewCount': 47, 'eliteYear': None}",5,9/9/2012,"[{'src': 'https://s3-media0.fl.yelpcdn.com/bphoto/xnL8WUo-4mGEc7bpQgNChg/300s.jpg', 'link': '/biz_photos/nespresso-boutique-singapore?reviewid=NuV4yh5S1nTxbIgrmgLLYQ&amp;select=xnL8WUo-4mGEc7bpQgNChg', 'altText': 'Photo of Nespresso Boutique - Singapore, Singapore. Nespresso Boutique', 'width': 300, 'height': 300, 'caption': 'Nespresso Boutique'}, {'src': 'https://s3-media0.fl.yelpcdn.com/bphoto/Vgvnq_YkybcHeKVcNjbyrw/300s.jpg', 'link': '/biz_photos/nespresso-boutique-singapore?reviewid=NuV4yh5S1nTxbIgrmgLLYQ&amp;select=Vgvnq_YkybcHeKVcNjbyrw', 'altText': 'Photo of Nespresso Boutique - Singapore, Singapore. Coffee selection', 'width': 300, 'height': 300, 'caption': 'Coffee selection'}]",Arunima K.,en,"I absolutely love the Nespresso Boutique at Ion Orchard. <br&gt;<br&gt;For starters, Nespresso coffee is hands down the best mass-produced coffee available on the market at a reasonable cost. Each sleeve costs about $18 for 7 capsules of coffee. They have 10 standard flavors available and are constantly finding new roasts marketing them as &amp;#34;limited additions.&amp;#34; The store has a beautiful selection of machines, ranging from professional to every day at home use. They also have a selection of cups and other accessories to compliment your purchase.<br&gt;<br&gt;The best part, of course, is the fact that customers can come in and try out any flavor of coffee, for free! The service is excellent and the staff are very knowledgeable on all the flavors. They prepare your coffee very well, to your tastes, as an expresso or with milk.<br&gt;<br&gt;They do not hard sell and let you enjoy the coffee for what it is rather than try and over impose on you.<br&gt;<br&gt;Really, a lovely place to come in after a day of shopping and grab a nice cup of joe or  pick up your very own machine"
nespresso-boutique-singapore,IF_G8EqbNODvD8RjTsvo8A,"{'link': '/user_details?userid=IF_G8EqbNODvD8RjTsvo8A', 'src': 'https://s3-media0.fl.yelpcdn.com/photo/1vaIHz_NnZujsK4Fn9YGyQ/60s.jpg', 'srcSet': 'https://s3-media0.fl.yelpcdn.com/photo/1vaIHz_NnZujsK4Fn9YGyQ/ms.jpg 1.67x,https://s3-media0.fl.yelpcdn.com/photo/1vaIHz_NnZujsK4Fn9YGyQ/120s.jpg 2.00x,https://s3-media0.fl.yelpcdn.com/photo/1vaIHz_NnZujsK4Fn9YGyQ/90s.jpg 1.50x,https://s3-media0.fl.yelpcdn.com/photo/1vaIHz_NnZujsK4Fn9YGyQ/168s.jpg 2.80x,https://s3-media0.fl.yelpcdn.com/photo/1vaIHz_NnZujsK4Fn9YGyQ/180s.jpg 3.00x', 'markupDisplayName': 'Cat V.', 'displayLocation': 'Irvine, CA', 'altText': 'Cat V.', 'userUrl': '/user_details?userid=IF_G8EqbNODvD8RjTsvo8A', 'partnerAlias': None, 'friendCount': 556, 'photoCount': 1922, 'reviewCount': 665, 'eliteYear': None}",1,11/14/2012,[],Cat V.,en,"Worse Nespresso Boutique service ever. <br&gt;<br&gt;Mr. Q and I were browsing for a birthday gift for his mom. We really enjoyed our Nespresso, so we want to introduce this beautiful machine to his mom as well. <br&gt;<br&gt;The store is beautifully presented. <br&gt;<br&gt;When I was looking at the newest model, I felt somebody watching me from behind. Suddenly he gets closer to me. He stood right beside me and he zoomed with his eyes on my shopping bag &amp;#34; ZooooOOmm...Topshop(cheapo), ZooOOOoommm...Bershka(Cheapo)...ZoooOOoomm...ZooOOoommm...L&amp;#39;occitane(Idon&amp;#39;t think she can afford the machine)&amp;#34; I could feel his eyes checking my shopping bags and  I thought he was targetting my wallet, So I hold my bag and walk to another machine and he followed me there. &amp;#34; We have the newest model&amp;#34; his nose was about 2 inches from my nose. I was shocked because his face was suddenly in front my face. <br&gt;<br&gt;OMG, this dude was analyzed me from my shopping bags to my casual wear whether I can afford their products here. <br&gt;<br&gt;I always enjoy Nespresso because of the quality of their coffee, coffee machine, frosting machine and the attentive but not overwhelming service.<br&gt;Unfortunately, this experience proved me otherwise."
nespresso-boutique-singapore,mXXwmm1QM88zKCm4pVdlfw,"{'link': '/user_details?userid=mXXwmm1QM88zKCm4pVdlfw', 'src': 'https://s3-media0.fl.yelpcdn.com/assets/srv0/yelp_styleguide/514f6997a318/assets/img/default_avatars/user_60_square.png', 'srcSet': None, 'markupDisplayName': 'Aaron W.', 'displayLocation': 'Washington, DC', 'altText': 'Aaron W.', 'userUrl': '/user_details?userid=mXXwmm1QM88zKCm4pVdlfw', 'partnerAlias': None, 'friendCount': 0, 'photoCount': None, 'reviewCount': 4, 'eliteYear': None}",3,1/3/2016,[],Aaron W.,en,"While the Nespresso boutique is a nice place, well presented with very good and well trained staff, there are other issues that presented themselves when I first bought my Nespresso in Singapore. To start, the delivery was confusing as once I left the store, I was unable to contact the ION store directly. I am serious, they do not allow calls directly to the store - you must call the toll free Singapore number to coordinate with a Nespresso Rep. <br&gt;<br&gt;Once I did get ahold of a central representative, they tried to coordinate the delivery but it took longer than anticipated. <br&gt;<br&gt;Even a simple billing question is difficult to answer due to their unnecessary complex structure. <br&gt;<br&gt;While I enjoy Nespresso and believe they are the best option for quick, delicious espresso - especially in Singapore, I believe they need to improve their customer service contact process. I should not have to contact a central representative, who then contacts the store, who then figures out the issue, who then calls me back and coordinates from there. The central rep told me they cannot give out the store number directly (and I called the number on the Nespresso Singapore site, and it just rang repeatedly. <br&gt;<br&gt;Nespresso has a great product but improved customer service is a must."
nespresso-boutique-singapore,OBFRSw7mTGtKJC89Qcai2w,"{'link': '/user_details?userid=OBFRSw7mTGtKJC89Qcai2w', 'src': 'https://s3-media0.fl.yelpcdn.com/photo/HfVXLSygJ8LcRyvbUqXJ7g/60s.jpg', 'srcSet': 'https://s3-media0.fl.yelpcdn.com/photo/HfVXLSygJ8LcRyvbUqXJ7g/ms.jpg 1.67x,https://s3-media0.fl.yelpcdn.com/photo/HfVXLSygJ8LcRyvbUqXJ7g/120s.jpg 2.00x,https://s3-media0.fl.yelpcdn.com/photo/HfVXLSygJ8LcRyvbUqXJ7g/90s.jpg 1.50x,https://s3-media0.fl.yelpcdn.com/photo/HfVXLSygJ8LcRyvbUqXJ7g/168s.jpg 2.80x,https://s3-media0.fl.yelpcdn.com/photo/HfVXLSygJ8LcRyvbUqXJ7g/180s.jpg 3.00x', 'markupDisplayName': 'Peter A.', 'displayLocation': 'Singapore, Singapore', 'altText': 'Peter A.', 'userUrl': '/user_details?userid=OBFRSw7mTGtKJC89Qcai2w', 'partnerAlias': None, 'friendCount': 0, 'photoCount': 227, 'reviewCount': 225, 'eliteYear': None}",5,8/26/2012,[],Peter A.,en,"Unlike TCC, Nespresso Boutique is the place to go for coffee lovers. <br&gt;<br&gt;In this boutique they only do coffee, nothing else. And they do it with style. Hip Nespresso machines brew espresso from coffee capsules, a type of pre-apportioned single-use container of ground coffee and flavorings. They have a standard 10 flavors with every 2 months a Nespresso special, a good reason to visit the store again. <br&gt;<br&gt;The Nespresso Aeroccino Milk Frother is just amazing. Put your favorite milk in it, push the button and it creates a froth in half a minute, which is thick, dense and creamy and just perfect!<br&gt;<br&gt;The ambiance of the store feels luxurious and modern. The staff is professional, attentive and kind. 10 capsules sell at S$ 9,90."
nespresso-boutique-singapore,w2_cG-OaLZq3OB4R4k_qZg,"{'link': '/user_details?userid=w2_cG-OaLZq3OB4R4k_qZg', 'src': 'https://s3-media0.fl.yelpcdn.com/photo/2_ZlCUEHTWEd1jX2PoVn7w/60s.jpg', 'srcSet': 'https://s3-media0.fl.yelpcdn.com/photo/2_ZlCUEHTWEd1jX2PoVn7w/ms.jpg 1.67x,https://s3-media0.fl.yelpcdn.com/photo/2_ZlCUEHTWEd1jX2PoVn7w/120s.jpg 2.00x,https://s3-media0.fl.yelpcdn.com/photo/2_ZlCUEHTWEd1jX2PoVn7w/90s.jpg 1.50x,https://s3-media0.fl.yelpcdn.com/photo/2_ZlCUEHTWEd1jX2PoVn7w/168s.jpg 2.80x,https://s3-media0.fl.yelpcdn.com/photo/2_ZlCUEHTWEd1jX2PoVn7w/180s.jpg 3.00x', 'markupDisplayName': 'Joanne C.', 'displayLocation': 'Singapore, Singapore', 'altText': 'Joanne C.', 'userUrl': '/user_details?userid=w2_cG-OaLZq3OB4R4k_qZg', 'partnerAlias': None, 'friendCount': 61, 'photoCount': 202, 'reviewCount': 208, 'eliteYear': None}",4,8/26/2012,[],Joanne C.,en,"Well as the name says it, it is nespresso boutique. It sells all thing nespresso there. <br&gt;<br&gt;You can pick up the machines, coffee capsules, cups and much more there. Well, it is not like a starbuck or a coffee bean where you can buy your cup of joe but you definitely can sample your coffee here.<br&gt;<br&gt;The service is awesome here too."
curry-leaf-singapore,Q1oMmm7tKPOzA7_gqcV4zg,"{'link': '/user_details?userid=Q1oMmm7tKPOzA7_gqcV4zg', 'src': 'https://s3-media0.fl.yelpcdn.com/photo/2XHwTGQ4kOC3RwcAuGhzWw/60s.jpg', 'srcSet': 'https://s3-media0.fl.yelpcdn.com/photo/2XHwTGQ4kOC3RwcAuGhzWw/ms.jpg 1.67x,https://s3-media0.fl.yelpcdn.com/photo/2XHwTGQ4kOC3RwcAuGhzWw/120s.jpg 2.00x,https://s3-media0.fl.yelpcdn.com/photo/2XHwTGQ4kOC3RwcAuGhzWw/90s.jpg 1.50x,https://s3-media0.fl.yelpcdn.com/photo/2XHwTGQ4kOC3RwcAuGhzWw/168s.jpg 2.80x,https://s3-media0.fl.yelpcdn.com/photo/2XHwTGQ4kOC3RwcAuGhzWw/180s.jpg 3.00x', 'markupDisplayName': 'Carolyn L.', 'displayLocation': 'Vancouver, Canada', 'altText': 'Carolyn L.', 'userUrl': '/user_details?userid=Q1oMmm7tKPOzA7_gqcV4zg', 'partnerAlias': None, 'friendCount': 171, 'photoCount': 23135, 'reviewCount': 1782, 'eliteYear': 2022}",4,4/16/2015,"[{'src': 'https://s3-media0.fl.yelpcdn.com/bphoto/KRYAEGfS4x_IONwPPWZltg/300s.jpg', 'link': '/biz_photos/curry-leaf-singapore?reviewid=CsYAZGAxTm8VM4YB1xAyXw&amp;select=KRYAEGfS4x_IONwPPWZltg', 'altText': 'Photo of Curry Leaf - Singapore, Singapore. Teh Halia and sardine curry puff', 'width': 300, 'height': 300, 'caption': 'Teh Halia and sardine curry puff'}]",Carolyn L.,en,"Come here for teh tarik or teh halia (ginger milk tea) if you are searching for your non-Starbucks or fancy coffee and tea. It is really good, with the typical Indian milky sweetness. Perfect.<br&gt;<br&gt;The sardine puff is not as good as the tea though. It is not crispy and the sardine filling is not spicy or sour enough. <br&gt;<br&gt;I have yet to try the local Indian muslim food dishes which are available at the adjoining shop. <br&gt;<br&gt;This place also sells small snacks and tidbits, like a &amp;#34;mama&amp;#34; shop but with a bigger premise. <br&gt;<br&gt;A good no frills place with affordable prices in the Orchard area. You can get a cup of teh or kopi for just $1."
tiong-bahru-yong-tau-foo-singapore,pZ5-8XHqxcERoTV1L7_WUw,"{'link': '/user_details?userid=pZ5-8XHqxcERoTV1L7_WUw', 'src': 'https://s3-media0.fl.yelpcdn.com/photo/9vzf948ryiZ1w7nWd2p-0A/60s.jpg', 'srcSet': 'https://s3-media0.fl.yelpcdn.com/photo/9vzf948ryiZ1w7nWd2p-0A/ms.jpg 1.67x,https://s3-media0.fl.yelpcdn.com/photo/9vzf948ryiZ1w7nWd2p-0A/120s.jpg 2.00x,https://s3-media0.fl.yelpcdn.com/photo/9vzf948ryiZ1w7nWd2p-0A/90s.jpg 1.50x,https://s3-media0.fl.yelpcdn.com/photo/9vzf948ryiZ1w7nWd2p-0A/168s.jpg 2.80x,https://s3-media0.fl.yelpcdn.com/photo/9vzf948ryiZ1w7nWd2p-0A/180s.jpg 3.00x', 'markupDisplayName': 'Marilyn T.', 'displayLocation': 'Singapore, Singapore', 'altText': 'Marilyn T.', 'userUrl': '/user_details?userid=pZ5-8XHqxcERoTV1L7_WUw', 'partnerAlias': None, 'friendCount': 36, 'photoCount': 213, 'reviewCount': 34, 'eliteYear': None}",5,12/13/2016,"[{'src': 'https://s3-media0.fl.yelpcdn.com/bphoto/2Vj3aI2yc8Bpe2dW_uhrJg/300s.jpg', 'link': '/biz_photos/tiong-bahru-yong-tau-foo-singapore?reviewid=xXNpoGu-NwbjSlAauxEaSw&amp;select=2Vj3aI2yc8Bpe2dW_uhrJg', 'altText': 'Photo of Tiong Bahru Yong Tau Foo - Singapore, Singapore. $3 without fishballs', 'width': 300, 'height': 300, 'caption': '$3 without fishballs'}]",Marilyn T.,en,"This place is my husband&amp;#39;s and my regular breakfast stop before he drops me off at my office. We are so regular that when the coffee shop attendant sees us walking towards them, my usual kopi poh siu dai and my hubby&amp;#39;s kopi O kosong will be on the table shortly after we sat down. <br&gt;<br&gt;Not too long later, our usual Yong Tau Foo kosong (means no noodles), and mine without fishballs (i traded my fishballs with their tau foo skin wrapped fish paste), will be served. Talk about fast food!<br&gt;<br&gt;They are super friendly, from the 1st time I ate there, till now, without fail I will see them all greet customers. An old lady who is in-charge of setting the chopsticks, spoon and sauce will be the first once you&amp;#39;ve set down, always smiling.<br&gt;<br&gt;Simple pleasures...."
tiong-bahru-yong-tau-foo-singapore,jfJF7wNEYW53_h1mE21ztg,"{'link': '/user_details?userid=jfJF7wNEYW53_h1mE21ztg', 'src': 'https://s3-media0.fl.yelpcdn.com/photo/NF61BV5ss120xD59w2o9rQ/60s.jpg', 'srcSet': 'https://s3-media0.fl.yelpcdn.com/photo/NF61BV5ss120xD59w2o9rQ/ms.jpg 1.67x,https://s3-media0.fl.yelpcdn.com/photo/NF61BV5ss120xD59w2o9rQ/120s.jpg 2.00x,https://s3-media0.fl.yelpcdn.com/photo/NF61BV5ss120xD59w2o9rQ/90s.jpg 1.50x,https://s3-media0.fl.yelpcdn.com/photo/NF61BV5ss120xD59w2o9rQ/168s.jpg 2.80x,https://s3-media0.fl.yelpcdn.com/photo/NF61BV5ss120xD59w2o9rQ/180s.jpg 3.00x', 'markupDisplayName': 'Gracia O.', 'displayLocation': 'Singapore, Singapore', 'altText': 'Gracia O.', 'userUrl': '/user_details?userid=jfJF7wNEYW53_h1mE21ztg', 'partnerAlias': None, 'friendCount': 72, 'photoCount': 360, 'reviewCount': 349, 'eliteYear': None}",5,8/11/2012,"[{'src': 'https://s3-media0.fl.yelpcdn.com/bphoto/5DO-MZM-UiVRat9tYgT4wQ/300s.jpg', 'link': '/biz_photos/tiong-bahru-yong-tau-foo-singapore?reviewid=BicVxLUHSRvXsr_BlVc3vw&amp;select=5DO-MZM-UiVRat9tYgT4wQ', 'altText': 'Photo of Tiong Bahru Yong Tau Foo - Singapore, Singapore', 'width': 300, 'height': 300, 'caption': ''}]",Gracia O.,en,"This is an old coffee shop that at last count boasted four stalls. Viewing the clientele, it&amp;#39;s pretty plain to see that the yong tau foo is by far the most popular option. There&amp;#39;s only four permutations: soup or dry, big ($4) or small ($3). Only bee hoon is used, no other way about it. It&amp;#39;s Hakka style, so you get three kinds of ingredients - fish balls, fish paste wrapped in bean curd skin, and tofu - and the chilli and sweet sauce dip goes with the ingredients nicely. There&amp;#39;s an undeniably homely feel to a piping hot bowl of flavorful, soupy bee hoon with some soy beans nestled at the bottom in the middle of the day. Granted, you&amp;#39;d be drenched in sweat after the lunch hour, but resistance is futile. Come early as some of the items get sold out sooner than others. You wouldn&amp;#39;t want to be faced with the prospect of yong tau foo bee hoon turning into a tofu bee hoon lunch."
drinks-desserts-stall-smith-street-singapore,0jmAZwCwQN9ByyWsLx7khA,"{'link': '/user_details?userid=0jmAZwCwQN9ByyWsLx7khA', 'src': 'https://s3-media0.fl.yelpcdn.com/photo/ecJyQPetYFEOOCw5iwlyuA/60s.jpg', 'srcSet': 'https://s3-media0.fl.yelpcdn.com/photo/ecJyQPetYFEOOCw5iwlyuA/ms.jpg 1.67x,https://s3-media0.fl.yelpcdn.com/photo/ecJyQPetYFEOOCw5iwlyuA/120s.jpg 2.00x,https://s3-media0.fl.yelpcdn.com/photo/ecJyQPetYFEOOCw5iwlyuA/90s.jpg 1.50x,https://s3-media0.fl.yelpcdn.com/photo/ecJyQPetYFEOOCw5iwlyuA/168s.jpg 2.80x,https://s3-media0.fl.yelpcdn.com/photo/ecJyQPetYFEOOCw5iwlyuA/180s.jpg 3.00x', 'markupDisplayName': 'Steve A.', 'displayLocation': 'Austin, TX', 'altText': 'Steve A.', 'userUrl': '/user_details?userid=0jmAZwCwQN9ByyWsLx7khA', 'partnerAlias': None, 'friendCount': 24, 'photoCount': 344, 'reviewCount': 269, 'eliteYear': None}",5,9/2/2012,"[{'src': 'https://s3-media0.fl.yelpcdn.com/bphoto/p_WJtec80QK9pWdQaM7foQ/180s.jpg', 'link': '/biz_photos/drinks-desserts-stall-smith-street-singapore?reviewid=Uq4JhLPy7JqxOw_5HqPxgA&amp;select=p_WJtec80QK9pWdQaM7foQ', 'altText': 'Photo of Drinks/Desserts Stall Smith Street - Singapore, Singapore', 'width': 180, 'height': 180, 'caption': ''}, {'src': 'https://s3-media0.fl.yelpcdn.com/bphoto/vyy3hhtS1hKHF_Gyx2DLPQ/180s.jpg', 'link': '/biz_photos/drinks-desserts-stall-smith-street-singapore?reviewid=Uq4JhLPy7JqxOw_5HqPxgA&amp;select=vyy3hhtS1hKHF_Gyx2DLPQ', 'altText': 'Photo of Drinks/Desserts Stall Smith Street - Singapore, Singapore', 'width': 180, 'height': 180, 'caption': ''}, {'src': 'https://s3-media0.fl.yelpcdn.com/bphoto/I-228jtrXbJXNQAlM_GYQw/180s.jpg', 'link': '/biz_photos/drinks-desserts-stall-smith-street-singapore?reviewid=Uq4JhLPy7JqxOw_5HqPxgA&amp;select=I-228jtrXbJXNQAlM_GYQw', 'altText': 'Photo of Drinks/Desserts Stall Smith Street - Singapore, Singapore', 'width': 180, 'height': 180, 'caption': ''}]",Steve A.,en,"I love, love, love, love this Drinks/Desserts stall. It&amp;#39;s got really good options - every thing&amp;#39;s fresh, and the varieties are just mind-boggling. They have great local stuff, like Water Chestnut, Coconut Juice and all the yummy local desserts, Cheng Teng, Soursop, Ice Kacang, etc.<br&gt;<br&gt;What I Love: It&amp;#39;s at a great location, very accessible. The service is great, and their Coconuts are really fresh and affordable - I think, $3? Which is really pretty okay. I&amp;#39;ve paid $5 in Changi Village - which is definitely kinda pricey. Their other drinks, Water Chestnut, Bandung, and canned options are also pretty affordable and tasty. Gotta try their Desserts - they are really, really, really yummy!! I usually ask them to make my Ice Kacang with just the Gula Melaka (Omg - I feel like having it RIGHT NOW!) and their Soursop, and other cold concoctions are all pretty good.<br&gt;<br&gt;What I Don&amp;#39;t Love: Absolutely nothing!! ;D"
cafe-football-singapore,AMexPsUO1CRpLm9g4qbojg,"{'link': '/user_details?userid=AMexPsUO1CRpLm9g4qbojg', 'src': 'https://s3-media0.fl.yelpcdn.com/photo/wzNBJNJGqqOBShRacPSLQw/60s.jpg', 'srcSet': 'https://s3-media0.fl.yelpcdn.com/photo/wzNBJNJGqqOBShRacPSLQw/ms.jpg 1.67x,https://s3-media0.fl.yelpcdn.com/photo/wzNBJNJGqqOBShRacPSLQw/120s.jpg 2.00x,https://s3-media0.fl.yelpcdn.com/photo/wzNBJNJGqqOBShRacPSLQw/90s.jpg 1.50x,https://s3-media0.fl.yelpcdn.com/photo/wzNBJNJGqqOBShRacPSLQw/168s.jpg 2.80x,https://s3-media0.fl.yelpcdn.com/photo/wzNBJNJGqqOBShRacPSLQw/180s.jpg 3.00x', 'markupDisplayName': 'Danny S.', 'displayLocation': 'Bukit Timah, Singapore, Singapore', 'altText': 'Danny S.', 'userUrl': '/user_details?userid=AMexPsUO1CRpLm9g4qbojg', 'partnerAlias': None, 'friendCount': 13, 'photoCount': 146, 'reviewCount': 52, 'eliteYear': None}",5,5/5/2017,[],Danny S.,en,A great place for food drinks (full bar) or coffee.  Great staff and atmosphere. They show all footbal games even early morning or late night.  <br&gt;The Aragosta pasta has awesome lobster type bugs. Super nice and I think only about 18 bucks. Pints are fairly priced at around $14. <br&gt;They also do good Pizza.
cafe-football-singapore,elaLkfhrp_1O5kDA7ssuwA,"{'link': '/user_details?userid=elaLkfhrp_1O5kDA7ssuwA', 'src': 'https://s3-media0.fl.yelpcdn.com/photo/fhJ-vmkQ98m6z0KP0pf8wA/60s.jpg', 'srcSet': 'https://s3-media0.fl.yelpcdn.com/photo/fhJ-vmkQ98m6z0KP0pf8wA/ms.jpg 1.67x,https://s3-media0.fl.yelpcdn.com/photo/fhJ-vmkQ98m6z0KP0pf8wA/120s.jpg 2.00x,https://s3-media0.fl.yelpcdn.com/photo/fhJ-vmkQ98m6z0KP0pf8wA/90s.jpg 1.50x,https://s3-media0.fl.yelpcdn.com/photo/fhJ-vmkQ98m6z0KP0pf8wA/168s.jpg 2.80x,https://s3-media0.fl.yelpcdn.com/photo/fhJ-vmkQ98m6z0KP0pf8wA/180s.jpg 3.00x', 'markupDisplayName': 'Shirley T.', 'displayLocation': 'Singapore, Singapore', 'altText': 'Shirley T.', 'userUrl': '/user_details?userid=elaLkfhrp_1O5kDA7ssuwA', 'partnerAlias': None, 'friendCount': 68, 'photoCount': 1206, 'reviewCount': 367, 'eliteYear': 2022}",3,8/8/2019,"[{'src': 'https://s3-media0.fl.yelpcdn.com/bphoto/CFfPqsdGt4LrbCXikMhZlg/180s.jpg', 'link': '/biz_photos/cafe-football-singapore?reviewid=de55kje5lDUaPFyjqHfHIQ&amp;select=CFfPqsdGt4LrbCXikMhZlg', 'altText': 'Photo of Cafe Football - Singapore, Singapore', 'width': 180, 'height': 180, 'caption': None}, {'src': 'https://s3-media0.fl.yelpcdn.com/bphoto/ZzVpWQYP6Skll3jOZiaq3Q/180s.jpg', 'link': '/biz_photos/cafe-football-singapore?reviewid=de55kje5lDUaPFyjqHfHIQ&amp;select=ZzVpWQYP6Skll3jOZiaq3Q', 'altText': 'Photo of Cafe Football - Singapore, Singapore', 'width': 180, 'height': 180, 'caption': None}, {'src': 'https://s3-media0.fl.yelpcdn.com/bphoto/NOO1lEvK6ch2UlRTt_hbcA/180s.jpg', 'link': '/biz_photos/cafe-football-singapore?reviewid=de55kje5lDUaPFyjqHfHIQ&amp;select=NOO1lEvK6ch2UlRTt_hbcA', 'altText': 'Photo of Cafe Football - Singapore, Singapore', 'width': 180, 'height': 180, 'caption': None}]",Shirley T.,en,"Located a little off the usual shopping hubs, Cafe Football has lots of space you can hold parties and even wedding receptions! Plenty of parking with added benefit that is also free! <br&gt;Food wise, there&amp;#39;s something for everyone that&amp;#39;s normal as cafe fare. <br&gt;To keep everyone occupied while waiting for food or to relax with your gang, there are games like dart boards and table soccer (of course)"
cafe-football-singapore,FZor-9ioTc3T4qjta6suSg,"{'link': '/user_details?userid=FZor-9ioTc3T4qjta6suSg', 'src': 'https://s3-media0.fl.yelpcdn.com/photo/8RnAMD594jbIu2jZrsuRlA/60s.jpg', 'srcSet': 'https://s3-media0.fl.yelpcdn.com/photo/8RnAMD594jbIu2jZrsuRlA/ms.jpg 1.67x,https://s3-media0.fl.yelpcdn.com/photo/8RnAMD594jbIu2jZrsuRlA/120s.jpg 2.00x,https://s3-media0.fl.yelpcdn.com/photo/8RnAMD594jbIu2jZrsuRlA/90s.jpg 1.50x,https://s3-media0.fl.yelpcdn.com/photo/8RnAMD594jbIu2jZrsuRlA/168s.jpg 2.80x,https://s3-media0.fl.yelpcdn.com/photo/8RnAMD594jbIu2jZrsuRlA/180s.jpg 3.00x', 'markupDisplayName': 'Keith W.', 'displayLocation': 'Singapore, Singapore', 'altText': 'Keith W.', 'userUrl': '/user_details?userid=FZor-9ioTc3T4qjta6suSg', 'partnerAlias': None, 'friendCount': 0, 'photoCount': 5, 'reviewCount': 5, 'eliteYear': None}",5,5/29/2019,[],Keith W.,en,This is a great place for early drinks or a casual meeting. Happy hour starts from 4pm to 7pm with $7 pints. Food is reasonably good and you can catch your football games here. Lots of free parking right in front but gets a bit crowded after 6pm. No many places like this near this area.
cafe-football-singapore,RYXYmpCCKFhpNv0ZemvEYQ,"{'link': '/user_details?userid=RYXYmpCCKFhpNv0ZemvEYQ', 'src': 'https://s3-media0.fl.yelpcdn.com/photo/nwd7ZRtTgEBbqOurws3lmg/60s.jpg', 'srcSet': 'https://s3-media0.fl.yelpcdn.com/photo/nwd7ZRtTgEBbqOurws3lmg/ms.jpg 1.67x,https://s3-media0.fl.yelpcdn.com/photo/nwd7ZRtTgEBbqOurws3lmg/120s.jpg 2.00x,https://s3-media0.fl.yelpcdn.com/photo/nwd7ZRtTgEBbqOurws3lmg/90s.jpg 1.50x,https://s3-media0.fl.yelpcdn.com/photo/nwd7ZRtTgEBbqOurws3lmg/168s.jpg 2.80x,https://s3-media0.fl.yelpcdn.com/photo/nwd7ZRtTgEBbqOurws3lmg/180s.jpg 3.00x', 'markupDisplayName': 'Isaac L.', 'displayLocation': 'Singapore, Singapore', 'altText': 'Isaac L.', 'userUrl': '/user_details?userid=RYXYmpCCKFhpNv0ZemvEYQ', 'partnerAlias': None, 'friendCount': 0, 'photoCount': None, 'reviewCount': 1, 'eliteYear': None}",1,4/29/2019,[],Isaac L.,en,"Unpresent services today at the Cafe, it is used to be my choice for lunch place with Biz assisate or friends to this cafe but today services Manager Yarn Tikhonova is really disappoitment.. We were being told off by her when we ask for assitant for taking photo during our lunch. Yarn has just walk away without giving any explanantion and with unpresnt attitude and avold to serve us. I was then speaking with her and she was telling me that she is not respobisble for clearing the table plate and that&amp;#39;s why making her angry. I dont quite undestand there is rule that manager are not allow to clear the table? Sadly that i am no longer recommend any person to this cafe."
