shop,userid,userinfo,rating,date,photos,username,language,text
platform-1094-singapore,0__4UW7FOOJS3jYBJOPj3Q,"{'link': '/user_details?userid=0__4UW7FOOJS3jYBJOPj3Q', 'src': 'https://s3-media0.fl.yelpcdn.com/photo/VkY2zJ5clLtfiMDsR-g8HA/60s.jpg', 'srcSet': 'https://s3-media0.fl.yelpcdn.com/photo/VkY2zJ5clLtfiMDsR-g8HA/ms.jpg 1.67x,https://s3-media0.fl.yelpcdn.com/photo/VkY2zJ5clLtfiMDsR-g8HA/120s.jpg 2.00x,https://s3-media0.fl.yelpcdn.com/photo/VkY2zJ5clLtfiMDsR-g8HA/90s.jpg 1.50x,https://s3-media0.fl.yelpcdn.com/photo/VkY2zJ5clLtfiMDsR-g8HA/168s.jpg 2.80x,https://s3-media0.fl.yelpcdn.com/photo/VkY2zJ5clLtfiMDsR-g8HA/180s.jpg 3.00x', 'markupDisplayName': 'Aida P.', 'displayLocation': 'Kailua, HI', 'altText': 'Aida P.', 'userUrl': '/user_details?userid=0__4UW7FOOJS3jYBJOPj3Q', 'partnerAlias': None, 'friendCount': 42, 'photoCount': 62, 'reviewCount': 58, 'eliteYear': None}",5,10/13/2018,"[{'src': 'https://s3-media0.fl.yelpcdn.com/bphoto/dFcGAPKGo9-A50CQoKyRCQ/180s.jpg', 'link': '/biz_photos/platform-1094-singapore?reviewid=wmtHdjstteNhsZ3fGlt07w&amp;select=dFcGAPKGo9-A50CQoKyRCQ', 'altText': 'Photo of Platform 1094 - Singapore, Singapore', 'width': 180, 'height': 180, 'caption': None}, {'src': 'https://s3-media0.fl.yelpcdn.com/bphoto/61TsluPBAcdSax00_My8tQ/180s.jpg', 'link': '/biz_photos/platform-1094-singapore?reviewid=wmtHdjstteNhsZ3fGlt07w&amp;select=61TsluPBAcdSax00_My8tQ', 'altText': 'Photo of Platform 1094 - Singapore, Singapore', 'width': 180, 'height': 180, 'caption': None}, {'src': 'https://s3-media0.fl.yelpcdn.com/bphoto/EjjsdTqeOOZti4NlSG9sYA/180s.jpg', 'link': '/biz_photos/platform-1094-singapore?reviewid=wmtHdjstteNhsZ3fGlt07w&amp;select=EjjsdTqeOOZti4NlSG9sYA', 'altText': 'Photo of Platform 1094 - Singapore, Singapore', 'width': 180, 'height': 180, 'caption': None}, {'src': 'https://s3-media0.fl.yelpcdn.com/bphoto/GFG7yH4r6uA6GRu-mvlE-w/180s.jpg', 'link': '/biz_photos/platform-1094-singapore?reviewid=wmtHdjstteNhsZ3fGlt07w&amp;select=GFG7yH4r6uA6GRu-mvlE-w', 'altText': 'Photo of Platform 1094 - Singapore, Singapore', 'width': 180, 'height': 180, 'caption': None}]",Aida P.,en,"I am so glad my friend told me about this hidden gem!!!! We took a cab here from Chinatown because we were not sure where it was, but it&amp;#39;s actually a short walk from a subway station, so take the subway to save on transportation expenses. <br&gt; <br&gt;We had the Hagrid&amp;#39;s Afternoon Tea and I am so glad we ordered it!  Everything on the menu was delicious. I have to admit that I wasn&amp;#39;t sure if the items would look exactly like it was on the menu because there are those places where the pictures in the menu are better then what you get and then there are those places where the pictures in the menu don&amp;#39;t do them justice. Well, these pictures represented exactly what we received! <br&gt;<br&gt;This is a perfect place for any &amp;#34;true&amp;#34; fan. Yes I say true because I have read reviews on here where they say that their friend didn&amp;#39;t realize it was a HP café. How are you a true fan and not notice this? Seriously!!!! From the menu, to the decorations, to the photo area, it all screams Harry Potter!!!!!  <br&gt;<br&gt;If you want to order the Hagrid&amp;#39;s Afternoon Tea, keep in mind that it starts at 2pm and it&amp;#39;s in limited quantities. Also, come with an appetite as it is a lot of food for 2 people. At least I think it&amp;#39;s a lot of food. My husband had the seafood menu items, and he said they tasted really good. I had the non-seafood menu items and it was so delicious! All the desserts were amazing! Though I did order some coffee to counteract the sweetness of the desserts. <br&gt;<br&gt;Overall, a must for any HP fan that is visiting Singapore!"
platform-1094-singapore,LK0zfxdI77wuBPh9uP9EBQ,"{'link': '/user_details?userid=LK0zfxdI77wuBPh9uP9EBQ', 'src': 'https://s3-media0.fl.yelpcdn.com/photo/gp1fd52fpOFImqndeJAJnQ/60s.jpg', 'srcSet': 'https://s3-media0.fl.yelpcdn.com/photo/gp1fd52fpOFImqndeJAJnQ/ms.jpg 1.67x,https://s3-media0.fl.yelpcdn.com/photo/gp1fd52fpOFImqndeJAJnQ/120s.jpg 2.00x,https://s3-media0.fl.yelpcdn.com/photo/gp1fd52fpOFImqndeJAJnQ/90s.jpg 1.50x,https://s3-media0.fl.yelpcdn.com/photo/gp1fd52fpOFImqndeJAJnQ/168s.jpg 2.80x,https://s3-media0.fl.yelpcdn.com/photo/gp1fd52fpOFImqndeJAJnQ/180s.jpg 3.00x', 'markupDisplayName': 'Lauren R.', 'displayLocation': 'New York, NY', 'altText': 'Lauren R.', 'userUrl': '/user_details?userid=LK0zfxdI77wuBPh9uP9EBQ', 'partnerAlias': None, 'friendCount': 45, 'photoCount': 326, 'reviewCount': 214, 'eliteYear': 2022}",5,5/30/2019,"[{'src': 'https://s3-media0.fl.yelpcdn.com/bphoto/Nl6C0NmVSCL3yMia7sPPog/180s.jpg', 'link': '/biz_photos/platform-1094-singapore?reviewid=DwHPkaiGC-Acf6THoRJ8Mg&amp;select=Nl6C0NmVSCL3yMia7sPPog', 'altText': 'Photo of Platform 1094 - Singapore, Singapore. chocolate cake', 'width': 180, 'height': 180, 'caption': 'chocolate cake'}, {'src': 'https://s3-media0.fl.yelpcdn.com/bphoto/ZzeAtJGCIbegN823hPdnZQ/180s.jpg', 'link': '/biz_photos/platform-1094-singapore?reviewid=DwHPkaiGC-Acf6THoRJ8Mg&amp;select=ZzeAtJGCIbegN823hPdnZQ', 'altText': 'Photo of Platform 1094 - Singapore, Singapore. brunch', 'width': 180, 'height': 180, 'caption': 'brunch'}, {'src': 'https://s3-media0.fl.yelpcdn.com/bphoto/oEH944ts1hYKyeoz6QatEw/180s.jpg', 'link': '/biz_photos/platform-1094-singapore?reviewid=DwHPkaiGC-Acf6THoRJ8Mg&amp;select=oEH944ts1hYKyeoz6QatEw', 'altText': 'Photo of Platform 1094 - Singapore, Singapore. chicken pesto spaghetti', 'width': 180, 'height': 180, 'caption': 'chicken pesto spaghetti'}]",Lauren R.,en,"I was a little skeptical at first because it kind of sounded gimmicky, but we had such a good experience here. The food was absolutely delicious. My friends got breakfast food that they really enjoyed (side note: I&amp;#39;m pretty sure they put truffle oil in their eggs, so just keep that in mind in case you don&amp;#39;t like truffle), while I got pasta with chicken and pesto. I was a little dismayed that they put lemon in it, as I personally do not like lemon at all, but it was still very good. The sauce was so creamy, and the plating was beautiful, as it was for the other meals. We also had a piece of chocolate cake that was amazing - it was rich, decadent, and moist. I split the cake with a friend, which was definitely a good idea because the food is quite filling here. One of my friends ordered Mr Lich&amp;#39;s Flaming Brew, which was an alcoholic drink that they light on fire by sprinkling what I think was cinnamon onto it. It was definitely a cool sight, though I&amp;#39;m not sure how it tasted. I&amp;#39;m not really one to go all out with themes like this, but my friends convinced me to wear the robes they had for each of the houses in Harry Potter, and it ended up being a fun touch. Overall had a great time and would definitely recommend for a weekend brunch spot."
platform-1094-singapore,yNQU9f5QdqS-AEY2Gj7KxA,"{'link': '/user_details?userid=yNQU9f5QdqS-AEY2Gj7KxA', 'src': 'https://s3-media0.fl.yelpcdn.com/photo/a1rP6WTVEkXM7mNaWdIpFA/60s.jpg', 'srcSet': 'https://s3-media0.fl.yelpcdn.com/photo/a1rP6WTVEkXM7mNaWdIpFA/ms.jpg 1.67x,https://s3-media0.fl.yelpcdn.com/photo/a1rP6WTVEkXM7mNaWdIpFA/120s.jpg 2.00x,https://s3-media0.fl.yelpcdn.com/photo/a1rP6WTVEkXM7mNaWdIpFA/90s.jpg 1.50x,https://s3-media0.fl.yelpcdn.com/photo/a1rP6WTVEkXM7mNaWdIpFA/168s.jpg 2.80x,https://s3-media0.fl.yelpcdn.com/photo/a1rP6WTVEkXM7mNaWdIpFA/180s.jpg 3.00x', 'markupDisplayName': 'Isis L.', 'displayLocation': 'Reno, NV', 'altText': 'Isis L.', 'userUrl': '/user_details?userid=yNQU9f5QdqS-AEY2Gj7KxA', 'partnerAlias': None, 'friendCount': 289, 'photoCount': 126, 'reviewCount': 68, 'eliteYear': None}",3,8/9/2017,"[{'src': 'https://s3-media0.fl.yelpcdn.com/bphoto/tMc03fSZIiB3MLdbC8PJMw/300s.jpg', 'link': '/biz_photos/platform-1094-singapore?reviewid=ZoglMJWXoYut3-S_Uv_K8Q&amp;select=tMc03fSZIiB3MLdbC8PJMw', 'altText': 'Photo of Platform 1094 - Singapore, Singapore', 'width': 300, 'height': 300, 'caption': None}]",Isis L.,en,"Harry Potter is my childhooood and coming to this place in all it&amp;#39;s entirety I had a lot of expectations! I saw this place in one of the Facebook videos being shared. I had an opportunity to go to Singapore and went directly here to see what the hype was all about! <br&gt;<br&gt;Singapore is a great place by the way and I love the country and its great food! <br&gt;<br&gt;Now going back here, the decor was amazing and they have costumes and wands and broomsticks you can wear to take the coolest pictures and videos with their food! I remember while waiting for our food and drinks, my friends and I had battles with the wands haha. <br&gt;<br&gt;I ordered the famous drink that lights up when sprinkled with cinnamon. It was the coolest thing I&amp;#39;ve ever done. It was particularly of course my favorite part in the restaurant. The drink itself was good and let me tell you that it&amp;#39;s an alcoholic drink. <br&gt;<br&gt;We ordered a lot of desserts since we ate from one of the hawk centers there. <br&gt;The food we got was why this place is only a three stars for me. <br&gt;<br&gt;I took out two because it was just not very good. I had so much expectations. I wanted it to be as magical in my mouth with the expensive price point. For one dish it was like $15-16 and so I was hoping it would be worth it. But it&amp;#39;s not. <br&gt;<br&gt;This restaurant just needs better food and more people will flock here especially since it&amp;#39;s Harry Potter, the business owners need to use that to their advantage and give their customers a more deserving magical and whimsical experience."
platform-1094-singapore,gm9MU9CqAfMXhrLvpPclQw,"{'link': '/user_details?userid=gm9MU9CqAfMXhrLvpPclQw', 'src': 'https://s3-media0.fl.yelpcdn.com/photo/uzw9qm39529Wg1hQCtLFTg/60s.jpg', 'srcSet': 'https://s3-media0.fl.yelpcdn.com/photo/uzw9qm39529Wg1hQCtLFTg/ms.jpg 1.67x,https://s3-media0.fl.yelpcdn.com/photo/uzw9qm39529Wg1hQCtLFTg/120s.jpg 2.00x,https://s3-media0.fl.yelpcdn.com/photo/uzw9qm39529Wg1hQCtLFTg/90s.jpg 1.50x,https://s3-media0.fl.yelpcdn.com/photo/uzw9qm39529Wg1hQCtLFTg/168s.jpg 2.80x,https://s3-media0.fl.yelpcdn.com/photo/uzw9qm39529Wg1hQCtLFTg/180s.jpg 3.00x', 'markupDisplayName': 'Stella L.', 'displayLocation': 'Monrovia, CA', 'altText': 'Stella L.', 'userUrl': '/user_details?userid=gm9MU9CqAfMXhrLvpPclQw', 'partnerAlias': None, 'friendCount': 580, 'photoCount': 2181, 'reviewCount': 510, 'eliteYear': None}",4,2/9/2017,"[{'src': 'https://s3-media0.fl.yelpcdn.com/bphoto/2gslXnDSgfTQIHMdIbsL1w/180s.jpg', 'link': '/biz_photos/platform-1094-singapore?reviewid=PTitOYkYtWjhX_KKQVIJ9A&amp;select=2gslXnDSgfTQIHMdIbsL1w', 'altText': 'Photo of Platform 1094 - Singapore, Singapore', 'width': 180, 'height': 180, 'caption': None}, {'src': 'https://s3-media0.fl.yelpcdn.com/bphoto/BVGHnsGlKxaM59uhcThm2A/180s.jpg', 'link': '/biz_photos/platform-1094-singapore?reviewid=PTitOYkYtWjhX_KKQVIJ9A&amp;select=BVGHnsGlKxaM59uhcThm2A', 'altText': 'Photo of Platform 1094 - Singapore, Singapore', 'width': 180, 'height': 180, 'caption': None}, {'src': 'https://s3-media0.fl.yelpcdn.com/bphoto/Y3FfvyhmFGEuMe5H2EN7GA/180s.jpg', 'link': '/biz_photos/platform-1094-singapore?reviewid=PTitOYkYtWjhX_KKQVIJ9A&amp;select=Y3FfvyhmFGEuMe5H2EN7GA', 'altText': 'Photo of Platform 1094 - Singapore, Singapore. Goblet of Fire aka Mr Lich&amp;#39;s Flaming Brew ($15)', 'width': 180, 'height': 180, 'caption': ""Goblet of Fire aka Mr Lich's Flaming Brew ($15)""}, {'src': 'https://s3-media0.fl.yelpcdn.com/bphoto/Ri6t19a5uEgbN4S2UEMSQA/180s.jpg', 'link': '/biz_photos/platform-1094-singapore?reviewid=PTitOYkYtWjhX_KKQVIJ9A&amp;select=Ri6t19a5uEgbN4S2UEMSQA', 'altText': 'Photo of Platform 1094 - Singapore, Singapore. Chocolate Peanut Butter Cake', 'width': 180, 'height': 180, 'caption': 'Chocolate Peanut Butter Cake'}]",Stella L.,en,"Located along 1094 Serangoon Road, lies a newly opened Harry Potter themed cafe. The moment you stepped in, you will be welcomed with brown decorated interior (brown chairs, brown wooden tables, brown wall tiles and etc...) that adds up to the theme. <br&gt;<br&gt;We asked for the signature drink and was told that it was on the menu, &amp;#34;Mr Lich&amp;#39;s Brewing Brew&amp;#34; ($15). When served, it is a cup of neon blue colored drink that looks like magic portion, which is actually made up of lime juice and Curacao liqueur. A spoon full of Barcardi 151 Rum, was then torched by the server before pouring it into the mixture. You will be given cinnamon powder to sprinkle for the sparkling effects. Abracadabraaaa boom!<br&gt;<br&gt;We ordered the 2 cakes that taste as good as they looks! The Lychee Cake has a very nice fruity lychee flavor, very fluffy and not too sweet. The Chocolate Peanut Butter Cake is interesting good, with a complex flavorful the first spoonful.<br&gt;<br&gt;Tips: <br&gt;~ Feel free to pick a few props from the side table when posing with your food and Goblet of Fire drink.  <br&gt;~ They accept reservations, call them in advance as they get pretty booked for dinner and on weekends.<br&gt;<br&gt;[009/100]"
platform-1094-singapore,X-dEv3zNKXms9udkuiVcbw,"{'link': '/user_details?userid=X-dEv3zNKXms9udkuiVcbw', 'src': 'https://s3-media0.fl.yelpcdn.com/photo/Iem0oP6cAMYQD2CjiEBSMA/60s.jpg', 'srcSet': 'https://s3-media0.fl.yelpcdn.com/photo/Iem0oP6cAMYQD2CjiEBSMA/ms.jpg 1.67x,https://s3-media0.fl.yelpcdn.com/photo/Iem0oP6cAMYQD2CjiEBSMA/120s.jpg 2.00x,https://s3-media0.fl.yelpcdn.com/photo/Iem0oP6cAMYQD2CjiEBSMA/90s.jpg 1.50x,https://s3-media0.fl.yelpcdn.com/photo/Iem0oP6cAMYQD2CjiEBSMA/168s.jpg 2.80x,https://s3-media0.fl.yelpcdn.com/photo/Iem0oP6cAMYQD2CjiEBSMA/180s.jpg 3.00x', 'markupDisplayName': 'Emilie A.', 'displayLocation': 'Fairfax, VA', 'altText': 'Emilie A.', 'userUrl': '/user_details?userid=X-dEv3zNKXms9udkuiVcbw', 'partnerAlias': None, 'friendCount': 257, 'photoCount': 453, 'reviewCount': 270, 'eliteYear': None}",4,11/2/2017,"[{'src': 'https://s3-media0.fl.yelpcdn.com/bphoto/2PVZc1kem4O4vIqqE5Qfrg/180s.jpg', 'link': '/biz_photos/platform-1094-singapore?reviewid=Gr3QzkYe93jir_YmuGLl2w&amp;select=2PVZc1kem4O4vIqqE5Qfrg', 'altText': 'Photo of Platform 1094 - Singapore, Singapore', 'width': 180, 'height': 180, 'caption': ''}, {'src': 'https://s3-media0.fl.yelpcdn.com/bphoto/_vp1q3blX2lRbA1tcxmBVw/180s.jpg', 'link': '/biz_photos/platform-1094-singapore?reviewid=Gr3QzkYe93jir_YmuGLl2w&amp;select=_vp1q3blX2lRbA1tcxmBVw', 'altText': 'Photo of Platform 1094 - Singapore, Singapore', 'width': 180, 'height': 180, 'caption': ''}, {'src': 'https://s3-media0.fl.yelpcdn.com/bphoto/xQVskzCeSitc8RvUZNkx2g/180s.jpg', 'link': '/biz_photos/platform-1094-singapore?reviewid=Gr3QzkYe93jir_YmuGLl2w&amp;select=xQVskzCeSitc8RvUZNkx2g', 'altText': 'Photo of Platform 1094 - Singapore, Singapore', 'width': 180, 'height': 180, 'caption': ''}, {'src': 'https://s3-media0.fl.yelpcdn.com/bphoto/MlF6bzylgJjC3WfaerHDsg/180s.jpg', 'link': '/biz_photos/platform-1094-singapore?reviewid=Gr3QzkYe93jir_YmuGLl2w&amp;select=MlF6bzylgJjC3WfaerHDsg', 'altText': 'Photo of Platform 1094 - Singapore, Singapore', 'width': 180, 'height': 180, 'caption': ''}]",Emilie A.,en,"This place is so adorable. We arrived pretty late at night and I was surprised to see diners dressed up in what appeared to be Harry Potter cosplay - but no, the cafe has outfits that you can wear to get in the spirit of things! The decor is so cute and very appropriately Hogwarts-like. Had I come in the daytime, I think the natural lighting would have made for some amazing pictures. <br&gt;<br&gt;We got the butterscotch ale, and though I&amp;#39;ve never been to the Wizarding World of Harry Potter, my friend who has said it tasted JUST like the butterbeer you can find there. It was delicious. <br&gt;<br&gt;The food was surprisingly good for a theme cafe. We got the confit chicken with pesto spaghetti and the pesto mayo pork ribs. Both were really well cooked, not too much pesto on either but enough to give you a could flavor. The pork ribs were super tender and the sides that came with it were delicious, very American-style like mashed potatoes and sweet corn. I loved it and that&amp;#39;s coming from an American mashed potato addict. <br&gt;<br&gt;The witch&amp;#39;s brew, although I didn&amp;#39;t try it, seems like it&amp;#39;s something you can&amp;#39;t miss here. I was excited to see another diner get it, and the flaming drink looks exactly like a potion from Harry Potter. If I have one regret it&amp;#39;s not trying that!"
platform-1094-singapore,LTn54LOt2eVWek1iTwDGMg,"{'link': '/user_details?userid=LTn54LOt2eVWek1iTwDGMg', 'src': 'https://s3-media0.fl.yelpcdn.com/photo/8sJIgxw3Gj5SG1FcAXJsMg/60s.jpg', 'srcSet': 'https://s3-media0.fl.yelpcdn.com/photo/8sJIgxw3Gj5SG1FcAXJsMg/ms.jpg 1.67x,https://s3-media0.fl.yelpcdn.com/photo/8sJIgxw3Gj5SG1FcAXJsMg/120s.jpg 2.00x,https://s3-media0.fl.yelpcdn.com/photo/8sJIgxw3Gj5SG1FcAXJsMg/90s.jpg 1.50x,https://s3-media0.fl.yelpcdn.com/photo/8sJIgxw3Gj5SG1FcAXJsMg/168s.jpg 2.80x,https://s3-media0.fl.yelpcdn.com/photo/8sJIgxw3Gj5SG1FcAXJsMg/180s.jpg 3.00x', 'markupDisplayName': 'Bianca L.', 'displayLocation': 'New York, NY', 'altText': 'Bianca L.', 'userUrl': '/user_details?userid=LTn54LOt2eVWek1iTwDGMg', 'partnerAlias': None, 'friendCount': 201, 'photoCount': 59, 'reviewCount': 46, 'eliteYear': None}",4,3/12/2019,"[{'src': 'https://s3-media0.fl.yelpcdn.com/bphoto/NOhH-t1xTsOK7Hw9fX5wVA/180s.jpg', 'link': '/biz_photos/platform-1094-singapore?reviewid=z5T8oSkSImuUNrKFLwUmbg&amp;select=NOhH-t1xTsOK7Hw9fX5wVA', 'altText': 'Photo of Platform 1094 - Singapore, Singapore', 'width': 180, 'height': 180, 'caption': None}, {'src': 'https://s3-media0.fl.yelpcdn.com/bphoto/zkHwxax5QDEVcJK38_6Qfg/180s.jpg', 'link': '/biz_photos/platform-1094-singapore?reviewid=z5T8oSkSImuUNrKFLwUmbg&amp;select=zkHwxax5QDEVcJK38_6Qfg', 'altText': 'Photo of Platform 1094 - Singapore, Singapore', 'width': 180, 'height': 180, 'caption': None}, {'src': 'https://s3-media0.fl.yelpcdn.com/bphoto/qkOqSzNfpsO2HIheLbR-4g/180s.jpg', 'link': '/biz_photos/platform-1094-singapore?reviewid=z5T8oSkSImuUNrKFLwUmbg&amp;select=qkOqSzNfpsO2HIheLbR-4g', 'altText': 'Photo of Platform 1094 - Singapore, Singapore', 'width': 180, 'height': 180, 'caption': None}]",Bianca L.,en,Very cute and quaint cafe with Harry Potter themed food and decor. I recommend this place is you have any leisure time to spare. We enjoyed this very cool and fun blue cocktail that went up in flames. It was also fun to dress up in robes &amp;amp; take some fun photos. It&amp;#39;s bit off the beaten path so make sure to come if you have time to spare.
platform-1094-singapore,elaLkfhrp_1O5kDA7ssuwA,"{'link': '/user_details?userid=elaLkfhrp_1O5kDA7ssuwA', 'src': 'https://s3-media0.fl.yelpcdn.com/photo/fhJ-vmkQ98m6z0KP0pf8wA/60s.jpg', 'srcSet': 'https://s3-media0.fl.yelpcdn.com/photo/fhJ-vmkQ98m6z0KP0pf8wA/ms.jpg 1.67x,https://s3-media0.fl.yelpcdn.com/photo/fhJ-vmkQ98m6z0KP0pf8wA/120s.jpg 2.00x,https://s3-media0.fl.yelpcdn.com/photo/fhJ-vmkQ98m6z0KP0pf8wA/90s.jpg 1.50x,https://s3-media0.fl.yelpcdn.com/photo/fhJ-vmkQ98m6z0KP0pf8wA/168s.jpg 2.80x,https://s3-media0.fl.yelpcdn.com/photo/fhJ-vmkQ98m6z0KP0pf8wA/180s.jpg 3.00x', 'markupDisplayName': 'Shirley T.', 'displayLocation': 'Singapore, Singapore', 'altText': 'Shirley T.', 'userUrl': '/user_details?userid=elaLkfhrp_1O5kDA7ssuwA', 'partnerAlias': None, 'friendCount': 68, 'photoCount': 1206, 'reviewCount': 367, 'eliteYear': 2022}",3,4/21/2017,"[{'src': 'https://s3-media0.fl.yelpcdn.com/bphoto/nXYYqbyunrx1aEbnIS8oJA/180s.jpg', 'link': '/biz_photos/platform-1094-singapore?reviewid=hMEP6dkGHpJPoSFaq3c_Fw&amp;select=nXYYqbyunrx1aEbnIS8oJA', 'altText': 'Photo of Platform 1094 - Singapore, Singapore', 'width': 180, 'height': 180, 'caption': None}, {'src': 'https://s3-media0.fl.yelpcdn.com/bphoto/X0fPko84aWDFkG1WLXTNqQ/180s.jpg', 'link': '/biz_photos/platform-1094-singapore?reviewid=hMEP6dkGHpJPoSFaq3c_Fw&amp;select=X0fPko84aWDFkG1WLXTNqQ', 'altText': 'Photo of Platform 1094 - Singapore, Singapore. Giant&amp;#39;s breakfast', 'width': 180, 'height': 180, 'caption': ""Giant's breakfast""}, {'src': 'https://s3-media0.fl.yelpcdn.com/bphoto/i9dk4GKTUrjZOHS_auri3A/180s.jpg', 'link': '/biz_photos/platform-1094-singapore?reviewid=hMEP6dkGHpJPoSFaq3c_Fw&amp;select=i9dk4GKTUrjZOHS_auri3A', 'altText': 'Photo of Platform 1094 - Singapore, Singapore. Spam fries', 'width': 180, 'height': 180, 'caption': 'Spam fries'}, {'src': 'https://s3-media0.fl.yelpcdn.com/bphoto/Mg5WJ-Fs2Ib3h2r-6JMqow/180s.jpg', 'link': '/biz_photos/platform-1094-singapore?reviewid=hMEP6dkGHpJPoSFaq3c_Fw&amp;select=Mg5WJ-Fs2Ib3h2r-6JMqow', 'altText': 'Photo of Platform 1094 - Singapore, Singapore. Cauldron of mushroom soup', 'width': 180, 'height': 180, 'caption': 'Cauldron of mushroom soup'}]",Shirley T.,en,"If not for the theme, my expectations would have been much lower. Food-wise the menu is the usual brunch and cafe fare with a twist. You can also play dress up with the ropes for Gryffindor, Slytherin, Ravenclaw and Hufflepuff. Interesting drinks as potions. It would have been better if the staff were more upbeat or dressed to fit the theme instead of just black tee shirts. Wouldn&amp;#39;t mind coming back to try the dinner menu."
platform-1094-singapore,U-YF8SK97oCWyHUVq2pK4Q,"{'link': '/user_details?userid=U-YF8SK97oCWyHUVq2pK4Q', 'src': 'https://s3-media0.fl.yelpcdn.com/photo/doVBundK2efOME0gboC-tg/60s.jpg', 'srcSet': 'https://s3-media0.fl.yelpcdn.com/photo/doVBundK2efOME0gboC-tg/ms.jpg 1.67x,https://s3-media0.fl.yelpcdn.com/photo/doVBundK2efOME0gboC-tg/120s.jpg 2.00x,https://s3-media0.fl.yelpcdn.com/photo/doVBundK2efOME0gboC-tg/90s.jpg 1.50x,https://s3-media0.fl.yelpcdn.com/photo/doVBundK2efOME0gboC-tg/168s.jpg 2.80x,https://s3-media0.fl.yelpcdn.com/photo/doVBundK2efOME0gboC-tg/180s.jpg 3.00x', 'markupDisplayName': 'Pearl K.', 'displayLocation': 'Saddle River, NJ', 'altText': 'Pearl K.', 'userUrl': '/user_details?userid=U-YF8SK97oCWyHUVq2pK4Q', 'partnerAlias': None, 'friendCount': 645, 'photoCount': 168, 'reviewCount': 187, 'eliteYear': None}",3,5/1/2017,[],Pearl K.,en,"Such a cute theme! And yet, disappointing in execution.<br&gt;<br&gt;I came to Platform 1094 for the ever-famous cauldron drink and was thrilled to find a costume rack complete with robes, hats, wands and stuffed animals to complete the experience. This feature was the extent of the magical experience. While I loved the small touches, like the wooden stag chairs, the cauldron drink we received was less than impressive, beyond the sparks that fly when you dash it with cinnamon.<br&gt;<br&gt;It was great to visit once, but definitely won&amp;#39;t be making a repeat appearance in my itinerary."
platform-1094-singapore,g-P058qnhLVXnEZYKBaVug,"{'link': '/user_details?userid=g-P058qnhLVXnEZYKBaVug', 'src': 'https://s3-media0.fl.yelpcdn.com/photo/36HFEbP1tXDRdCmQFx-DaA/60s.jpg', 'srcSet': 'https://s3-media0.fl.yelpcdn.com/photo/36HFEbP1tXDRdCmQFx-DaA/ms.jpg 1.67x,https://s3-media0.fl.yelpcdn.com/photo/36HFEbP1tXDRdCmQFx-DaA/120s.jpg 2.00x,https://s3-media0.fl.yelpcdn.com/photo/36HFEbP1tXDRdCmQFx-DaA/90s.jpg 1.50x,https://s3-media0.fl.yelpcdn.com/photo/36HFEbP1tXDRdCmQFx-DaA/168s.jpg 2.80x,https://s3-media0.fl.yelpcdn.com/photo/36HFEbP1tXDRdCmQFx-DaA/180s.jpg 3.00x', 'markupDisplayName': 'Alyssa Chloe T.', 'displayLocation': 'Singapore, Singapore', 'altText': 'Alyssa Chloe T.', 'userUrl': '/user_details?userid=g-P058qnhLVXnEZYKBaVug', 'partnerAlias': None, 'friendCount': 101, 'photoCount': 128, 'reviewCount': 82, 'eliteYear': None}",3,2/24/2017,[],Alyssa Chloe T.,en,"Being an incredibly huge Harry Potter fan, having a themed Harry Potter cafe really excited me. Unfortunately, I must admit that it was pretty underwhelming. <br&gt;<br&gt;For a themed cafe, I expected more; to see the theme being reflected in the food, the drinks, the decor, etc. Ambience wise, the only thing close to Harry Potter were the brick plastered walls... they had props, but there wasn&amp;#39;t enough to go around (&amp;amp; also, they only had gryffindor robes :/). <br&gt;<br&gt;To give them credit, they did try to create &amp;#34;potions&amp;#34; which lit up, but again, that was only one drink (their signature)  <br&gt;<br&gt;Taste wise, everything was pretty standard; drinks needed more alcohol,"
